"ranking","Chinese.origin.data","Baidu.translated.data","Baidu.English.sentiment.analysis.postitive.probability.base.on.Baidu.translated.data."
10,"几度昏昏欲睡。偶尔一两句台词能干笑那么几声。如果旨在黑色幽默讥讽一下当下几大现象和事件未免拍的也太难看了点。好歹这也是电影，不是网络短片或小品。用甲方乙方里已经用过的旧瓶里也没装新酒，充斥着廉价的网络段子，容易让人觉得是在看爸爸去哪儿这种骗一把钱的电视节目改成的电影。不好看。","A few sleepy sleepiness. Occasionally one or two lines can then Ganxiao a few times. It is too much to be able to sneer at some of the current phenomena and events with a black humour. It's also a movie, not a short film or a short film. By Party A Party B has been used in the old did not install the new wine is full of cheap network scripts, easy to make people feel in where to go to see my father this cheat money into TV movie. Disgraceful。",0.130704
10,"分几次终于看完了。。这部电影究竟想表达个肾嘛？？圆梦之后最后出现个道歉篇是什么JB立意？？？","Several times have finally finished. Does the film want to express a kidney?? What is the end of an apology after a dream? What is JB's intention???",0.156327
10,"到底想表达什么呢？甲方乙方小品版？失望！！！","What do you want to express? Party B's minor edition? Disappointment！！！",0.154488
10,"前几天陪朋友去看，到最后什么鬼道歉我就崩坏了，本来睡得挺好的，被这矫情的直接冲到厕所各种干呕，冯小刚这个垃圾，真的白瞎了！","A few days ago to accompany a friend to see, what I have to apologize to the last ghost collapse, had slept well, this is being directly rushed to the toilet all this rubbish retch, Feng Xiaogang, really white blind!",0.232808
10,"十足的烂片。被恶心到了。","A bad movie. It's nauseous.",0.268416
10,"原地踏步还以为观众会屁颠屁颠乐呵捧场 自毁招牌 愚昧大众。。你以为你换个名 披个狗皮就不认识你是甲方乙方了？","Piaffe thought the audience will Pidianpidian Lehe join self destruct signs public ignorance.. Do you think you change a name with a dog does not know you are a party B?",0.293516
10,"原本我以为是网友言论太偏激 结果它真是这么傻逼。歌好听也没法，一星给定了。看完我整个心情都down了。说不出什么味道。","I think that is too extreme netizen comments it is so idiot. There is no way for a song to hear, one star is given. After seeing my whole mood, I've been down. I can't say anything.",0.292526
10,"去看之前看到很多差评心想不会这么差吧，看了个苗圃莫名其妙的开头心想完了，结果。。。。尼玛的真的这么差啊！","It's not so bad to see a lot of bad reviews before you go and see the inexplicable beginning of the nursery. Nima's really so bad!",0.30994
10,"又一部刷新下限的烂片，比富二代的烂仍过之而无不及。小钢炮为办春晚，提前拿私人定制练手，其敬业精神令人赞叹。","A refresh limit bit, than the rich two generation is still worse than bad. Oh to do the show, to take private custom hand, its dedication is amazing.",0.31034
10,"又他妈的零星嘛？？？！！！","And the fucking sporty???!!!",0.286085
10,"受不了！！！！！！！！！！！！！！！！！！！！！！！！！！！！！！！！！！！！！！！！！！！！！！！！！！！！！！！！！！！！！！！！！！","Cannot bear sth！！！！！！！！！！！！！！！！！！！！！！！！！！！！！！！！！！！！！！！！！！！！！！！！！！！！！！！！！！！！！！！！！！",0.283227
10,"吃老本 ，就因为你是大导演？","Laurels, just because you are a director?",0.291201
10,"和好久之前的甲方乙方没得比","And a long time ago, Party A Party B has no comparison",0.292475
10,"和甲方乙方不是一个级别的，故事太烂了，完全没有逻辑性可言，完全是侮辱观众智商。冯小刚，你可以下课了。","Party A and Party B is not a class, the story sucks, no logic at all, is an insult to the audience iq. Feng Xiaogang, you can go to class.",0.213497
10,"哈 为了响应冯导对豆瓣大尾巴狼们的号召 我也来评一回没看过的电影 冯导说是为了迎合人民群众的欣赏水平 实际上不就是水平有限 只能换一种方式回到甲方乙方的年代么 抨击影评人和豆友？先拍好你的电影再说教吧 呵呵","Kazakhstan in response to Pingdao to bean big tail wolf call I have to comment a back no movie he said is to cater to people's appreciation level is actually limited level of only one way back to the Party A Party B's what attacked critics and friends of beans? First take your film and talk about it",0.3081
10,"哈哈哈哈，不仅仅是烂的原因吧，让人焦虑了都。一个司机花那么多钱就实现这么一个破白日梦，这样的故事你告诉我是写实，讽刺现实哈哈哈哈，怎么可能！！","Hahaha, not only the bad reason, it is anxious. A driver spends so much money to achieve such a daydream, such a story you tell me is realistic, satirical reality ha ha ha ha ha ha ha, how possible!",0.181727
10,"哎。。 默默的翻出甲方乙方再怀恋一下我以前尊敬的冯导，然后对着这部片子说一句，能TM退票吗？","Oh. Silently pulls out again before my party B Miss dear Pingdao, then to the movie say, can TM refund?",0.248267
10,"喜剧又不好笑又要讲大道理讲的 大道理又讲的那么显而易见。真是成全冯小刚恶心观众。看完第一个小故事就不想看下去了。一个字烂。","It is so obvious that comedy is not too funny to speak of the big truth. It's a nauseous audience of Feng Xiaogang. I don't want to see the first little story. A word is rotten.",0.271361
10,"四个段子＋一个公益广告，你好意思叫电影？还什么平均一分钟笑一次，妈的，全场笑声0次，稀稀拉拉的笑声也就平均20分钟一次，好意思叫喜剧片吗？","Four paragraph + a public service advertisement, how do you mean the movie? What is the average one minute smile again, mom, the laughter 0 times a laughter on average every 20 minutes, I ask a comedy?",0.286195
10,"四个零碎的片段，不知何是真是内核，笑料不好笑，能量也不正，限于豆瓣打分的区间，所以。。。。","Four fragments, I do not know what is real is the kernel, joke is not funny, energy is not positive, limited to the interval watercress scoring, so....",0.289557
10,"因为有之前的三T公司和甲方乙方，所以这要是别人拍出来东施效颦的，也就给2星了，处女作还能考虑给个3星半。冯导，您都要弄着村晚在年夜饭出现了，贺岁片拍成这样，这年让人怎么期待啊？","Because before the three T company and Party B, so that if people take out dongshixiaopin, also to the 2 star, can offer a half star debut. Feng guide, you have to make the village night in the evening meal appeared, new year's film was made so, how do you look forward to this year?",0.281176
10,"国产不抱希望，但是也不能烂成这样。几段微电影拼成一步大电影冯小刚胆子也真大。电影还真是暴利行业。结尾突然扯到大自然，给大自然道歉……说教性质这么明显，又不是让你拍科教片。结尾恭贺新年什么的也他妈和狗皮膏药一样！","There is no hope for homemade, but it can't be so bad. It's really big for a few films to make a big movie, Feng Xiaogang. The film is really a profiteering industry. The end suddenly tore into nature and apologized to nature... The nature of preaching is so obvious that it is not for you to take pictures of science and education. At the end of the new year is what his mother and dogskin plaster!",0.274696
10,"垃圾 中的站斗机。可以 给零分 吗","A bucket machine in the garbage. Can you give it a zero?",0.229693
10,"垃圾啊，你怎么拍的这么恶心，你家里人知道么？","Garbage, how do you make so much nausea, do you know what people do in your family?",0.273921
10,"多么庆幸没去电影院看，真不明白今年12月的电影档这么不给力。即使甲方乙方不存在在我的记忆里，私人定制也逃不出2星以下的命运。","How fortunate not to go to the cinema to see, really do not understand this December movie so suck. Even if Party A does not exist in my memory, private customization can not escape the fate of less than 2 stars.",0.268246
10,"大杂烩。说是喜剧，看不出哪儿好笑。委实达到了成全导儿和编剧，恶心了观众。","A hodgepodge. It is a comedy that can't see where it is funny. Is to guide and help the audience screenwriter, nausea.",0.299848
10,"大烂片，三个小品的堆砌，让人不敢想象这是冯小刚导演的作品","A flop, piling up three pieces, let a person dare not imagine that this is Feng Xiaogang's works",0.275628
10,"大烂片，要不是陪父母，倒贴都不看。剧情一塌糊涂，完全是生拼硬凑起来的，连冯大导最后都说这是随便拍出来的，这不是欺骗观众么，当傻子忽悠啊！成龙又说了，他再烂的片子都有人看，犯贱！","A flop, not to accompany their parents, do not see the upside down. The plot is all in a mess. It's all hard to get together. Even Feng Feng guide finally said that it was taken out at random. This is not deceiving the audience. Jackie Chan said, his films were bad people,!",0.245192
10,"大烂片儿！！！！！","A large piece of rotten!!!!!",0.25157
10,"太TM垃圾的一出戏了，看一半就睡觉去了，就李小璐有点看头（还是脱了才有），情节无聊，生搬硬套，结尾还TM的抄网上的无聊点子，坑爹啊~~","A play too TM garbage, half went to sleep, Li Xiaolu something (or off only), the plot is boring, mechanically, at the end of the TM copy online boring ideas, cheating ah ~ ~",0.274203
10,"太恶心了，无头无尾，完全没情节。最后莫名其妙又宣传环保。","It's so disgusting, no head, no tail, no plot. At last, it is indescribable and environmentally friendly.",0.291481
10,"太让人失望了，真心的一部烂片，害得我们一群人兴冲冲地跑到电影院！！后面冯小刚是不是找不到拍的了！！！","Disappointing, really a bad movie, so we have a group of people excitedly went to the cinema!! Feng Xiaogang is not going to be able to find it!!!",0.214254
10,"好久没看过这么差的电影了，这也就是没有特别差0星的选项。想到很多人花钱去看，我真心觉得他们的钱花的太冤枉了。冯小刚第一时间该因为这破片子跟消费者道歉","I haven't seen such a bad movie for a long time, that is, there is no special 0 - Star option. Thinking of a lot of people to spend money to see, I really think their money is too bad. Feng Xiaogang should have apologized to consumers for the first time.",0.2861
10,"好好的一个有才的导演，怎么就这么不接地气了呢?恶心别人的同时真的成全了自己么?烂片一部，没得挑剔","A talented good director, so not a down to earth? Nausea and others at the same time really be yourself? A bad film, not picky",0.188786
10,"好想打负分滚粗！！！！以往再烂的电影都还可以吐一下槽，这部电影完全不想吐槽，只想咆哮！！！！！！！！这部电影真的贺岁片吗？不是来愚弄观众的，秀智商下限的？","I want to make a big blow!!!!! The past rotten movies can also spit a slot, this film does not want to spit, just want to roar!!!!!!!!! Is this movie really a new year's movie? Is it not to fool the audience, the lower limit of the show IQ?",0.217385
10,"如果有负分，我真想评一个负分出来，这片子到底想说什么，前面胡编乱凑的剧情，基本无笑点，后面又想上升到一个高度讲环保，毫无逻辑毫无剧情，除了几个演员演的还行外，其他基本不能看，冯小刚你就这样子砸自己的招牌，曾经的黑色幽默就这么搞！！？","If there is a negative, I really want to comment on a negative points out, this film really want to say what, in front of wild compact plot, no bursting point, back to rising to a height of about environmental protection, there is no logic no story, except for a few actors OK, other basic cannot see Feng Xiaogang do you like this drop their signs, once the black humor is done!!?",0.16638
10,"如果甲方乙方值8分，这片最多只能值0分。","If Party A's Party B is worth 8 points, this piece can only be worth 0 points at most.",0.263793
10,"如果能打负分，我真想给负一百分，感觉冯小刚是来羞辱所有的观众的，反讽社会上所有事，讽刺官员在其位不谋其政。一个喜剧导演拍这么个烂片，才是最大的不负责任，讽刺自己还差不多。为了当年看过的集结号，这么多年都去电影院支持冯小刚，真觉得被狠狠的涮了一把！！！","If you can play a negative score, I really want to give negative one hundred points, Feng Xiaogang is feeling insulted all the audience, all social satire irony, officials in charge. A comedy director to shoot a movie, is the biggest irresponsible and sarcastic almost. For years to see the collection number, so many years to go to the cinema to support Feng Xiaogang, really feel ruthlessly rinsed!!!!",0.296477
10,"如果说去看小时代是期待吃个包子结果吃了个馒头 ，那去看私人定制就是期待吃个汉堡结果吃了坨屎","If you want to see a little time to eat a steamed bun and eat a steamed bun, to see a personal custom is to eat a hamburger and eat a piece of shit.",0.248807
10,"学鲁迅？学姜文？一坨五彩缤纷的黑黑我大中国的屎","Learn Lu Xun? Learn Jiang Wen? A lump of colourful black and black my big Chinese shit",0.297927
10,"完全就是甲方乙方啊，还有最后那一段我想问跟这个电影有任何联系吗","Is it all Party A, Party B, and the last paragraph that I want to ask about the movie?",0.287851
10,"完全就是甲方乙方的换皮之作，毫无新意，对白陈旧，桥段老套，看完有种回到九十年代的感觉，坑爹大作！！！","Party A Party B is entirely for skin to make, no new, old ideas, old white, after a return to 90s feeling for cheating!!!",0.154418
10,"完全就甲方乙方的奢华版 不过甲方乙方是经典 这个是眼子 貌似就第一个故事还可以 最后结尾那 又感人又醒世 但真心跟整部片子基调不符好吗 不理解为什么要拍那些","Completely Party A Party B Party A Party B is a classic luxury version but this is eye looks like on the first story can also be at the end of the world but really moving and the movie does not match with the tone you don't understand why those pictures",0.219569
10,"导演你到底想表达什么     我不是你的饭   所以就不捧场了","What do you want to say about what you want to express? I'm not your meal, so I won't take it.",0.302282
10,"小刚，我一般不给一星的。听说你在微博上向观众开炮了，这么说吧，你和张艺谋中间差不多隔了七八百个张亮。什么？张亮是厨子？什么？你居然不是厨子？？？","Xiao Gang, usually I don't give a star. I heard you shot the audience on micro-blog. So, you're almost seven hundred or eight hundred Zhang Liang apart from Zhang Yimou. What? Is Zhang Liang the cook? What? You're not the cook???",0.266479
10,"小刚有点倚老卖老骗钱了。","A little yilaomailao Xiaogang scam.",0.311659
10,"小时候学邯郸学步这个成语时我打死也不信还有这样的人，结果今天发现原来确有其事。三个小品加一个诗朗诵，乱炖成一锅浆糊，尤其是结尾到底是什么玩意。如果写一句话当影评，很遗憾，徐峥2:0冯小刚。","When learning in this idiom I just won't believe there is such a person, the original is found today. Three pieces with a poem recitation, Luandun into a paste, especially at the end of what is. If you write a word as a film review, it's a pity that Xu Zheng 2:0 Feng Xiaogang.",0.30433
10,"小钢炮已经才尽了？又把甲方乙方拿出来翻拍？而且翻拍的那么烂，简直是毁掉自己之前的经典之作。","The cannon's sold out? And Party A Party B to take out the remake? And the remake was so rotten that it was a classic work before it was destroyed.",0.202687
10,"就想快餐一样，几个短篇拼成一部电影，衔接都没有，期间还不忘抱领导大腿。疯导就想说自己是大雅是艺术，群众是愚昧是三俗？你这么努力的抱大腿，领导知道么","Just like fast food, a few short pieces of film, a film, there is no connection, during the period still do not forget to hold the leadership of the thigh. The guide will want to say that he is crazy, is art, people are ignorant is vulgar? Do you work so hard to hold your thighs?",0.233526
10,"就算已经当成重制版甲方乙方...就算冯小刚自己都说还人情之作了...夸张点儿真是天堂烂到地狱的感觉...","Even if it has been regarded as a heavy production of Party A Party B... Even if Feng Xiaogang himself said it was a human being... The exaggeration was the feeling of heaven rotting to hell...",0.276085
10,"尼玛，本来还想给两星，看到第四段果断给最差评，说教可以，但麻烦有点故事带入好吗？这样突然搞个道歉日你认为感动得了谁？跟四个人的公司又有半毛钱关系？成全别人恶心自己？我看是成全小缸，恶心观众吧","Fuck, wanted to give two stars, see paragraph fourth of the most decisive to the bad, but a little trouble to preach, the story to me? Who do you think is touched by a sudden apology? Is there a half - money relationship with the company of four people? All the others are disgusting yourself? I think it's a small jar. It's nauseous.",0.308355
10,"尼玛的垃圾！恶心版甲方乙方？爆乳抢票房？脑残的对白！脑残的表演！真他妈的恶心你了！！！","Nima's garbage! Party B, Party A of nausea? Breasted box office? Idiotic dialogue! Idiotic! It's so fucking sick of you!!!",0.149554
10,"尼玛豆瓣怎么不能打负分！！浪费哥宝贵的时间！！！","How can n't be able to make a negative score! Waste precious time!!!",0.301186
10,"屎一样的电影。","A shit like movie.",0.284628
10,"巨没劲，完全是零笑点，尼玛这叫喜剧？？","Great, it's just a zero smile. NMA's called a comedy??",0.215858
10,"店要这么开不一定关张，你这么拍一定得滚蛋。人们向不向自然道歉先不说，冯小刚你丫得向电影道歉。    2/10","So open shop to not shut down, so you have to take off. People don't apologize to nature before they say, Feng Xiaogang you have to apologize to the movie. 2/10",0.261014
10,"强烈建议有负分来直面著名大导演的中年危机","A midlife crisis that strongly suggests a negative point to a famous big director",0.270277
10,"当年的甲方乙方，有话好好说还是挺有范的，可后来什么非诚勿扰，1942完全就是侮辱观众吗，私人定制再一次创造了烂片中的下线","Party A Party B of the year, has something to say or a fan, then what is an insult to the audience If You Are The One, 1942, private custom once again created a movie in the line",0.308695
10,"很久没看到这种刷新下限的电影了，以为抄几个网上的段子就是大师吗？","I haven't seen such a movie for a long time. Do you think it's a master to copy a few online passages?",0.311978
10,"很难得的贺岁片，难得这么难看。","A rare new year's film, rarely so ugly.",0.232829
10,"怎么可以这么烂？！","How can it be so bad?!",0.309847
10,"想说的太多，胡闹得太多，相当的一般。顽主→甲方乙方→私人定制，沦为了很长的小品的拼凑，这是为无聊春晚的预热么？Ps:时间都去哪儿了……对不起","Too much to say, too much nonsense, quite common. Wanzhu, Party B, private custom, in order to become a patchwork of long pieces, this is what spring preheating boring? Where's the Ps: time... I'm sorry.",0.301087
10,"想起了当你的甲方乙方。。冯氏喜剧一去不返了吗","Reminiscent of Party B when you are Party A. Feng's comedy over it",0.296635
10,"懒这一个字还不够嘛？？？？！！！！","Laziness is not enough???!!!!!",0.228927
10,"成全票房，恶心观众。甲方乙方，免费看经典。私人定制，掏钱看烂片。","A box office, a nauseous audience. Party B, Party B, see the classics free of charge. Private custom, pay to watch movie.",0.192805
10,"我只想知道这个真的是电影吗？我真的感觉到了深深地讽刺。！没有丝毫看点的烂片俗片，差点睡着了。.真的是成全了别人，恶心了自己啊！冯导你成功了。呵呵","I just want to know that this is really a movie? I really felt a deep sarcasm. No piece of bad vulgar aspect, almost fell asleep. It's really made up of others, nausea! Feng leads you to succeed. Ha-ha",0.300275
10,"我只想说，护舒宝，就你那贱嘴一张，还不赶紧回家养老。都白癜风成奶牛样了还赶出来吓唬人就是你不对了。不好意思我还记着您骂网友的事呢，您在我这别想翻身了。可惜不能打零蛋，不然我连一星都不给你。拜了个拜。","I just want to say, you whisper, that bitch mouth one, do not hurry to go home. Vitiligo is a cow like, and it's wrong to rush out to frighten people. Sorry, I also remember you scolding netizens, you do not want to turn over in me. But not the odd egg, or I do not give you a star. Worship a worshiper.",0.288319
10,"我只能说看这部电影就是虐心，一种煎熬，白日梦，变成真，但又不是真，让人很不爽。","I can only say that watching this movie is abusive, a torment, a daydream, a true, but not true, so unpleasant.",0.311463
10,"我妈非要拉我一起看，结果自己睡着了；白百合的比基尼穿得太丑了，失望……","My mother wants to pull me to see the results, he fell asleep; white lily bikinis dressed so ugly, disappointed......",0.266499
10,"我是冯导和葛大爷的粉丝，可这部电影实在拍得太难看了。那么多腕儿也扶不上墙的一滩烂泥啊！这是多年来，我第一次在影院如坐针毡，好想起身离场！恨毒了这垃圾两小时！","I'm a fan of Feng Dao and grandpa Ge, but this movie is really so ugly. A pool of mud so much also Waner does not hold the wall! This is the first time in many years, I want to leave the theater and got up! Hate poison the garbage for two hours!",0.304934
10,"我是来恶意差评护舒宝电影的…………","I'm here to malicious bad movie whisper............",0.290421
10,"我看懂了冯导你想讽刺的,也没什么意见. 但就是觉得把这种烂东西搬到电影院去圈钱的行为,真的作践了自己的名声.一星打给结局吧...","I understand you want to Pingdao ironically, no opinion. But what is the bad things that go to the cinema quanqian behavior, really spoil your reputation. A star called ending...",0.284541
10,"我给的差评是给冯小刚的不诚意，当别人是傻子么？不就是21世纪的甲方乙方么？有必要自己恶心自己么？！","I give a bad comment to Feng Xiaogang's sincerity, when is someone a fool? Is it not the Party A Party B of twenty-first Century? Is it necessary to make yourself sick?!",0.16324
10,"我觉得一个创作者该有的气度就是心无旁骛，只专注于自己热爱的东西。别人喜不喜欢是笑是骂，那都不是懒得理，是正事太多根本顾不上。有什么想表达的，拿作品说话。反正我是没见过李安杜琪峰整天没事刷微博和网友对骂。弄到最后作品是个哑炮，还非逼别人跪舔。想站着把钱挣了，光靠嗓门大不讲理可不行。","I think that some tolerance is a creator intentnesses, just focus on what you love. People like to like or not to laugh is scolding, that is not lazy, it is too much business. What you want to express is to speak with a work. I haven't seen Ang Lee Johnny To all the fine brush micro-blog users recrimination. Get the final work is a squib, also forcing others to kneel lick. If you want to earn your money, you can't do it with a loud voice.",0.293905
10,"我觉得给1星都嫌多。。感觉黔驴技穷，完全复制的甲方乙方。剧情烂透，不如去拍旅游宣传片。。还不错，茶余饭后可以痛骂这些垃圾电影。","I think 1 is too many stars.. The feeling of wits, Party A Party B fully replicated. The plot is rotten, so it's better to take a tourist publicity film. Well, can these junk movies clapperclaw at leisure.",0.196435
