"ranking","Chinese.origin.data","Baidu.translated.data","Baidu.English.sentiment.analysis.postitive.probability.base.on.Baidu.translated.data."
10,"房价如此之高，我们为何还要疯买？金价如此狂跌，为什么有那么多大妈被套牢？都羡慕怨恨别人处处优先有关系，遇到问题我们第一个想到的是不是找熟人托关系？影片如此之烂，为什么还有那么多脑残前赴后继？不怪别人，只怪我们的头盖骨长得和非洲裔一样，千古不变，那是祖辈的基因遗传。现在改还来得及。","House prices are so high, why do we have to go crazy? So the price of gold fell, why there are so many aunt is stuck? The envy of others is the priority of others. What is the first thing we think about is not looking for a relationship between the acquaintances? The movie is so bad, why there are so many idiotic one after another? It is not to blame others, only that our skull is as long as African Americans, and that is the genetic inheritance of the ancestors. It's still in time.",0.226301
10,"护舒宝江郎才尽，其实也没什么才吧，他的电影看的不多。不过这个是真心烂！！！！！！！！！！！！！！！！！！！！！！！！！！！！！！！！！！！！！！！！！！！！！！！！！！！！！！！！！！！！！！！","Whisper jianglangcaijin, in fact is not what it was, his movie is not much. But this is real!!!!!!!!!!!!!!!!!!!!!!!!!!!!!!!!!!!!!!!!!!!!!!!!!!!!!!!!!!!!!!!!!!!!!!!!!!!!!!!!!!!!!!!!!!!!!!!!!!!!!!!!!!!!!!!!!!!!!!!!!!!!!!!!!!!!!!!!!!!!!!!!!!!!!!!!!!!!!!!!!!!!!!!!!!!!!!!!!!!!!!!!!!!!!!!!!!!!!!!!",0.00295042
10,"护舒宝的一坨屎!","A shit of Hu Shubao!",0.302279
10,"放个屁还不让人说臭的一部电影, 懒得吐槽了","A fart that doesn't make a stinky movie, too lazy to spit",0.293072
10,"旁边一女生笑得不行。一直很难融入他们的气氛。说好这个学期不去影院看烂片的。:(","A girl next to a smile can't laugh. It's always hard to get into their atmosphere. This term is not agreed to go to the cinema to see the movie. (:",0.264293
10,"无力吐槽了，刚哥这是要闹哪样啊！最后一部分本来以为会有点惊喜，想想不至于这样平庸，结果最后一段简直让失望多增加了气愤的情绪！拍这样的电影对得起一直热爱你的铁粉吗？简直失望透顶！！！","Unable to end, just this brother is to lead to trouble! The last part thought it would be a little surprise. Think about not being so mediocre, and the last part of it was a little more disappointing. Do you always love your iron powder for such a movie? It's very disappointing!!!!",0.237243
10,"无聊，笑不出来的喜剧","A boredom, a comedy that can't be laughed out",0.288304
10,"早闻乃烂片一枚，前段时间亲自鉴定，果然如此，看到一半就关掉了，什么破玩意儿","A bad smell is early, some time ago in person identification, right enough to see half off, what a piece of junk.",0.264492
10,"明摆圈钱，毫无诚意，一声没笑什么水平？","Clear quanqian, no sincerity, no sound at what level?",0.294895
10,"春晚式的喜剧，所谓的潜台词那么明显，完全没内涵，又不好笑。最主要得是拍了烂片还不给评论，想名利双收？","Spring and evening comedy, the so-called subtext so obvious, completely no connotation, and not funny. The most important is not to take bad comments, want fame and fortune?",0.296944
10,"昨天看到第二个故事就实在看不下去了……这泥玛跟当年拍甲方乙方的是一个导演？说出去谁信？笑点低成我这样的也一直笑不出来到底是想怎样！连说这是甲方乙方的狗尾续貂都不配啊……","I can't see second stories yesterday... Is this mud Ma a director who took Party B's Party B at the same time? Who does it say? Laugh as low as I do, and I can't laugh all the time. Even say this is to Party A Party B does not deserve......",0.180775
10,"是TM冯小刚导演的吗？还能叫电影吗？","Is it directed by TM Feng Xiaogang? Can you call a movie?",0.24117
10,"最后那一段生搬硬套啥意思嘛。还搞环保宣传片呢，有种学老外登上一年拍个野生纪录片去。什么玩意东西。","The last paragraph what you mean mechanically. In addition to environmental publicity films, there is a school for a year to shoot a wild documentary. What is a thing.",0.304813
10,"有这么多功夫选景点，不如认真拍部好片。敢不敢拍得更儿戏更肤浅更马虎啊？？是逗我们玩儿吧","There are so many Kung Fu selected attractions, as a serious film shoot. Dare to take a much more superficial more careless ah?? Let's play with us",0.272204
10,"朋友告诉我电影演到半个点儿的时候我就倚着他睡着了。。。他没有推开我是不是说明了什么问题！！！？","A friend told me the movie when I was half a little because he fell asleep... He didn't push me to explain what the problem was!!!?",0.188069
10,"本来就是准备去一笑了之的一片儿，哪知道看了半天连笑点也少得可怜。冯导没做成3d的还算有点良心。。","A patch is ready to laugh, know what to look for a long time even the bursting point is pitiful. Feng guide did not make 3D a bit of conscience.",0.252616
10,"本来想写个一句话影评的，但又觉得就说一句话实在对不住冯导，那就三句吧：1，我没看完就退场了。2，这是一部要啥没啥下载枪版到电脑里都浪费硬盘空间的大烂片。3，生完孩子的李小璐胸是真特么大！.","Originally wanted to write a sentence ', but that is to say a word really sorry Pingdao, just three words: 1, I haven't finished it. 2, this is what no download gun version to a computer hard disk space is wasted a flop. 3, how big is the baby's Li Xiaolu chest! .",0.18561
10,"本来我都忘了豆瓣的帐号是什么了，但冯导的这部电影实在是让人发困，感觉像极了一个吃了醋的孩子，把1942的亏钱的原因归结于观众的欣赏水平问题，随便拍了个私人订制，票房反而这么好，本来冯导就觉得不爽了，还被人骂了，冯导一副给你大餐你们吃不了，给你屎你还嫌难吃的表情，于是我翻了半天邮件找帐","I have forgotten what is the watercress account, but this movie Pingdao is really let a person feel sleepy, feeling like a child to eat vinegar, losing 1942 of the reasons attributed to the audience, just took a private order, but the box office so well. Originally Pingdao felt uncomfortable, being scolded, Feng Daoyi you can't eat dinner for you, give you shit you're too horrible face, so I turned for a long time to find the mail account",0.310554
10,"杂乱的叙事，毫无逻辑的结尾，生硬的笑料。可以打负分吗？","A cluttered narrative, no logical ending, a stiff smile. Can you score a negative score?",0.141704
10,"果然比不上甲方乙方 本来甲方乙方就烂 现在就更烂了 最后变公益宣传片 恶心","No more than Party A Party B originally Party B, Party B is worse now worse the last change of public publicity film nausea",0.26764
10,"比小时代更烂的大片总算出炉了","A much worse blockbuster than the younger generation has come out of the oven.",0.312632
10,"气的连吐槽都不愿意了 这烂片tm的居然还要另外多收费??","The gas even Tucao are not willing to this movie TM actually also pay more??",0.20468
10,"水平极低的作品。。。简直不敢相信是这么多大腕烘出来的","A very low level of work. I can't believe so many big wigs out of it",0.311407
10,"沒興趣評的高大上影片","A big film that is not interesting to comment on",0.297862
10,"没什么意思，和甲方乙方类似。挺失望的。","It's not so interesting that Party B is similar to Party B. It's very disappointing.",0.309737
10,"没劲!!!!!!!!!!!!!!!!!!!!!!!!!!!!!!!!!!!!!!!!!!!!!!!!!!!!!!!!!!!!!!!!!!!!!!!!!!","No effort!!!!!!!!!!!!!!!!!!!!!!!!!!!!!!!!!!!!!!!!!!!!!!!!!!!!!!!!!!!!!!!!!!",0.0235481
10,"没有0星这个选项吗？","Is there no 0 star option?",0.294256
10,"没有冯导的破口大骂影评人，也不会来写评论。本来首映就去看了，当真觉得不好笑，作为一个搞笑贺岁，所有的笑料都是老料。甲方乙方本来是百看不厌，所以私人定制看了五分钟就觉得发腻，看到最后只能是快吐了。如果真的不会拍喜剧，就别拍了。几个主演，葛大爷演的没魂，假胸更让我想吐。求下次别这低俗","No Pingdao into a film critic, never to write comments. The first show was to see, I really felt not funny, as a funny year of congratulations, all the laughter is old material. Party B is lost, so private custom watch five minutes will feel tired, can only see the last is sick. If you really don't take a comedy, don't do it. A few starring, Mr. Ge starred in the soul, false chest to let me feel more vomit. Please don't be so vulgar next time",0.274361
10,"没有梗的喜剧。三个小品也就算了，最后一段是在做梦么！！！","A comedy with no stalks. Three small items are also even, the last paragraph is in a dream!!!",0.201849
10,"没看过，但冲着冯导的泼妇式骂街就只能给一星了，您都导了大半辈子戏了，非得晚节不保是不？！电影差就算了，还那么没素质地骂人，您真是太LOW了！","Not seen, but at a street Pingdao the type will only give a star, you can guide a lifetime of play, is not to be like?! Even if the movie is bad, you are so LOW!",0.283576
10,"渣得一塌糊涂，乱七八糟的小品拼接，而且是春晚都不屑使用的小品段子","A mess of dregs, a mess of small pieces, and a piece of a piece that is disdain to use in the spring evening.",0.276726
10,"演得好烂啊...为什么要写那么浮夸无意义的场面和台词？闷得要睡着了","Why do you write so boasting and meaningless scenes and lines? I'm so bored to fall asleep",0.300928
10,"烂就一个字","A word is a word",0.308853
10,"烂成这样还喷人太过分……小时代我还愿意打两星呢！导演先不说编剧简直不忍吐槽……","It's too bad to be so bad. I also like to play two times! The director can hardly bear to spit a job without saying a screenwriter...",0.251441
10,"烂片！！！！！！！！！！！！！！！！！！！！！！！！！！！！！！！！！！！！！！！！！！！！！！！！！！！！！！！！！！！！！！！！！！！！！！！！！！！！！！！！！！！！！！！！！！！！！！！！！！","Bad!!!!!!!!!!!!!!!!!!!!!!!!!!!!!!!!!!!!!!!!!!!!!!!!!!!!!!!!!!!!!!!!!!!!!!!!!!!!!!!!!!!!!!!!!!!!!!!!!!",0.0058676
10,"烂片，冯小刚的电影还能看吗？","A bad film, Feng Xiaogang's film can see?",0.225509
10,"烂片一枚。","A bad movie.",0.310148
10,"烂片一部，冯小刚纯为了圈钱拍的吧。","A bad movie, Feng Xiaogang took it to pure money.",0.297173
10,"用江郎才尽来形容冯小刚真的不为过，以后他的片子再也不看了。。。。真垃圾，浪费了80元的电影票钱，我老公都想半途离场，后来还是我要求陪我看完，无语.....有点伤感，伤感以后冯小刚再也不是票房保证了","Using jianglangcaijin to describe Feng Xiaogang really is, after his film will never see.... It's a waste of 80 yuan of movie ticket money. My husband wants to leave the field half way. Later, I asked to accompany me to finish reading, no language... A little sad. After that, Feng Xiaogang was no longer a box office guarantee.",0.237617
10,"甲方乙方 冯小刚打算以后再把原来的片重新翻拍一遍么","Party A Party B's Feng Xiaogang intends to remake the original film again",0.301102
10,"甲方乙方 模仿 顽主  ，私人定制 再模仿 甲方乙方，，，，没完没了吃老本，这次的故事实在是看不下去了","Party A Party B to imitate Wanzhu, private custom and imitation of Party B,,,, endless laurels, this story really could not stand",0.2642
10,"甲方乙方？","Party A Party B?",0.222787
10,"甲方乙方？江郎才尽就别晃荡了","Party A Party B? Don't shake up",0.277039
10,"甲方乙方2，炒冷饭，不值得看。","Party A Party B 2, the same old stuff, not worth watching.",0.275926
10,"甲方乙方2015？","Party B Party B 2015?",0.304466
10,"甲方乙方升级版，没新意，除了几个老家伙，其他的根本就不适合演喜剧，没演技。太失望","Party B Party B's upgrade version, no new idea, in addition to a few old guys, the other is not suitable for comedy, no acting. Too disappointed",0.311096
10,"甲方乙方回不去就回不去了，可最后逻辑混乱的一比那啥是最不能理解的","Party A will not go back if Party A does not go back, but one of the last logical confusion is the most incomprehensible.",0.262256
10,"甲方乙方才是经典。只不过这部片子反应出点不一样，说嘲讽不知道合不合适。","Party A Party B is the classic. But the film reacts to a different point, saying that irony is not appropriate.",0.241893
10,"甲方乙方的2013年版，故事主题还算能接受，但结尾的太狗血了吧，其实就是简简单单的喜剧片，还弄的貌似挺深沉的结尾，风马牛不相及，貌似这一刻还在夏日，下一秒就冬日了…一个世界道歉日就这么过渡来了…","Party A Party B of the 2013 edition, the theme of the story is acceptable, but at the end of the idea too well, is actually a simple comedy, get the seemingly quite deep end, have no relevance, seemingly at this moment still summer, next winter... A world apology day is coming in...",0.173856
10,"甲方乙方的山寨版","A Shanzhai edition of Party A Party B",0.214829
10,"甲方乙方的思路，在现在看来格格不入。还来一段俗雅辩证？","Party A's idea of Party B seems to be out of order at present. A piece of elegance and Dialectic?",0.152396
10,"甲方乙方的故事套路，黑热点黑的过于夸张。四人除了称谓不同完全没分工啊！环保宣传片做结尾？！忽而浮夸又忽而煽情？！冯导你是怎么了？！","Party B's story of Party B, the black hot black is too exaggerated. The four people have no division of labor except their appellations. Do environmental publicity films end?! Suddenly suddenly exaggerated sensational?! How did Feng guide you?!",0.167161
10,"甲方乙方的翻版，立意太枯燥。。。","The reversion of Party A Party B is too boring.",0.304787
10,"甲方乙方的翻版，说搞笑不搞笑，说温情不温情，片尾是公益广告么？冯导的电影啊，差评！","Party B's version of Party B, say funny not funny, say warmth is not warm, the tail is a public service advertising? Feng Dao's movie, bad comment!",0.292257
10,"甲方乙方翻版，说了点社会大白话","Party A Party B reversion, said a little social vernacular",0.289159
10,"甲方乙方重制版？","Party A Party B reproduces the plate again?",0.215882
10,"电影拍得这么烂，你妈知道么？","The film is so bad, do you know, mom?",0.283264
10,"电影是让人翻不完的白眼","A film is an invisible eye.",0.307285
10,"电影院一群SB女的，不知道在笑什么，主要是冯小刚的电影，不管演员说啥都会笑，换了别的导演，他们早骂了！","The movie theater group of SB women, do not know what to laugh, mainly Feng Xiaogang's film, no matter what the actor said will laugh, changed other directors, they early scolded!",0.303382
10,"画虎不成反类狗，冯小刚想表达对权利，文化，钱的批判，可惜江郎才尽，或者根本就没哪个装深沉的能力，才拍出一部不伦不类的小品串烧，根本不好笑的笑料，结局的时候居然还套上一个老掉牙的网络笑话","A poor imitation like a dog, Feng Xiaogang would like to express the rights, culture, money criticism, but did not run out of ideas, or which loaded deep ability to shoot a comedy skewers not neither fish nor fowl, funny jokes, ending when actually set an old tooth network joke",0.2806
10,"白百合就像景甜，拍一部毁一部，因为一部失恋三十三天就把一个三流演员炒成一线明星，中国真是人傻钱多.......","White lily like Tian Jing, took a ruined a, because of a lovelorn thirty-three put a three stream of actors fried into first-line star, Chinese is really silly money.......",0.255113
10,"白百合演的有不是烂片的吗？冯小刚这三年来有拍过不是烂片的吗？","White lily played a not bad? Feng Xiaogang has spent the past three years have done is not bad?",0.31326
10,"白百合真的很难看，贺岁档的唯一一部喜剧片真不知道导演是咋想的，要搞笑没搞笑，要故事没故事，要内涵美内涵，还说神马俗雅这么大的话题，是拍出来给人吐槽的吗？还好没花钱看不然要憋屈死！！！！","White lily is really ugly, only a comedy, Lunar New Year stalls do not know the director Ye want to be funny, not funny story to no story, to the beauty of connotation connotation, said god horse Suya such a big topic, is made for people Tucao? I didn't spend money to see or to suppress death!!!!",0.296643
10,"看不下去     把N年前甲方乙方的故事翻新，拿出来圈钱，唉。。。。","Don't go to the Party A Party B N years ago the story of renovation, take out money, alas....",0.277329
10,"看了这么多场电影，让我能中途愤而离席的真不多。冯小刚去年刚拍了1942，尼玛今年的你是从40年前刚穿越回来的吗？还有这编剧烂得一逼，东拉西扯不知所云。","Look at this movie, so I can not really and walk out halfway. Feng Xiaogang just took 1942 last year. Did you get back from 40 years ago by Nima? This is a screenwriter rotten force, or drag in all sorts of irrelevant matters.",0.259138
10,"看到一半就走了。甲方乙方是经典，可这部是垃圾。","Half of the sight is gone. Party A Party B is a classic, but this is a garbage.",0.285364
10,"看到一半我都愤然离场了~商业片也不能这么拍啊 广告植入这么多 真不累啊~冯导创作思维已经枯竭了么 过了这么多年再来个翻版的甲方乙方 有意思么？","I see half shake off ~ commercial film can not do so many ads ah ah ~ really not tired of Feng Dao's creative thinking has been exhausted. After so many years a replica of the Party A Party B has mean?",0.198658
10,"看到白白盒怎么这么烦躁？！","How to see the white box so irritable?!",0.30304
10,"看完1/3已经实在坚持不下去，这不就是过去的甲方乙方之类的拼凑么？有意思么？","After seeing 1/3, it is really hard to stick to it. Is this the patchwork of Party A, Party B and so on in the past? Is it interesting?",0.163983
10,"看电影的时候就一直在想为什么会有这么多人跟我坐在一起看这样一部片子。然后吃爆米花吃的满身都是","When you see a movie, I've been wondering why there are so many people sitting with me to watch a movie like this. And then eating popcorn all over the body",0.300402
10,"看私人定制的心情就像少年对性的幻想，渴望一次愉悦地高潮，结果发现是一部连胸都没露的三级片，只能骂一句，裤子都脱了你就给我看这个？全片毫无笑点只有不知所谓的插科打诨，毫无剧情只有编剧导演对某些现象的意淫以为这样就是批判了。负分滚粗。","It's like a teenager's sexual fantasies and longing for a pleasant climax. It turns out that it's a three stage movie with no chest exposure. It can only be scolded. If you take off your pants, you can show me this. It's no bursting point only so called no drama screenwriter director make impromptu comic gestures and ramarks, only certain phenomena of you think this is critical. The negative roll is rough.",0.308
10,"看过了,真的有被恶心到了的感觉.冯小刚,我对你的评价只有四个字:江郎才尽!.冯导:你的诚意呢,你的节操呢!!!我不想骂人,我真的不想骂人了,可你TMD你的地气呢???","Yes, there really was a sick feeling. Feng Xiaogang, I to you only four words: jianglangcaijin!. Pingdao: your sincerity, your integrity!!! I don't want to swear, I really do not want to curse, you can TMD your gas???",0.134777
10,"真没抱着.甲方乙方.的标准去看，但也不至于这么烂吧！","I really didn't hold it. Party A Party B's standard to see, but not so bad!",0.29025
10,"真没法坚持看完，这什么乱七八糟跟相声一样的你一句我一句，没有剧情，说是暗讽不如直说是明讽吧，没深意没动脑筋的不说，连一个突出的角色都没有，走马观花的都不知道想说什么，叫微电影三合一算了，就算是那讽刺地太稀烂了，还有，京片儿就是作，受不了！","Really can not insist on reading this, what you like to talk out of order I sentence, no story, said to be as straight out, innuendo irony, no meaning no brains do not say, even a prominent role are not typically do not know what to say, called micro film three one well, even the irony is too pulpy, and Beijing area is not!",0.200286
10,"真的…没有…感受到…喜剧…","Really... No... Feel... Comedy...",0.309115
10,"真的很失败的一部电影，全场无笑点都是尿点，最后煽情那段简直不能更刻意一点，冯小刚去年揣着1942眼红囧囧，酸溜溜的说随时可以把喜剧捡回来，今年就折腾出这么一个挫玩意，简直毫无诚意！","A movie is a failure of the true, the bursting point is the last point of urine, that couldn't be a deliberately provocative, Feng Xiaogang Chuaizhe 1942 jealous embarrassed embarrassed, sour said ready to take back this year comedy, toss out such a thing and there is no sincerity!",0.23664
10,"真的没小时代好看呀！人家水平低起码在认真拍，你呢，拿电影，拿观众的信任来玩...","It's really not a small time. People are at a low level at a low level. You take a movie and play with the trust of the audience.",0.303837
10,"私人定制出来后就一个感觉 坑爹呢这是！  几个神经病屌丝做白日梦拼凑下 最后加个公益广告  我在哪看不成还花钱去电影院看公益广告 尼玛","When a personal custom comes out, a feeling pit daddy is! A few neuropathic Diao fillets, together with a daydream, finally add a public service ad, where can I see no money to go to the cinema to see the public service ad Nima",0.244528
10,"私人订制 冯小刚的失意之作","A personal reservation to Feng Xiaogang's disagreement",0.307389
10,"笑点伪造太明显就不那么好笑了！只会让人恶心！","It's not so funny to laugh too much! It's just disgusting!",0.294252
10,"笑点低，结尾莫名奇妙，粗制滥造的典型","A low smile, an indescribable ending, a rough model",0.269052
10,"第一个故事让我恐惧：我tm可能就是群众中的坏人啊；第二个故事让我觉得悲伤：我tm看那么多书看那么多电影没事儿看个话剧简直就是傻逼到了极点啊；第三个故事让我绝望：上一个姐阶层有个JB用啊，钱是什么啊钱是王八蛋啊一切都是浮云啊。没吃过鲍鱼就别吃了，不如萝卜。NMB。","The first story makes me fear: I TM is probably the masses of bad guys ah; second story makes me feel sad: I TM see so many books to read so many movies all right to see a drama is simply idiot to the extreme ah; third story let me despair: a sister class has a JB ah, money is what money is a bastard all clouds. Don't eat abalone, not as good as radish. NMB.",0.122184
10,"第二个故事：想当清官也就将就看看了，后面几个的惨不忍睹，太不接地气了；哎，也就白百合的修长身材留下了点映像。。。。。","Second story: to be honest also will see, the following is not too horrible to look at, down to earth; alas, also left little reflection lily white slender figure.....",0.293896
10,"简单来说，这就是冯小刚拿自己之前积累下来的口碑兑现了一笔收入，说是粗制滥造、不负责任毫不过分，没见过这么没节操的……太伤人品了，大导……","In simple terms, this was before Feng Xiaogang took his accumulated reputation to honor an income, that is, crudely made irresponsible not too much, not seen so no integrity of the...... It's too bad for people, big guide...",0.221587
10,"简直想打零分……太烂了……","Almost to zero...... Sucks......",0.294716
10,"纯属烂片，能不能敬业一点，尊重一下捧场观众，花点心思！！！太猪了","A bad film, can a little work, respect for the audience to join, huadianxinsi!!! Too much pig",0.256392
10,"结尾的道歉也是王朔写的？？？？太小瞧他了！！！！！","The end of the apology was also written by Wang Shuo??? So look down upon him!!!!!",0.301107
10,"网友说没有剧情 这个可以接受 但是看过后没有笑点。真是骗票房，简直太垃圾了！","The net friend said there was no plot that could be accepted but there was no laughing. It's a box office. It's so rubbish!",0.277553
10,"翻拍炒冷饭也就算了，拍的还这么弱智","A remake of stuff even, the scene was so retarded",0.297242
10,"翻版的垃圾，冯爷去年好闲。。。。","A replica of the garbage, Feng Ye last year to....",0.234193
10,"老谋子弄了一堆地方印象，您想圈钱又不想费那么大劲干脆多弄几个段子拍连续剧成吧？","Still get a bunch of local impression, you want money and don't want so much trouble just make a few scripts into drama?",0.225404
