"ranking","Chinese.origin.data","Yandex.translated.data","Baidu.English.sentiment.analysis.postitive.probability.base.on.Yandex.translated.data."
20,"很想找点喜欢这电影的理由，但是只找到了一个白百何。去之前预期已经很低了，但是看到[道歉篇]实在不知道这最后一段是为了什么，尤其是出现恭贺马年的时候着实被恶心着了。我们对于电影，需要的永远是脱离现实的东西，不是实现自己的白日梦，而是有更多、更高、更美的东西，等着电影去帮我们实现。","Was trying to find something like this movie The reason, but only found one white hundred. To go before the expectations have been very low, but see[apology]really don't know if this last paragraph is for what, especially the emergence congratulations to the year of the horse time really is disgusting. We for movies, need never be out of touch with reality of things, not to achieve their own daydreams, but there are more, higher, more beautiful things, waiting for the movie to help us achieve.",0.807017
20,"很烂。倒也说明冯小刚拍电影已经写意了，可以换个名字：冯小刚和观众拉家常或者冯导的13年末告知观众的几点感悟。赞一下宋丹丹最后卸妆时候的演技，那几下一下戳泪中点了。我是没法想像没有冯氏喜剧的年末，只是大年末的提钱多俗，又是一个和钱有关的片儿。","Sucks. Pour also shows Feng Xiaogang movie has freehand, you can change the name: Feng Xiaogang, and the audience pretty or Feng turned 13 at the end to inform the audience of a few sentiment. Like what song Dandan finally cleansing of the time of acting, that the next stamp tear the midpoint. I can't imagine not von's Comedy by the end, just big at the end to mention the money many customs, and is a and money-related piece of.",0.820944
20,"很费力地想要表达诸如政治腐败，环境污染等社会问题，讨论人性，但是浮于表面，过于荒诞，流于形式，缺乏深度。片段式的相互连接也不恰当。还有white lily这个烂片之王，有的人不知道哪里有问题，就是有她就不想看了。不过，海南风光真美。","Very laborious to want to Express such as political corruption, environmental pollution and other social problems, discussion of human nature, but floating on the surface, is too absurd, a mere formality, the lack of depth. Fragments connected with each other is also not appropriate. There is also the white lily this rotten piece of the king, and some people don't know where there problem is she don't want to see. However, the Hainan scenery of true beauty.",0.756296
20,"很难想象编剧是王朔 三段一个国家一个导演一个富人 的确有可笑之处只是对白与情节不够好笑 骂观众及拍俗是高潮 关于父母那段是泪点 突然接最后感谢来反讽 有教育意义却脱戏之感 最后葛优的台词冯式典型嘲笑国人 说的再好再有感悟实际去做就是诟病 这戏看不到真诚是因为冯导在真诚的骂各位傻B~","It's hard to imagine screenwriter is Wang Shuo three sections of a country A to the Director a rich man indeed ridiculous, with only the dialogue and plot not enough funny to yell at the audience and shoot the secular is the climax on the parents that is to the point of tears suddenly pick finally, thanks to irony have educational significance but off the games sense of the last GE. von formula typically laugh at people say no matter how good and then there is perception of the actual do is criticized and this game Look less than sincere because von guide in sincere cursing you silly B~",0.853565
20,"心灵麻醉","Mind anesthesia",1
20,"心里游戏的山寨闹剧版，两星是给片尾的那四个道歉的，虽然和影片没关系还是有感动我。感觉白百合和李小璐她俩不和啊","The heart of the game cottage in the drama version, the two stars is for the credits that four of the apology, though, and the movie's okay to still have touched me. Feel white Lily and Li Xiaolu they don't.",0.784854
20,"怀疑是王氏兄弟为了做空专门弄的毒药引子，股价低了他们买进啊，然后再弄个好的炒高，高！实在是高！","Doubt is the King's brother in order to make available specialized get the poison primer, the stock price is low they buy. and then get a good fried high, high! Is really high!",0.902189
20,"怀疑票房是假的！！！圣诞节当天放映前3小时格瓦拉订的票子，只有最前2排有位子，放映时上座率大概10%最多了…范伟那段挺好看，之后越来越烂！葛大爷也挽回不了了…","Doubt the box office is fake it!!! Christmas day show in the 3 hours before Guevara booked the tickets, only the front 2 rows of seats, the show attendance is probably 10%at most...fan Wei that look good, after getting rotten! GE uncle also restore not...",0.815461
20,"怀着憧憬的心情进电影院，结果就给我看了这玩意。葛大爷似乎是个打酱油的，在这部电影里根本没有发挥出他的水平，三个乱七八糟的故事接在一起，让人看完了都不知道自己这俩小时到底看了啥玩意。反正我是没看出这部电影有什么好的。没给一颗星而给了两颗星是因为比较喜欢冯小刚和葛优，给点他俩面子吧。","With a vision of mood into the cinema, the result showed me this stuff. GE uncle seems to be a soy sauce, in this movie Reagan didn't play to his level, three sixes of the stories connected together, let people watching don't know that two hours in the end to see the What stuff. Anyway, I haven't seen this movie what good. Didn't give one star but gave two stars is because like Feng Xiaogang and GE you, to the point they face.",0.887685
20,"怎么看都是海南的广告宣传片，结尾是公益广告！整个一大广告！只能说景色还是挺漂亮的","See How is Hainan advertising sheet, at the end is the public service ads! The entire a large advertising! Can only say the view was quite nice",0.773164
20,"总体来说就是一个骗钱的情节和骗钱的电影，最后的环保主题，把破坏的环境拍的有一丝凄美，虽然很无厘头和突兀，不过个人觉得是仅有的亮点。","Overall, it is a rip-off of the plot and get money for the movie, and finally the environmental theme, the destruction of the environment of the shoot has a hint of poignant, though very nonsensical and abrupt, but personally there is only some highlights.",0.778583
20,"总结四字：玩味太重，冯导作为一个老练的商业片导演，拍出这样的片子只能说是已经不想干了，全篇无诚意，基本是导演自己玩的high，根本没有去照顾观众的感情。","Summed up in four words: playful too heavy, Feng guide as an experienced Commercial Director to shoot such a film can only be said to be already don't want to dry out, the whole article without good faith, the basic is the Director of their own play of high, there is no to take care of the audience's feelings.",0.819798
20,"恶","Evil",1
20,"恶心自己、成全别人，谢谢你能有这样的觉悟，不知你被恶心成什么样，可是我却没有被成全的感觉。电影里的三个故事既不好玩也经不起推敲，打死也不说的智慧变成了让北京城熄灯的显摆，真牛，可是一点也不好玩。","Nausea themselves, the sake of others, Thank you for such enlightenment, don't you be disgusting?, but I have not been full of feeling. Movies three stories neither good to play also can not withstand scrutiny, killed also don't say wisdom into get the city lights out the show-off, the genuine, but is not fun.",0.774377
20,"恶心观众，成全自己，这事儿做得不靠谱。冯导王编自是借电影有话讲，但没讲好，还不如上微博看各种怨声载道，狗血吐槽。观众审丑都没法再糊弄的年代，片官员，涮土豪，纠结俗雅，容易搞砸。","Disgusting the audience, to fulfill myself, this thing do not fly. Von guide King series from is borrowed the movie has to say, but didn't speak good, not as good as on the microblogging see a variety of grumbling, the idea tucao。 Audience review ugly are Can't fool the years, sheet officials, rinse tyrant, tangled vulgar ya, easy to mess up.",0.867244
20,"情节无逻辑，角色单薄，电影手法简陋。扑面而来的无奈和丑陋，观影时候的笑声多是嘲讽，没有了喜乐的成分。看完郁闷不已，物质富足精神匮乏的现实被电影直接呼在脸上。如果是想看贺岁喜剧，可能不是好的选择。","Plot no logic, the role of thin film techniques rudimentary. Blowing the helpless and the ugly, the movie when the laughter more is the sarcasm, not the joy of the ingredients. After reading the grouchy, the material abundance of the spirit lack of the reality is the movie a direct call on the face. If you want to see New Year Comedy, probably not a good choice.",0.86351
20,"情节生硬牵强","Plot blunt far-fetched",1
20,"情节零散，如演小品；笑料老套，如嚼鞋底。音乐好听，但不切题；剧终抒情，莫名其妙。","The plot fragmented, such as the play pieces; the jokes old-fashioned, such as to chew sole. Music nice, but not to the point; the end. lyrical, somehow.",0.777602
20,"惨不忍睹","Appalling",1
20,"想到friends里一个台词，Rachael把松露蛋糕做成了松露馅饼，Rose说有脚的味道。。。Joey说，很好吃啊！牛肉，好吃！蛋糕，好吃~奶油，好吃。。。话说四个段落，分开来排成四个电影可能都不错，但是放在一起就。。。","Think of friends in one of the lines, Rachael put truffles cake into truffles pies, Rose said there feet a taste of it. Joey said, very tasty! Beef, delicious! Cake, delicious~creamy, delicious and... The words of the four paragraphs, to separate the row into four movies may be good, but put together it is.",0.908512
20,"想法很不错，可惜文案张力不够，碎片化严重，换成电视剧还不错~","The idea is good, pity copywriting tension is not enough, the fragments of the grave, into a TV series is also good~",0.877422
20,"想法还挺好，当官、当艺术家、当有钱人的中国梦，只是自己抄自己，用过的创意已新意全无。比前一部更突出的缺陷是，影片败就败在旁的东西太多，显得太随意了。","The idea is also good, when the officer, when the artist, when the rich of the Chinese dream, just your own copy yourself, using the creative has new nothing. Than before a portion of the more prominent defects are, the movie failed on the defeat next to too many things, seem too casual.",0.805369
20,"想认真拍点东西，结果反响很差，索性随便搞搞，反响当然不好，终于毛了，却也只敢怪怪影评人，真正看电影的老百姓，有几个是随影评人左右的？内容源于群众，迎合群众，却也总视群众为乌合之众，其实骨子里还是挺瞧不起大众文化的吧，怕是有一天...","Want to seriously shoot something, the result response is very poor, simply just mess things up, the response is of course bad, and finally the hair, but also only dare to blame blame the critic, the real movie people, there are a few is with the film critics left and right? Content from the masses, cater to the masses, but also the total apparent mass for the rabble, in fact, the bones still quite looked down on mass culture it, fear is one day...",0.781623
20,"想讽刺的做法挺好的，二人转啊相声啊也是好东西，但是时间太长，就会煮烂掉，2个小时，连这汤底都给熬干了，考虑过观众的感受吗。","Think of the irony of the practice of good, mouth, Ah the comic. also is a good thing, but time is too long, it will cook rot, 2 hours, even the soup base to boil dry, considering the audience's feelings.",0.866587
20,"意淫","Obscenity",1
20,"感觉冯小刚完全没认真拍。这个剧本本身就有问题，炒甲方乙方的冷饭，简直是活生生的自我抄袭。而且抄得还没原来好，草草了事，整个结构都是散的，靠几个小标题勉强相联。四位主角全无互动，故事层次单一，最后还来一段环保广告，加上七七八八极其嚣张的植入广告，这部电影真是年末一大烂片。","Feeling of Feng Xiaogang wasn't a serious shoot. The script itself has a problem, the fry Party a party b the cold rice, is simply living self-plagiarism. But the copy was not the original good, the rushed, the entire structure is scattered, relying on several sub-headings barely linked. The four main characters-nothing interactive, stories, levels Single, and finally also to a period of environmental advertising, coupled with the most treasures is extremely arrogant of implantation of advertising, this movie is really the end of a rotten piece.",0.812945
20,"感觉此片的定位颇为尴尬，说是剧情片剧情很一般，说是喜剧片笑料又不足，作为冯氏喜剧这部片非常疲软乏力。不过又不像网上说得那么差，整体还是能看的。冯导似乎是想指桑骂槐地说点什么，把几个阶层全部埋汰一遍，想有深度可又深得不够。值得一提的是片尾那几段关于环保的戏倒是全片亮点，颇为动人。","Feel this piece of the positioning rather awkward, saying that the drama plot is very General, that is the Comedy jokes are inadequate, as Fung Comedy, this film is very weak weak. But not like online said it so bad, overall still can see. Von the guide seems to be going 指桑骂槐 to say something, Put a few segments of all of the Mai Tai again, want to have depth and deep enough. It is worth mentioning that the credits that a few paragraphs on the environmental protection of the game's full sheet highlights, quite touching.",0.782688
20,"感觉还不错嘛  PS. 白百合头一次感觉介么好看啊","Feels good! PS. White Lily for the first time feeling the dielectric? look good?",0.762103
20,"感觉这个方向其实挺好的，毕竟有很多人可能终其一生都有一个完成不了的梦想，通过这种虚幻的方式感受一下可能也不错，虽然还是梦一场，但是也能给人生增加一丝微笑吧，但是正如导演自己说的，随便拍拍而已，没诚意的片子，博君一笑吧，最后一段倒是有些思想境界的升华不过感觉跟电影本身没有关系","Feel this direction is in fact very good, after all there are a lot of people may last a lifetime there is a complete lack of Dreams, by this illusory way and feel it may be too good though or the dream of a field, but can also give life increase one Silk smile, but as the Director himself said, casually Pat only, no sincerity of the film, Bo-Jun, a laugh, the last paragraph touches on some of the ideological realm of sublimation but feel like the movie itself does not matter",0.910448
20,"成全别人，恶心自己！我真的有被恶心到！怎么可以拍出这么难看的电影来啊！最后一段怎么变成宣传环保了？好突兀！突然觉得泰囧俗得挺好看的！","The sake of others, nausea yourself! I really have been sick! How can you make such a ugly movie! The last paragraph how into promote environmental protection? Good abrupt is! Suddenly feel the Thai embarrassing vulgar was good to see!",0.754013
20,"成全票房，恶心钱包~~~","The sake of box office, disgusting wallet~~~",0.758306
20,"成全自己，恶心别人的意思是：老男冯导开始习惯于喋喋不休，这本身没什么错，但是问题在于他不管观众能否接受。而当冯导把一个观众不买账的习惯当成风格来发扬的时候，原本接地气的冯导就和观众分道扬镳了。从这个意义上来说，冯导拍出这么一个作品，是一种不负责任的态度。","The sake of yourself, nausea and others mean: the old men's von guide began to get accustomed to the chatter, which in itself is nothing wrong, but the problem is that he no matter the audience can accept. And when von guide Put a the audience do not buy it the habit as a style to carry forward the spirit of the time, the original ground of the von turned on and the audience parted ways. In this sense, von guide make such a work, is an irresponsible attitude.",0.844053
20,"我一直觉着冯拍的不错 这部真心不好看","I always think Feng shot good this unit really doesn't look good",0.792466
20,"我们都知道要有梦想，可是我们常常只能看到它光鲜的外表。结尾能承担起媒体的社会责任是好的，不过显得太生硬。剧本感觉有漏洞，想表达的东西是好的。","We all know to have dreams, but often we can only see its glamorous appearance. End can take up the media's social responsibility are good, but seem too stiff. Script feel there is vulnerability, wanted to Express something is good.",0.861033
20,"我其实一直很宽容的，很少给3星以下，但这样一部小品拼凑的电影由冯小刚拍出来，还都是不好笑的小品，还明白告诉你我就是来要钱的，还把贺岁档都给了它，我就觉得那些广告植入拼胸都那么让人不能忍受了!两星是给范伟和李小璐的，一个保持了水准一个让我看到了多面性。","I've actually been very forgiving and rarely give 3 stars or less, but such a small piece of the movie by Feng Xiaogang shoot out, also is not funny Comedy, but also understand tell you is to ask for money, also the New Year gear gave it, I think those ads to fight the chest so people can't take it anymore! The two stars is for fan Wei, and Li Xiaolu, one holding a standard one let me see the multi-faceted.",0.799531
20,"我喜欢两类电影，要么足够搞笑，像泰囧一样，从头笑到尾，笑完也就过去了，要么就引人深思，震撼人心。可是私人订制呢，让人哭笑不得，你说搞笑吧，又不纯粹，你说隐射社会现实吧，也不纯粹。不明白导演到底想表达什么。说实话，真的挺失望的。想表达的东西太多，反而让人觉得很混乱，简单纯粹最好。","I like two types of movies, either enough funny, like Thai embarrassing, like, smiling from start to end, laughing after it passed, or thought-provoking, and humbling it. But private customized yet, let people laugh and cry, you said funny right, not pure, you said meaning social reality it also does not purely. Don't understand the Director in the end want to Express what. To be honest, really disappointed. Want to Express things too much, but let people feel very chaotic, simple and pure is best.",0.86732
20,"我对电影的定位其实特别肤浅，就在好不好看和热不热闹上。有的电影不好看但热闹，但私人定制只能说不好看也不热闹了。","I'm on a movie location actually is particularly superficial, it is in good looking and hot and not lively. Some movies look good but the lively, but private custom can only say look good not lively.",0.881344
20,"我就觉得有钱那个故事挺好的，其他的，确实不怎么样，而且结局那个采访我也觉得挺莫名其妙的。","I think the money that the story is good, the other, really bad, but the ending of that interview I feel pretty somehow.",0.801479
20,"我开始反感这个导演的作品了，炒旧饭，一点不可爱。故事是很有深度，但是好刻意。2小时的白日梦不是这样做作想出来的。没有特别好笑的，也没有特别动人的，四人组被隔离来，没有什么出彩可言。倒是丹丹演绎自然，不是小品和戏剧。","I began to resent this Director's work, fry old rice, a little cute. The story is very deep, but good deliberately. 2 hours daydreaming is not such a contrived thought out. Not particularly funny, not particularly engaging, the four-people group is isolated, there is nothing out of color at all. Touches Dandan interpretation of the natural, not Comedy and Drama.",0.755788
20,"我总觉得冯小刚的看不懂和姜文的看不懂不是一回事儿~ 以上~","I always feel Feng Xiaogang's can't read and Mr. Jiang, the Read is not the same thing~~",0.852455
20,"我看电影真的很宽容的，能在哪里稍稍撩起某些感触或者仅仅是能让人有欲望一口气看完就行。。但看这片真的称不上愉快。。宋丹丹那段快睡着，以及最后道歉跟前面有什么关系吗，违和感max，不如拿去当公益广告，逻辑和煽情都像被强行绑架过来的。。不过郑恺很帅= =","I'm watching the movie really tolerant, where slightly lifted some of the feeling or just can make people have the desire to breath after watching it. But looking at this piece really isn't enjoyable.. Song Dandan that fast asleep, and the last to apologize in front of the surface what is the relationship?, the sense of violation and max, it is better to take when the public service ads, logical and sensational are like forcibly abducted over. However, Zheng Kai is very handsome.= =",0.867
20,"我真是好奇哈。到底有多糟。然后。真的满足了我的好奇心。给两个星我好安慰我这一小时五十三分钟。","I'm really curious ha. In the end there is much worse. Then. Really satisfied my curiosity. To the two stars I good comfort and I the one hour and fifty three minutes.",0.791035
20,"我知道你在讽刺现实 也有一些地方确实好笑 不过看完整体就会觉得像小朋友跟妈妈耍脾气 没有什么实际意义和价值更别提作用 难怪大周看到我看王朔的书和我说 王朔老了看不看都行了","I know you're ironic reality there are also some places really funny but look at the complete body will feel like kids with the MOM. there is nothing of practical significance and value not to mention the role of the no wonder the big week see I see Wang Shuo's book and I said Wang Shuo old look not to see the line",0.781972
20,"我给分真客气，这玩意可以用老太婆的裹脚布来形容。貌似是为了批判而拍的电影，但估计连创作人员都不会觉得站的住脚。真心怀疑是不是王或冯江郎才尽，要么就是冯大导在大片的路上走远了，有点飘飘然，当自己真能炮炮置地有声？第五代导演的辉煌，至此结束了吧。一星给宋丹丹，一星给王振亮和羽泉的歌。","I give points really kind, this stuff can use the old Hubbard's cupboard to describe. Looks like in order to critique and shoot Movie, it is estimated that even the creators are not going to feel standing at the foot. Really suspect that is not Wang or Feng run out of ideas, or is Feng big lead in a blockbuster way to go far away, a little smug, when your own really can cannon cannon set to have sound? The fifth generation of the Director's brilliant, so far end of the bar. A star to the song Dan Dan, a star to Wang Liang and Yu Quan of the song.",0.761687
20,"我能说这片子很无聊么，内容非常简单，我也知道你要表达的意思，但是这个表现形式实在是很无趣。就连最后一个我们确实应该向山河日月道歉的内容，也感觉不是发自真心的。","I can say this film is boring?, the content is very simple, I know you're trying to say, but this form of expression is really very uninteresting. Even the last one we really should to the mountains and rivers the sun and the moon to apologize for the content, but also feeling not from the bottom of the heart.",0.850903
20,"我觉得只剩下葛优一个人撑起当初好梦一日游的公司，或许会更好。封面上其余的三个人存在意义不大","I think the only remaining GE you a man propped up when the good dream of a day tour company, might be better. On the cover the rest of the three individuals present of little significance",0.780821
20,"我觉得没什么好好笑的呢？是我笑点太高了么？只觉得影片最后向大自然道歉的立意比较好，可让大家注意保护环境。其他的，能记住场景没几个","I didn't think it was a good laugh? Is my laugh too high? Just think of the movie and finally to the nature of the apology with the intention of better, can be let attention to the protection of the environment. The other, can remember the scene a few",0.863782
20,"我觉得这部电影好坑爹啊，只能说是一部低俗喜剧，而且笑点很烂。看完后没有任何意义。影片中唯一稍微触动我的就是时间都去哪儿了这首歌播放的时候，还有片尾曲挺好听吧。","I think this movie is good pit father Ah, can only say is a vulgar Comedy, and the punchline sucks. After reading makes no sense. The film only slightly touches me is the time where this song played, and the credits song is good listen to it.",0.844991
20,"打发时间的电影，有搞笑，有煽情，夸张，但处处又欠缺些什么。尤其是不能分析电影价值，和心灵鸡汤完全搭不上边。也真就是因为冯小刚拍的，换个导演还能有这票房么？反正我是后悔在电影院看了。","Pass the time movie, funny, sensational, exaggerated, but everywhere and the lack of something. Especially not the analysis of the movie out, and chicken soup for the soul complete the ride not top. Also really is because Feng Xiaogang shot, a Director can also have this at the box office? Anyway, I regret it in the cinema to see.",0.791344
20,"扯","Ripped",1
20,"抄段子什么的倒没感觉 就是觉得好无聊啊 好笑的地方还是有的但是冗长乏味居多 最后那段道歉为了升华主题也太无病呻吟了吧","Copy piece of what pour don't feel is feel good boring Ah funny. the place is still there however tedious the majority of that last paragraph to apologize to sublimation theme too making a fuss.",0.801234
