"ranking","Chinese.origin.data","Yandex.translated.data","Baidu.English.sentiment.analysis.postitive.probability.base.on.Yandex.translated.data."
20,"照这样拍下去电影也太好拍了，三个段子拼在一起再整个违合的鸡汤结尾，我也会啊。容易看明白导演试图讽刺什么，观众不是傻子。但观众也在乎诚意，而这植入日益赤裸甚至连完整故事都讲不好的作品实在令人失望。所以导演您那几条微博也就真有些可笑了。","As such beat goes on the movie is also too good to shoot, and the three piece the pieces together and then the whole contrary to the engagement of the chicken broth at the end, I will also. Easy to see the Director trying to satire what, the audience is not a fool. But the audience also cares about good faith, and it implanted an increasingly naked and even complete stories all speak of Bad works is really disappointing. So the Director you that a few tweets will really some ridiculous.",0.900865
20,"片头和第一段的荒诞感还是营造得不错的，况且把苏州一人工湖拍那么美的确不容易。二三两段明星和广告扎堆，故事太碎，最后朗诵简直莫名其妙。所谓两脚不沾地，是自嘲吧。","Titles and the first paragraph of the absurd sense, or make much good, and besides, the Suzhou an artificial lake shoot so beautiful indeed is not easy. Two-three period of the Star and advertising get together, the story is too broken, the last recitation was simply somehow. The so-called two without touching the ground, is self-deprecating.",0.847752
20,"片子虽烂，但那首歌还多好听的。。","The film, although the rotten, but that song also nice..",0.781631
20,"片子虽然讽刺玩得蛮好，但是太不连贯了..给.三个故事的主演点赞，但是片子怎么都觉得像学生作品的结构，两星不能更多...","The film, although satirical play was pretty good, but too choppy..to. Three stories starring the likes, but the film, how all feel like a student structure, the two stars cannot be more...",0.767846
20,"片子还是挺烂的。我虽然喜欢环保话题，但是这部电影最后用刻意可最后又戏谑的感觉来演让我觉得很难受。电影本身也没啥意思，瞎胡搞。冯小刚就是个大煞笔","The film was quite rotten. Although I like the environmental topic, but this movie finally with deliberately may last and banter feel to play makes me feel very uncomfortable. The movie itself also doesn't mean blind playing with it. Feng Xiaogang's a big fucking assholes!",0.841596
20,"片尾环保那部分挺好，两个配乐也挺好，其他一般般，","Credits eco-friendly that part is good, the two the soundtrack is also very good, other General,",0.836234
20,"片段式结构，开头还不错，就当是甲方乙方续集看，也还会满怀期待。第一段范伟的故事稍见诚意，往后开始一路走低，到最后的道歉片段简直忍无可忍，真的是恶心了观众，成全了自己！其实观影前就做好了看烂片的准备，不怕俗，就怕装。冯大导演，你在吃老本捞钱，以为观众都是弱智吗？","Fragment-type structure, the beginning is also good, when is the Party a party b the sequel to see, but also will look forward to it. The first paragraph of fan Wei story slightly to see faith back to start all the way down to the end of the apology segment is simply intolerable, it really is disgusting the audience, all by yourself! In fact, the concept of the shadow in front do well to see a bad film at the ready, not afraid of vulgar, afraid clothing. Von Director, you in the laurels make money, that the viewers are retarded?",0.812892
20,"牵强","Far-fetched",1
20,"特特空空","Tete empty",1
20,"狗尾续貂版甲方乙方2，当时甲方乙方是造梦的尽心尽力，做梦的深陷其中，到这儿变成双方时刻保持冷静，生怕着了对方的道。您这演戏的都不入戏，让我们看戏怎么能觉得有意思，最后造成全场下来很难爽快的笑出一声。冯导，您不是最反感在贺岁片说教吗？怎么现在一次比一次语重心长，然后不接地气草草了事","Towards the end of version Party a party B 2, then Party a party B is the dream of dedication, dreaming deep which, to the Here into the two sides to keep calm, for fear of the other side of the road. Your this Act are not into games, let's watch how can feel interesting, and finally caused the audience down hard refreshing and laugh out loudly. Von the guide, you are not the most offensive in the surreal sermons? How now than the last earnestness, then do not ground gas rushed",0.800281
20,"王朔年轻时挺好一老头只得瑟不愤青怎么临了老了老了成大愤青了呢。。演的也不行，我想乐都乐不出来","Wang Shuo young when the good one the old man had Joseph not angry youth how to Pro the Old the old into a big cynical the. Played also not, I think instrumentals are the music does not come out",0.791295
20,"王朔还是以前的王朔，小刚还是从前的小刚么？后者早已成了中国第一位10亿导演，以及下一届春晚的导演。不知道是不是这些原因，这部花里胡哨的小品集合可以说是完全没有灵魂，只有第一个范伟的段子还将就有点笑点，之后的李成儒完全不知所云，宋丹丹的段子更是无厘头的催泪，时代变了。","Wang Shuo or ago of Wang Shuo, the small just or from the front of the small just? The latter has already become China's first 10 million the Director, and the next session of the show Director. Don't know if these reasons, this portion of the bells and whistles of the pieces of the collection can be said to be completely without a soul, only the first fan Wei's piece will also be a bit of a laugh, after the Li Confucianism completely incomprehensible, song Dan Dan, the piece is nonsensical tear, times have changed.",0.857798
20,"王朔这个傻逼，能写出来什么好东西。整个电影整的很几个微电影凑的一样，想表达讽刺的东西那么多，但是每个都没觉得能让人共鸣，说你拍的不好你还逼逼骂街，本来就不咋地你有什么可鸡头白脸的。白百合这身材，啧啧，该有C了吧，口水。。。","Wang Shuo this asshole can write anything good. Throughout the movie the whole of the very few micro movie along the same, want to Express the irony of something so much, but each didn't feel able to make people resonate, say you shoot the bad you are also forced to make squalling, already. what do you have to chicken head white face. White Lily this figure, Gee, The have C it, drool on...",0.849696
20,"王朔那一套东西还停留在上世纪90年代，完全跟这个时代脱节，已经过时了。。郑恺还不错，么么哒~","Wang Shuo that set of things is still stuck in the ' 90s, complete with this era, out of touch, outdated. Zheng Kai also good, meme da~",0.83645
20,"现在拍好电影的导演都被封杀了，剩下的，也就敢拍拍扯淡的电影了。别拿1942说事儿。复刻历史谁不会啊，老男孩用了多少投资，有时候你用心不见得就能弄出好东西，不过大环境也就这样了，前阵子看了许愿在回头看看这几年的中国电影，呵呵","Now make a good film Director is killed, and the rest, also dare to clap crap movie. Don't get 1942 to say. Xtreme history who will not Ah, old boy, how much investment, sometimes your intentions don't will be able to get out of the good stuff, but the environment also so, a while back saw the wish in the look back at the years of Chinese film, huh?",0.777504
20,"用一个贺岁的名义，向过去致敬，或许是这部电影唯一的借口和看点。纵观全片，确实有些现实的影子和教育的意义。但缺乏新意，却是这部电影最大的硬伤。当一个导演只能通过抄袭自己的过去来证明自己时，或许就是江郎才尽的时候吧","With a new year in the name of the last tribute, perhaps, is this movie only an excuse and see the point. Throughout the entire film, and indeed some reality to the shadow, and educational significance. But the lack of new ideas, but it is this movie The biggest hard injury. When a Director can only by copying their own past to prove themselves, maybe that's run out of ideas.",0.800074
20,"用力过猛","Overexert",1
20,"甲午","Jiawu",1
20,"甲方乙方 是那个时期不错的贺岁片 私人订制已经跟不上趟 其实这些电影不如80年代的 顽主","Party a party B is a that period nice surreal private custom has been keep up with the times in fact, these movies not as good as the 80's coercive main",0.860788
20,"甲方乙方2013商业版 期望越大失望越大 我曾以为葛优是男主角 可事实上我找不到电影的核心意义在哪 电影整体不明觉厉 再次印证了 票房好的电影未必是好电影 穿警察衣服的未必是警察.","Party a party B 2013 Business Edition expectations the greater the disappointment the greater I used to think that GE you is an actor in fact I can't find the movie The core sense in which the movie overall thank once again confirms the box office good movie is not necessarily a good movie to wear police clothes is not necessarily the police.",0.852326
20,"甲方乙方中第一次看到圆梦团队，感觉创意有趣，而且故事发展非常自然流畅，主题内容很温馨。私人定制采取同样套路，但根本无法相比，讽刺显得刻意了些。","Party a party B for the first time to see the dream team, the feeling of creative fun, and the story development is very natural and smooth, the subject matter is very welcoming. Private custom take the same routine, but simply can not be compared, the irony seemed deliberate.",0.797566
20,"甲方乙方是一部电视电影的试验性作品。那私人定制就是冯导的春晚电影试验作品 它已沦落到和春晚一样抄过时流行语与段子的境地 并像春晚一样布满了商标。最大缺陷是 它的分段模式生硬掐断观众的观影体验 使电影句不成篇 像一部小品合集。不予评分 因为它不是电影。","Party a party B is a TV movie pilot works. That private custom is von guide of the gala film of the test piece which had sunk to and the show the same reading outdated catchphrases and jokes of the situation and like the Spring Festival Gala, as covered with the trademark. The biggest drawback is its segmented patterns curt cut off the audience's viewing experience to make the film sentence not post like a small collection. No score because it's not a movie.",0.758273
20,"甲方乙方智障版。吃惊的是家乡人民的消费能力，买原价票，吃天价爆米花，大晚上的人手一杯星巴克，怕失眠的也要喝依云。ps：团购取票之麻烦，期间看到的t可以绕索菲亚教堂两圈了。","Party a party b The retarded version. Surprise is the home of the People's consumption capacity, buy the original price of the ticket, eat the high price of popcorn, a big night of hands a Cup of Starbucks, afraid of insomnia also want to drink Evian it. ps: buy the tickets of the trouble during the to see the t can be rotated about the Sophia Church two laps.",0.862185
20,"电影不错，观影体验也蛮好……只是太让人失望，尤其是最后一段。","The movie is good, the viewing experience is also pretty good...... Just too let people disappointed, especially the last paragraph.",0.826478
20,"电影名字不错~~","The movie is a nice name.~~",0.890676
20,"电影实在太欺负人了。。。就和春晚开篇那个洗脑短片一样不负责任，谁给你的权力借群众之口说春晚可以瞎逼烂，反正大伙也是瞎逼看，您可以自我感觉良好，但是不允许您把我们都假想成臭傻逼然后显得您自己搁那儿还挺美，完后还要用卑劣的手法给我们洗脑让我们觉得自己就是臭傻逼，这就太胡闹了","The movie is really too bully people. And the show opens with the brainwash short film as irresponsible, who gives you the power to borrow masses of the Port, Said the Spring Festival Gala can be blind forced rotten, anyway, and everyone is blind forced to see, you can feel good, but does not allow you to we are imaginary into a smelly cunt and then look at your own shelves there also quite American, after also want to use underhanded tactics to us brainwashed so we feel that smelly sucker, it's too fucking around.",0.806987
20,"电影就不做评论了，故事都没讲好，其他的就甭谈了，倒是看出了现代人们的追求，无外乎有钱有权有品位，最好还能和公益事业挂上边，从而达到所谓精神的升华，可惜冯导这次玩砸了~","The movie does not do reviews, the story didn't speak good, the other is never talked about, it is seen that the modern people pursue, no less than the rich have the right to have a taste, it would also be and welfare hang in the upper side, so as to achieve the so-called spirit of sublimation, pity von Guide This play smashed~",0.865626
20,"电影整体上给人一种很零碎的感觉，不连贯。导演编剧理想太过丰满，现实又太过苗条，想要体现出一点深意，结果怎么看都是哗众取宠，想弄得文艺，最后又免不了插进去一堆广告，不伦不类。 开头廉政片，热按后是精神治疗病篇，中间插播下广告，片尾突然主题上升到环保教育片。还是地心引力比较好。","The movie on the whole gives a very fragmented feel, is not consistent. Director screenwriter ideal too plump, reality is too slim, want to reflect a little of the deep meaning, the results to see How are grandstanding, trying to get Devon Arts, and finally and inevitably inserted to a bunch of ads, neither fish nor fowl. At the beginning of the integrity of the sheet, the heat press is the spirit of the treatment of disease, intermediate spots under ads, the credits suddenly the theme to rise to the environmental education piece. Or gravity is better.",0.838057
20,"电影末尾的几条短片很好，从文字到画面，够文艺，够小清新。。。比电影本身好看多了。","The movie at the end of a few short films is good, from text to screen, enough art, enough fresh and... Than the movie itself look good.",0.792465
20,"电影结束后，观众们在一片沉默中走出影院。我问唐同学：你觉得这片儿怎么样？唐同学：我觉得这是部yibidiaozao的电影。我：我难得有一次和你意见一致。","After the film, the audience in silence out of the theater. I asked don students: do you think of this piece? Tang students: I think this is the portion of the yibidiaozao movie. Me: I come once and you are in agreement.",0.759347
20,"电影背后的故事值得关注，社会的三观，导演的三观，原来就是为了mini和海南的旅游吧，当年的甲方乙方再也不会看见了吧，最后是怎么个意思，不如做正片~~","Movies the story behind worthy of Attention, The Society of the third concept, the Director of the third concept, the original is to the mini and the Hainan tourist bar of the Year party a party B never saw it, finally, is how a meaning, it is better to do a positive piece~~",0.863708
20,"电影逻辑很清晰，社会上三个矛盾对象，贪官烂片导演和暴发户，看上去是他们烂，但实际前两者是群众自己孕育出来的，暴发户比穷人更辛苦可怜，风光都是表面上的。所以，矛盾激化到影响生存的环境问题时，别抱怨别人抨击社会，多吸点正能量鸦片就一切美好了。不知道冯导是正经说事，还是高级黑正能量大法","Movie logic is clear, society three contradictory object, the corrupt rotten film Director and the Nouveau riche, look like they are rotten, but the actual first two are the masses themselves bred out, Nouveau riche than poor people more hard and miserable, scenery that are on the surface. So, the contradictions sharpened to affect the survival of the environment problem, don't complain about someone else bashing social, multi-suction point of positive energy opium is all good. Don't know von the guide is a serious say things, or premium black, positive energy Law of the",0.895782
20,"电影院里就坐了四个人，挺好，我喜欢人少。.宋丹丹演的最自然。.不带感情色彩的给了两颗星，这片子在家看足够了，如果不是电影票不要钱绝对不会特地去影院看。","The cinema seated four people, very good, I like the person less.. Song Dandan played the most natural.. Without the emotional had given two stars, this film at home and see enough, if not movie tickets, not money definitely won't specially go to the cinema to see.",0.868162
20,"电影院里有没有笑声，绝对不是鉴别喜剧是否成功的标准。 这部电影的笑点都是在硬挠你，大部分人会笑，因为他们是看春晚都合不拢嘴的。其他人应该是真的会被恶心到。  尤其是最后还拿热爱大自然的环保概念泼你一脸。  观影建议，租dvd。","The cinema there is no laughter, and absolutely not the identification of the Comedy of the success of the standard. This movie's punchline is in the hard flexible you are, most people will laugh, because they are watching the show are from ear to ear. Other people should be the really will be sick. Especially the last also get the love nature environmental concept to splash your face. Viewing recommended to rent a dvd.",0.786273
20,"电视上看的，降低了期待感觉竟然还行。范伟那个及格，后来一路下滑。宋丹丹孤身回家那个镜头不错，雅俗那个烂到家了。","On the TV to see, reduces the look feel even. Fan Wei that pass, then all the way down. Song Dandan unaccompanied home that the lens is good, YASU that rotten home.",0.764565
20,"疯子越狱那里我还挺好忽悠的笑了几声，范伟结束后就彻底不接地气了，中国电影电视剧大部分都是让人听相声，这个直接就是几个段子凑着玩命恶心你，尤其最后对着什么天啊地的道歉，我都替演员尴尬。","Madman escape there I also good Fudge laugh a few sound, fan Wei after the end of the completely ungrounded gas, Chinese movies dramas most of all is to let people listen to the comic, this is a few scripts to scrape the play-life of nausea you, especially the last of what God, in apology, I'm all for the actor embarrassment.",0.795066
20,"白小姐对着雾霾装深情装痛心疾首的时候，我是真心笑了，仅此而已。我不高山白雪，不文艺装逼，一年到头就盼个贺岁片能让人乐乐，在一片众骂声中也要坚持为票房做贡献。结果证明预告是忽悠人的，豆瓣人民眼睛是雪亮的。还是要一星给葛大爷，我是你脑残粉，回去看甲方乙方去了。","The white Lady of the haze mounted soulful mounted bitterly the time when I was really laughing, that's all. I don't Alpine snow, not theatrical loaded to force, and throughout the year on the hope of a surreal can make people happy, amidst all scold sound, but also to adhere to the box office to make contributions. The results proved that the notice is a bluff, watercress peoples eyes are sharp. Or to be a star to GE uncle, I'm your crazy fan, go back and look at Party a party B to go.",0.780805
20,"白痴","Idiot",1
20,"白痴冯小刚","Idiot Feng Xiaogang",1
20,"白百何和李小璐都很好看，演员的表演还是值得称道的。问题是编剧和导演总是摆出一副给群众上课的架子，实在是让人受不了。很过气的感觉，很假的感觉，确实没法看下去。唯一搞笑的是在夜总会那段，妈妈咪和小姐、公主真艳丽啊！","White hundred what and Li Xiaolu are very nice, the actor's performance is still commendable. The problem is the writer and Director always put on a pair of to the masses the lesson of the shelf, is really make people can not stand. Very old feeling, very fake feeling, really can't see down. The only funny is in the nightclub that paragraph, Mamma and miss, the Princess really is gorgeous!",0.934393
20,"白百合戏还行，天然俗，知行合一，表里如一。王朔的剧本也挺好，可惜时代不再，又加上冯扭捏造作的庄谐糅杂及自我治愈，最后就变成了2013春晚小品联播。","White Lily game also, naturally vulgar, and known line unity, and what they seem. Wang Shuo's script is also very good, unfortunately the times are no longer, and plus Feng tweaking pretentious Trang tuned within hetero-and self-cure, and finally it becomes the 2013 Spring Festival Gala skit hookup.",0.81605
20,"的确不好看，看得我快睡着，跟扫毒和风暴没得比，虽然这两部不见得非常好！","Does not look good, look at me fast asleep, with the antidrug and the storm didn't have a ratio, although the two are not very good!",0.864019
20,"的确就是不懂电影的路过，我就会看电影！除了第一个段子搞笑 并且有反讽意味之外，后面两的确没有凸显冯导的特色，并且感觉再凑时间的感觉；最后一个环保的 我感包票 么有起到警示环保的作用，因为太做作了！另外我就是豆瓣的大尾巴狼，你TM能拿我怎样，本来都不想评的！真是，让人操心","Indeed just do not understand the movie passing by, I will see the movie! In addition to the first piece of the funny and irony mean outside, behind the two did not highlight von guide features, and feel and then scrape together the time feeling; and finally a green I'm feeling way or another it has played a warning to the environmental role, as too contrived! In addition I was the watercress of the big tail wolf, you TM can get how I, originally don't want to review! Really, let people worry about",0.800207
20,"的确没有骂得那么烂，但是也的确并不怎么好看。宋丹丹那段还不错，主要是歌好。最后那段向大自然道歉，拍成个公益片或许还好，放在这微电影里是什么节奏嘛。。","Indeed not scold so bad, but did not how to look good. Song Dan Dan that are also good, mainly is the song good. That last segment to the nature of apology, and made into a public piece, perhaps fortunately, put in this micro-movie is what rhythm.... and",0.817491
20,"看之前就告诫自己不要被已有的恶评所影响，尽量祛除自己的有色眼镜。看完之后着实觉得期望大于失望。不过觉得里面的讽刺意味还是很浓的，观众若缺乏一定的艺术圈和经济圈里的已有潜规则，可能就比较困难地理解冯小刚的梗在哪。之所以异于1棵星正在于此。","Look before telling yourself not to be has some bad reviews, try to get rid of their own colored glasses. After reading really feel desired is greater than the disappointment. However there inside of of irony is still very concentrated, the audience if the lack of a certain art circles and economic circles have unwritten rules, it may be more difficult to understanding of Feng Xiaogang Terrier. The reason why ISO-to 1 tree the stars are in this.",0.777849
20,"看之前被人告知还不如富春山居图，看完还是要为其平反一下：还是好富春很多地！毕竟富春的烂片地位不可动摇。不错的广告合集，最后一段公益广告最为出彩.哈 哪有拍片向自己的作品致敬的啊","See before being informed might as well fuchun mountains, reading still have to for its vindication: or good rich spring very much! After all the rich spring of the rotten sheet status unshakable. Good advertising collection, the last period of public service ads the most out of color. Ha, what film to their work salute.",0.879852
20,"看了一场针砭时弊反讽现实问题的不带明确主题混乱大杂烩式的相声纪录片兼具的教育片儿~一特出名导演导的，你们都认识，但风格我不太敢认了~结尾觉得海南岛人口还不够多，又宣传了一把那里的空气~看完多了份情怀，怀念甲方乙方...","See a mirror for the ills irony of the reality of the problem without a clear theme of the chaos of a Hodge-podge of comic documentary both educational piece~one of the outstanding Directors guide, you all know, but the style I'm not too afraid to admit to the end but the Hainan Island population is not enough, and publicize a put where the air~after watching many parts of the feelings, remember the Party a party B...",0.76294
20,"看了三次开头终于看完了，完全无笑点，拖沓的节奏简直睁不开眼了，影片后阶段想走温情路线，我真的瞌睡的不行了。葛优白百合宋丹丹啥的演技不错，只是角色无感。","Looked three times at the beginning finally finished, completely without humor, procrastination rhythm simply open eyes, the movie later stage want to go warmth route, I'm really sleepy to die. GE you, white Lily of the song, Dan Dan what the acting is good, the only role of non-sense.",0.790856
