"ranking","Chinese.origin.data","Yandex.translated.data","Baidu.English.sentiment.analysis.postitive.probability.base.on.Yandex.translated.data."
10,"甲方乙方还能感觉到意外，这一步我看的时候提着心害怕他出意外，感觉情节很假，观众还没入戏电影片段一个个结束！就是为了赚钱，糊弄观众！无耻，冯倒！！！","Party a party B also can feel unexpected, this step I look at the time to mention the heart afraid of his accident, and feel the plot is fake, the audience is also not into the drama of the movie clips one by one to the end! Is to make money, to fool the audience! Shameless, he poured it!!!",0.831937
10,"电影不知所云~~~垃圾制作~~","Movie unintelligible~~~waste production~~",0.853603
10,"电影在短短120分钟里面，想要传递太多很深沉很有层次的东西，富与贵、雅与俗、贪与廉、自然与人类，但也正是如此，才根本不能表达清楚。很多东西都仅仅是一笔带过，用结论来代替过程，空洞又乏味，既不能让人开怀一笑，也不能发人深思。笑点用各种一句话段子支撑，这是电影不是脱口秀。","Movies in just 120 minutes inside, want to pass too many very deep very there are levels of things, the rich with expensive, elegant and vulgar, the greedy and the cheap, natural and human, but it is also true, it simply can not be expressed clearly. Many things are merely a passing, with conclusions instead of the process, the empty and boring, neither to make people laugh, but also can not be thought-provoking。 Laugh with various word piece support, this is a movie not a talk show.",0.729845
10,"电影本身没啥意思，三个故事无比俗套，勉强加些社会热点段子，可惜都是老段子，早就没有笑料，最后再来个俗套的煽情，总之一切都是大家在网上已经见过的，还有最后一辆车的笑话，也太老了，整个就是炒剩饭。讽刺的俗套而没深度，越发让人觉得导演的肤浅！另外：看到第三个故事时睡着了。。。","The movie itself is not what do you mean, three stories of incomparable threadbare, barely add some hot social piece, unfortunately it is an old piece, already without jokes, then finally to a formulaic sensationalism, in short, everything is everyone online has seen, and the last car of the joke, also too old, and the whole is fried leftovers. The irony of the cliche and the didn't depth, more let a person feel the Director's superficial for! Also: see the first three stories when asleep.",0.86171
10,"电影里没有任何一个角色立的住，梦想公司所有人都像一个人的分身说话，然后来寻梦的人都像神经病，唯一不像神经病的宋丹丹，居然是被强制来实现梦想的。立志要改革春晚的冯导演，在电影里几乎把最差春晚的毛病全学会了，一堆没有任何理由来来去去的演员，各种植入的景区和品牌，当然还有絮叨的说教","The movie does not have any one character that lived, the dream company of all the people are like a person's avatar to speak, and then to dream of the people are like crazy, only unlike neuropathy, song Dan Dan, actually, is being forced to achieve a dream. Determined to reform the Spring Festival Gala Feng Director, in the movie almost the worst show of wrong with the whole society, a bunch of no reason to come and go to the actor, the various implanted areas and the Brand, of course, the babble of preaching",0.770845
10,"白百合怎么不去死一死！！！冯导大清早地连发微博，泼妇似的骂街行为完美解释了什么是小气，与其怒发冲冠，不如静下心来看看到底是哪里出了问题。大导演听进批评不丢人，这部片子恶评如潮的情况下您还能赚的盆满钵满也算是对您大导演这个名头的认可了。","White Lily what does not die a death! of!! Von the guide early in the morning to even send Twitter, shrew-like squalling behavior is the perfect explanation of what is small, its feeling angry, not the static under heart to look at where exactly is out of the question. The great Director listen into criticism is not a shame, this film bad reviews as the tide of the case you can also earn basin full earthen bowl is full but also be your Director this name of the head of accreditation.",0.768991
10,"盛名之下无虚士，和传说中一样差。奢华拍得不如小时代好看，剪辑神逻辑不如富春山居图颠覆，搞笑不如情景喜剧放得开，思想比公知浅薄那么一点，社会批判性不如李大眼煽动。片名意思是，这是导演编剧订制给每个观众的夹带私货精神文明说教短片集，总有一款教育你，你看我们多深刻。","Known under no virtual disabilities, and legends same difference. Luxury shot was not as good as hour generation of good-looking, clip God logic than fuchun mountains subversive, funny as sitcom open, thought than the well-known shallow so little, the Society of critical as good as the Lee big eye incitement. Title mean, it is Director screenwriter customized to each audience entrained private goods spiritual sermons a collection of short videos, there is always one to educate you, you see us more deeply.",0.819951
10,"相信人民的智慧就好，不要总以为自己被潜规则了。看看人家2001太空漫游，所有人都看不懂8.5分，你这个所有人都看懂了，5.5分，这就是差距。","Believe in the wisdom of the people is good, do not always think themselves to be the unspoken rules. Look at the people 2001: A Space Odyssey, all of them can't read 8. 5, You this all who have read, 5.5 points, which is the gap.",0.803986
10,"看一半的时候我说好困啊，朋友说我也是······","See half of the time I say good sleepy Ah, friends say that I am also······",0.810916
10,"看了这么多年电影第一次在电影院睡着了…剧情没特色 远不及甲方乙方 结尾突兀 演员表现力倒是都很不错","See so many years the film first in the cinema and fell asleep...the plot didn't features far Party a party B end of the awkward actor expressive touches are very nice",0.783896
10,"看了这部电影，以后再也不会花钱去电影院看冯小刚的电影了。不谈电影的艺术性（因为整部影片毫无电影的艺术性），前两段勉强结合网络上的梗还算有笑点，从宋丹丹出场后就可以直接睡到影片结束了。","Watched this movie, later will never spend money to go to the cinema to see Feng Xiaogang's movie. Not to talk about the art of cinema, because the whole movie without the art of cinema, the first two paragraphs barely binding on the network the stems also have a punchline, from the song Dandan played directly after sleep to the end of the film.",0.74039
10,"看出来刚哥最近缺钱缺的厉害，旅游宣传片，会所广告，感觉到了导演的挣扎，想要大雅1942却不赚钱，想要大俗却叫好，可惜已经过了冯氏喜剧的时代，大家笑点都高了，只能凑部明摆着圈钱的戏让愿者上钩了。","Seen to just brother recently lack of money lack of good, travel promos, club advertising, felt the Director of the struggle, want taiga 1942 but did not make money, want a big vulgar but good, unfortunately it has been the von's Comedy of the era, everyone laugh are high, and only getting in portion of the plain ring money games to take the bait.",0.902904
10,"看到一半睡着也够可以了，我只为了纪念下当初三人的美好时光","See half asleep and also able to Can, I only in order to honor under the original three people of the good times",0.730236
10,"看到李咏出来后玩开手机了，实在不忍心再看下去了。内容空洞，搞笑乏力，剧情也不连贯，都是些无事生非的笑点。这电影我看除了出点人力，其他什么钱都不用出吧，拍摄地点都是当地政府友情赞助，道具更不用说了，就算拍出来垃圾，只要放电影院里就是净赚，冯小刚这钱太好赚了！","See Li Yong came out to play after opening the phone, really could not bear to look at anymore. Content empty, funny weakness, the plot is also incoherent, is much ADO about nothing the punchline is. This movie I saw in addition to the point of manpower, what other money are not out of it, the shooting locations are the local government friendship sponsorship, props not to mention, even beat out waste, as long as the discharge of the theater is net earn, Feng Xiaogang this money too good to earn!",0.797685
10,"看到白百合想到瘦小枯干又矮又黑的陈羽凡，就像被狗舔过的大白馒头，再可口也不想要。看到李小璐想到鼻梁和硅胶假体，丰额头加假鼻梁演阿凡达简直不用做造型。看到郑凯想到滥交艳照，刚混出点样就开始抖，艾滋梅毒疱疹可得赶紧治。四个主演只有葛大爷能给两颗星了，还被冯导的白癜风恶心掉一颗，夭寿哦","See white Lily thought skinny withers short and black, Chen Yu who, like a dog licking the large white steamed bread, again delicious also don't want to. See Li Xiaolu think of the bridge of the nose and silicone implants, Feng forehead plus the fake nose play avatar simply does not do styling. See Zheng Kai think promiscuity pornographic, just mixed with a point-like began to shake, HIV / AIDS syphilis herpes may need to get political. Four starring only GE uncle can give two stars, is also von the guide of vitiligo nausea off one, Yao Shou Oh",0.73045
10,"看到第三段直接玩手机了，好在电影院有wifi，不然真是煎熬，想不明白冯导怎么好意思喷影评人喷，很显然冯导脑子跟正常人长的不一样。","See the third paragraph of the directly play mobile, good in the cinema with wifi, or really suffering, does not want to understand Feng guide how the nerve to spray critics the spray, apparently von guide the brain with the normal people long is not the same.",0.824036
10,"看完之后，我想对我那一盆洗好的韭菜说声对不起，我应该窝在家里包饺子的。","After reading it, I think to me that one of the pots a good wash the leeks say sorry, should I nest in the home to make dumplings.",0.745832
10,"看完只想说一句，冯导演，你不爱电影了！起根儿上你就没啥诚意，仗着自己以前的功底，加上王朔个人风格明显的台词，以为演员在阳光明媚的游泳池边露个胸部就可以交差应付，寒了多少冯氏拥趸的心。真是不知道成全了谁又恶心了谁。","After reading just want to the way, von Director, you don't love the movie! From the root of while on you're no good faith, relied on their own previous skills, plus Wang Shuo personal style, apparent lines, that the actor in the Sunny pool and enjoy the exposed chest can cross to cope with cold how many Fung fans hearts. Really don't know the full WHO and nausea who.",0.848894
10,"看完这个，突然觉得小时代和不二神探还不错","After reading this, suddenly feel small and not inspector gadget is also nice",0.79549
10,"看完这部电影（可能还不能称之为电影），真的觉得是成全了别人，恶心了自己。扫毒、无人区、风暴都比这部强，至少这几部看完出了电影院觉得还不错，值了票价，这部看完出来居然和一起看的朋友无语凝噎，吐槽的心情都没了。冯导必将再次遭遇信任危机了，信任这东西一旦失去就很难挽回了。","After watching this movie, probably also not call it the movies, the really feel is the sake of others, nausea yourself. Sweep Poison, no man's land, the storm are than this strong, at least this couple after reading out of the cinema but also good, the value of the fare, this unit after reading out actually and together to see friends speechless condensate choke, tucao mood were gone. Von the guide will once again suffered a crisis of confidence, of trust that something once lost is difficult to restore.",0.881831
10,"看得快吐了，快60岁得了白癜风就不要扯雅不雅俗不俗的问题了，影片比导演本人还丑，王朔也完了，一把年纪还耍贫嘴，还环保意识，呸，整部影片就是凑时长，王朔写剧本就凑字数。","See fast spit, fast 60-year-old had vitiligo don't pull ya indecent vulgar good question, and the movie than the Director himself also ugly, Wang Shuo also done, a age also 耍贫嘴, but also environmental awareness, Bah, the whole movie is Minato a long time, Wang Shuo wrote the script on getting in the word count.",0.802292
10,"看来连冯导也觉得中国人傻、钱多、好挣了，但再傻的人也不会一直上当的。","It seems that even Feng also feel Chinese silly, more money, good make up, but then stupid people would not have been fooled.",0.738158
10,"看电影走心是对电影和创作者的起码尊重，可是这片越走心越糟心甚至恶心。","Watch the movie the heart is the film and the creators of at least respect, but this piece of the heart the bad heart and even nausea.",0.737165
10,"看过的朋友都说烂，要我不要去看。我还以身试法非要看看，结果，第二个故事开始就哈欠连天，丹姐一出来，我就睡着了！还挺香，被一男的接电话给吵醒了，恨得我！起身走人！出了电影院，我抽了自己一耳光，犯贱！","Watched friends all say rotten, I don't go to see. I also Defy have to look at the results, the second story begins on the yawns, Dan sister came out, I fell asleep! Also kind of incense, be a man answer the phone to Wake up, the hate got to me! Get up and go! Out of the cinema, I pumped His a slap in the face, committed base of!",0.843567
10,"看这部片子之前，我一直在想，王朔的编剧，冯小刚回归喜剧，加上葛优，这电影不会差，只是豆瓣太多人装逼，喜欢把自己放在一个很高的位置上，认为接地气的东西太俗，看完我才发现，不接地气的反而是这部片子，从头到尾不知所谓，想标榜着一个正直的观点去嘲讽社会却连槽点都没找好，失望","See this movie before, I've been thinking, Wang Shuo screenwriter, Feng Xiaogang return to Comedy, coupled with GE, this movie is not bad, just watercress too many people loaded to force, is like putting yourself in a very high position on, that the ground of things too vulgar, after reading I have found, do not ground gas. but is this movie, from start to finish don't the so-called, want to flaunt an integrity perspective to the sarcasm society, but even the groove points are not looking good.",0.805129
10,"看这部电影让我找回了初高中时写作文绞尽脑汁凑字数的感觉。","Watching this movie let me get back to the beginning of high school when writing the text trying to scrape the word count feel.",0.737056
10,"真心不好看，心疼钱","Really doesn't look good, and feel bad money",0.740163
10,"真心不好看，至少我感觉全程无笑点，剧情也是甲方乙方2，电影中也是很讨厌矫揉造作的煽情。 非常不喜欢笑点跟煽情都是如此的假和硬搬。。","Really doesn't look good, at least I'm feeling full without the punchline, the plot is also Party a party B 2, The movie is also very hate the artificiality of sensationalism. Very much not like to laugh with sensationalism is so fake and hard to move on..",0.733697
10,"真是差啊！敢把这种超级烂的剧本拍片上映，也真是有胆了，真不怕被人骂！这烂片还用得着编剧和导演？。以后去影院还是该看枪战片或进口大片，即使剧情烂，耳朵也算能享受一下。看来2013最恶心的事看来就是看这个烂片了。","What a difference! Dare to put such a super rotten the script of the film released, it really has guts, and really not afraid to be scolded for! This rotten piece also need the screenwriter and the Director? in. Later go to the cinema or to see a shootout of the sheet or imported blockbusters, even if the plot is bad, the ears too can enjoy it. It seems that in 2013 the most disgusting thing it seems is to see this rotten piece.",0.825684
10,"真是无聊透顶毫无乐趣啊~给最后的环保宣传片打一星当是做好事吧~","Really boring no fun Ah~to the final environmental propaganda piece to hit the one star when it is doing good.~",0.782847
10,"真的，小时代都比这鬼片好看 有这时间不如看两小时微博段子来的爽~","Really, hours of generation than the Ghost piece look good there this time not as good as watching a two-hour Twitter piece to cool~",0.891183
10,"真的恶心到我了，每次看电影都是掏了钱的，花了钱的事儿从来都不半途而废，这次是真正的想半途离场，越看到最后，愈明白了一个道理，当你不喜欢它的时候，做什么都是错的，后续我再也看不下去了，引起了我生理上的反感啊，真的觉得心里想吐啊，可能是看前对冯导是有点期望的吧","Really disgusting to me, every time I see the movie is dig up the money, spend the money. never give up halfway, this time is really want to halfway off the field, the more see the end, the more understand a truth, when you don't like it, do what ever is wrong, the follow-up I no longer see not go down, caused me physical revulsion Ah, really feel want to spit Ah, is likely to see the front of the von guide is a bit desired.",0.758345
10,"真的是五块钱都不值得去看的电影，胡编乱造得一点水平都没有，甲方乙方还能看出点真诚，电影不好看能退票么？也许这样能激励点导演拍点好看的片子吧？总结一这部电影：成全冯导，恶心大家。恶心","Really is five bucks are not worth it to go see the movie, The fabrications got to the point levels are not, party a party B also can see the point of sincerity, the movie does not look good can refund? Maybe this can be the excitation point Director shoot the point good looking film? Summary of this movie: The full von guides, disgusting everyone. Nausea",0.86973
10,"真的烂的不行，糟蹋了好风景","Really rotten no good, to spoil a good view",0.72918
10,"睡着","Asleep",1
10,"睡着了","Asleep",1
10,"瞎","Blind",1
10,"矫情","Hypocritical",1
10,"确实挺恶心的，网络过时段子的一次挖坟运动，演员拼命想展示自己的喜剧天赋可惜愣是半天憋不出一个响屁，全场零星笑声，尿点密集，剧情就像生吃臭豆腐，闻着臭，吃着更臭....观影之后感觉冯导和社会脱节的厉害，都21世纪了，冯导喜剧水准还停留在上世纪八九十年代，怪只怪社会发展太快啊！","Indeed quite disgusting, the network outdated piece of time to dig the grave movement, the actor desperately trying to show their comedic talent unfortunately froze half a day to hold a loud fart, the audience smattering of laughter, urine point-intensive, the plot is like eating raw stinky tofu, the smell of stinky, eating more smelly.... Viewing after feeling Feng guide and social disconnection., century 21, von the guide the Comedy level is still stuck in the eighties and nineties, blame only blame the social development too fast Ah!",0.729741
10,"票买早了，早知道只有5.2分我是不会去买的。今年看过的最脱戏最无聊的电影。连范伟都不搞笑了。要不是左边的大妈一直在排泄出特别臭的臭屁熏得我几次都精神了，我早睡着了","Ticket bought early, I knew only 5. 2 points I'm not going to buy. This year seen the most off the game the most boring of the movies. Even the fan Wei are not funny. If it weren't for the left's aunt has been in the excretion of a particularly smelly cocky smoked me a few times all the spirit, and I early fell asleep",0.807467
10,"私人定制 是当初上映时阴差阳错看到的，对我一个平时不怎么热衷去影院观影的人来说，也算是场缘分。但当我看完的第一反应确实不怎么样，它完全对不起我花的钱，刨去主演，你根本没办法想象这是一个连贯的作品，那种感觉就像是明明不属于这个地方的拼图硬被拼起来一样，除了难受还是难受。。。","Private custom is the original release when accidentally saw, of me a the usual not very keen to go to the cinema concept of the shadow people, can be considered a field of fate. But when I finished watching the first reaction is really bad, it exactly sorry I spent the money, planing to starring, you simply can't imagine that this is a coherent work, that kind of feels like it does not belong to this place the puzzle hard is together same, in addition to uncomfortable or uncomfortable to you.",0.794933
10,"私人定制，冯小刚用很长一段反击了评价他俗的人，有点像赵本山春晚小品反击别人说他俗的感觉。给人感觉很酸很矫情。王朔从痞子变成了文人，少了年轻时给冯小刚写本子的幽默，也少了成名之后送给姜文本子的霸气，反而变得很哲学，很沉思，和冯小刚有点不搭调了。","Private custom, Feng Xiaogang with a long counter for the evaluation of his secular people, a bit like spendin the Spring Festival Gala skit fight back people say he vulgar feeling. Give a person feel very sour very hypocritical. Wang Shuo from the ruffian turned out of the literati, a little young to Feng Xiaogang to write a Book of humor, also a little fame after sent to Mr. Jiang, the Book of the despot, but became very philosophical, very meditative, and Feng Xiaogang is a bit dissonant.",0.79906
10,"私人定制，它带着一张面具，拒绝以真面目示人，所有人都用一种逢场作戏的姿态讥笑别人，以为站在道德制高点，可以批判世俗，调戏他人，奚落人生如梦如影。冯小刚越来越缺少一种艺术创作的灵气，和批判自身的勇气。后者这才是喜剧真正的魅力。","Private custom, it came with a mask, refusing to really show people, all people have a flirtation gesture, sneer at others, the thought of standing on the moral high point, you can critique the secular, molested others, put-downs life is like a dream as shadows. Feng Xiaogang more and more the lack of an artistic creation of Reiki, and critique their own courage. The latter this is Comedy real charm.",0.736486
10,"私人订制，呵呵，成全华宜，恶心观众。俗不可耐的东西搬上荧幕配上大特写的露骨植入广告，故事连流畅自然的穿插转换都懒得想…冯导你真是最俗的导演，最不要脸的导演，没追求和底线了你。别人说你植入，你就植入更多；说你俗，你就连夜总会，钱甩脸都摆上。要不你就有胆俗到底，最后何必","Private custom-made, Oh, the sake of Hua Yi, nausea audience. Vulgar not resistant to the stuff on the screen with a big close-up of a sexually explicit ads, the story connected smooth nature of the interspersed transitions are too lazy to want to...Feng guide you what the most vulgar the Director, the most shameless of the Director, not the pursuit of and the bottom line for you. Others say you implant you will implant more; say you're vulgar, you're night will always be, the money thrown face are placed. Why don't you just have the bile and vulgar in the end, and finally why",0.795475
10,"称之为电影实在牵强，不如看三个小品中间插播一个公益广告，这部电影又是为了冯导以后的大制作赚够资金？整部电影看完感觉导演非常随意，有那么点侮辱观众的意思。","Call it the movie is really far-fetched, it is better to see the three sketches in the middle spots of a public service advertisement, this movie is for von guide the future of big production to make enough funds? The whole movie is watching the feeling the Director is very casual, there is then the point of insulting the audience's mean.",0.768745
10,"穿帮无数","Goof countless",1
10,"突破了看过的电影的下限，假大空和自以为是，恶心到我了。第一次看电影到提前退场，汗。这教训告诉我，千万不要因为片荒就去看一部差片，你会后悔自己的两个小时。","Breaking the seen the film of the lower limit, impracticality and self-righteous, disgusting to me. The first look of the movie to early exit, the Khan. This lesson tell me, don't because of the chip shortage you to see a difference between the pieces, you will regret your two hours.",0.738234
10,"竟然还有评论恬不知耻说这片碰触贪腐高压线？！碰触了智商底线吧！说再多也掩盖不了大烂片的本质。烂得不能再烂！","Turned out there comment the gall to say this piece touches the corruption of the high voltage it?! Touch the IQ bottom line! Say again many also can not cover up the big rotten piece of nature. Rotten couldn't be rotten!",0.788239
