"ranking","Chinese.origin.data","Yandex.translated.data","Baidu.English.sentiment.analysis.postitive.probability.base.on.Yandex.translated.data."
20,"几乎瞎扯了一整部片子，却在最后生硬的认真起来去关注环境向大自然道歉，越发显得前面那些三部曲不仅仅是在恶心自己，还恶心别人了，其实影片制作团体最应该向影迷道歉，他们辜负了6.55亿的票房，真不怪冯小刚都心虚的表示粗制滥造的本片都如此高票房，而精心制作的1942却票房惨淡。","Almost talking an entire movie, but after the last blunt of serious attention to the environment to the nature of the apology, the more appear in front of those of the trilogy is not only in the of nausea yourself, but also disgusting to others, the fact of movie-making groups should be most to the fans an apology, they live up to 6. 55 million at the box office, really do not blame Feng Xiaogang are diffident expressed crudely in the present sheet are so high at the box office, and elaborate 1942, but the box office bleak.",0.900588
20,"分三次勉强看完，段子陈旧，演员做作，说不出的别扭。冯导端着架子说事，早就脱离群众，不接地气了，眼里无外乎权色名利而已。糊弄观众也就罢了，这些戏子们自视甚高的劲头令人很不舒服。接受服务的这些客户，明知做戏，真有快感吗，逻辑上说不通呀。","Three times barely finish watching that piece of stale, the actor contrived, indescribable awkward. Von the guide end of the shelf for that matter, already from the masses, do not ground gas, in the eyes of nothing less than the right color fame. Fool the audience but also on., these. are thinking of momentum very uncomfortable. Accept service of these customers, knowingly put on a show, there really is pleasure?, the logic doesn't make any sense.",0.843842
20,"分段式小品。第一段实在难称讽刺，第二段荒诞却毫无趣味可言，第三段煽情的莫名其妙，我反而最喜欢第四段，用最直白的方式起到最正面的影响。虽然槽点满满，但谁家的苦谁知道，为什么拍私人定制，其实也是明摆着的事儿。","Segmented pieces. The first paragraph is really hard to say irony, of the second paragraph of the absurd but no fun at all, the third paragraph of the sensational somehow, I actually like most of the fourth period, with the most straightforward way to play the most positive impact. Although the slot is full, but who's bitter and who knows, why shoot a private custom, in fact, is the plain thing.",0.776954
20,"分裂的剧本，结尾莫名其妙。广告旅游宣传植入猖狂。三段故事有意思，无奈剧本流于段子堆砌而非真切的生活体验。李成儒像冯导自己，对雅俗的探讨是个有趣的主题但片中对雅的一味贬低令人失望。宋丹丹那段缺少创意，一味摆阔很无聊。李咏苗圃等客串的段落挺多余。所以相对最好的是范伟那段吧","Split the script, the ending somehow. Advertising tourism promotion implant rampant in. Three sections of the story interesting, but the script stream bit stuffing and non-real life experience. Li Cheng RU as von guide yourself, for YASU to explore is an interesting topic but the film for ya blindly belittle disappointing. Song Dandan that period of lack of creativity, just a frill to be boring. Lee chant nursery and other a cameo of the paragraph quite redundant. So the relative Best is fan Wei that period.",0.791675
20,"刚开始苗圃那一段看半天不知道在演什么，好吧，终于看懂了，原来是在演戏。然后看到一半快睡着了，那个大导演那一段特别无聊，总之是部烂片。","Just started the nursery that looked half-day do not know in the play what, okay, finally understand, the original is in the acting. Then see the half fast asleep, and that the great Director that a period of particularly boring, in short, is the Ministry of rotten piece.",0.756594
20,"刚看了点映，真心觉得失望，有冯小刚江郎才尽的赶脚。内容照搬当年的甲方乙方，但包袱笑料却几乎都不响，能让人记住的幽默台词好像也没有。三个故事只有第一个还不错，第二个纯扯淡，第三个打下温情牌。最后还硬生生塞进去一段完全和故事主线无关的人与自然来升华主题，本来蛇就没画好，还添了脚。。。","Just watched point of the map, really feel disappointed with, there are Feng Xiaogang run out of ideas of the best DJ's. Content copy of the Year party a party B, but the burden of jokes, but almost no sound, can make people remember the humor of lines like. The three stories only the first one was good, second one is pure crap, and the third lay a warm hand. Finally, also abruptly stuffed into one section completely and the story line is independent of man and nature to sublimation theme, the original snake just didn't draw well, but also add a feet. it..",0.900131
20,"前两个故事还是可以的，后面简直不知道在讲什么，什么报恩实现当有钱人的原因真是俗死了，还有那个拍最俗电影导演的那个故事特别莫名其妙。給两颗星都多了，不过一颗给葛优一个给白百合吧，超级喜欢他俩。","The first two stories, the back simply don't know in what, and what gratitude when the rich man's reason is really vulgar dead, and that beat the most vulgar film Director the story of the special somehow. To the two stars are many, but one to GE you a to the white Lily., Super like him both.",0.817021
20,"前天去看的首映，基本全场爆满。私人定制的想法不错，故事情节略欠。总体觉着不值票价！","The day before yesterday to see the premiere, basic full full. Private custom idea is good, the storyline is slightly less. The overall feel isn't worth the fares!",0.762276
20,"劣质","Inferior",1
20,"勉强","Barely",1
20,"半夜失眠睡不着看的，疗效不错！ps：辛亏没时间去电影院看。心疼我葛大爷的T_T","The middle of the night insomnia can not sleep see, the effect is good! ps: octyl loss don't have time to go to the cinema to see. Distressed I GE uncle.",0.760697
20,"原来，这不是贺岁片儿，也不是喜剧片儿，是教育片儿！虽然站在电影角度只能最多给两颗，但导儿和编儿的心是好的！","It turned out that this is not the New Year piece, nor is it a Comedy Piece, the education piece is! While standing in the movie angle can be up to two stars, but the daughter and the editor's heart is good!",0.782115
20,"去电影院看第一遍，一脸复杂。去电影院再看一遍，说不定就会觉得好看了。看完还是一脸复杂：怎么还是不好看呢。","Go to the cinema to see the first pass, a face of complex. Go to the cinema to see it again, maybe it will feel good. Reading or a face of the complex: how or not to see it.",0.789054
20,"去看私人定制顺便换了个小黄人的卡套。其实这片子要是没有末尾那15分钟还是可以打三星的。看来冯小刚也有雅过敏症，不加个莫名其妙的结尾就不舒服。王宝强打得一手好酱油。宋丹丹那段也不错。","Went to see private customized by changing the minion's card sets. In fact, this film if not at the end of that 15 minutes or can play Samsung. It seems that Feng Xiaogang also got ya allergies, without a somehow the end of it uncomfortable. Wang Bao strong to give a good sauce. Song Dandan that is also good.",0.869665
20,"反刍只适合牛，不适合人，看甲方乙方的时候挺喜欢的，觉得很新颖，现在把这个题材又拿出来挖，而且加入很多政治意味，看起来就是那么是滋味了。但宋丹丹在圆梦过后的那段戏很喜欢很喜欢，演戏太走心了，台词掌控恰到好处，尤其在车里拿湿巾擦掉脸上妆的动作，细节处理的很好。","CUD fit only for cattle, not suitable for people looking Party a party b of the time like, there is a novel, and now take this theme and come up to dig, and added a lot of political undertones, the look is so is the taste. But song Dan Dan in the dream after that period of play it like it like, acting too take heart, the lines of control just right, especially in the car to get wipes to wipe off the face makeup on the action, the details of the deal very well.",0.754248
20,"反正全程我是一次也没笑过，这种私人定制有些牵强了，远不如当年的甲方乙方。这哪是在圆梦，分明是让梦想与现实更加鲜明的对立。","Anyway, the whole I was once did not laugh, this private custom far-fetched, far better than the Year party party. That which is in the interpretation of dreams, clearly is to let the dream and the reality more stark opposites.",0.760596
20,"发现预告片都挺好的阿~","Found the trailer are very good Ah~",0.863033
20,"只拍最后那几分钟公益就够了，没准还有人夸~没给一星的理由是，想要引起本人强烈的反感并不容意，但这片子做到了······","Just shoot that last few minutes of the public good enough, maybe there are people who boast that~didn't give one star the reason is, you want to cause I strongly dislike is not the content intended, but this film did it.······",0.877951
20,"只是阵容不错而已，当真正看的时候才发现剧情无聊到看不下去，最后直接在煽情，唉！","Just lineup good only, when the real see the time only to find the plot boring to watch does not go, and finally directly in the sensational, alas!",0.76483
20,"只有歌好听","The only song nice",0.763931
20,"只有范伟和宋丹丹那段好点。其他好无厘头啊。","Only fan Wei song Dandan that good point. Other good nonsense.",0.767843
20,"只有范伟的那个part好看剩下的简直看不下去 但是呢 和喜欢的人一起 看白纸都能看出花儿来 哈哈","Only fan Wei of the one part look good and the rest simply could not stand however. and like the people together to see the white paper can be seen in the flowers to lol",0.824416
20,"只觉得最后十分钟环保宣传片拍的不错，至于前面的剧情基本都是一些没有营养的笑点，在电影院看有点亏！","Just feel the last ten minutes of the environmental propaganda film shot good, as for the previous plot are basically some no nutrition to laugh in the cinema to see a bit of a loss!",0.75711
20,"可悲","Sad",1
20,"可惜了可惜了","Pity pity",1
20,"可看性不高，但是三个故事都是在解读当下人们得心态，说教育意义又有些肤浅","As can be seen resistance is not high, but the three stories are in the interpretation of the moment when people have the mentality, education significance and some superficial",0.755489
20,"可能没有结尾我会给四星。本来挺接地气一导演现在双脚离地了。莫名其妙的结尾毁在自以为是的想要传达点高深的东西。接地气就一直接下去吧。大俗即大雅。冯导自重","May not be the end I will give four stars. Would have been quite ground gas Director now feet off the ground. Somehow the end of the destruction of the self-righteous want to convey the point of advanced things. Ground gas has been the next to go. Large vulgar that Daya is. Von guide weight",0.753325
20,"台词在故作深奥,表演在刻意把人往笑上引.反正个人不是很喜欢,勉强可以看,和<<甲方乙方>>差得远了.杨重和马青两人物名字就是跟定了<<顽主>>,但除了拍摄技术,都不及<<顽主>>.","Lines in pretending to be esoteric,performing in deliberately taking people to laugh on the lead. Anyway personally not very fond of,can barely see,and<<party B>>far from it. Yang heavy horses and green two-character name is specified.<<coercive master>>,but in addition to shooting techniques,are not<<the coercive master>>.",0.772409
20,"名副其实的炒冷饭，笑果比甲方乙方差很多。而且故事推进给人感觉全靠对白，看的人很疲劳，好多场面完全靠演员表演撑着。片尾的心灵鸡汤搞得有点反胃。凑热闹和小伙伴们看看还成，总之比春晚好看就是了。","Literally a rehash, laugh fruit than Party a party b a lot worse. And the story of the advance giving the impression that all the dialogue, look at the person very fatigue, a lot of the scene relies entirely on the performers. hold on. Credits of the chicken soup for the soul got a little nausea. Join in the fun and small partners to look further into, in short, than the show look good.",0.871889
20,"向甲方乙方致敬的失败烂片，由内而外地感觉到冯小刚在1942后的倦意与失落。想传达的对现实的讽刺与说教太杂太乱，最后干脆沦为了欣赏白百何李小璐不辨真假的胸和腿。","To party a party B to pay tribute to the failure of the rotten sheet, from the inside and outside feel Feng Xiaogang in 1942 after somes and lost. Want to convey the reality of the satirical and didactic too complex too messy, and finally simply degenerated into the enjoy white hundred what Li Xiaolu do not distinguish between true and false chest and legs.",0.825787
20,"听说这电影挺烂的，于是抱着怀疑的态度走进了电影院。。果然是真的，唯一出彩的就是范伟了。电影烂是烂，但是冯导人气高啊，座无虚席，估计大部分人跟我的目的是一样的，烂也有人看，怪不得冯导骂影评人呢。你们确实是没有资格骂，但是我有啊~~","I heard this movie's pretty bad, so hold a skeptical attitude went into the cinema. it. It really is true, only the color is fan Wei. Movies rotten is rotten, but von guide high popularity Ah, Packed, estimated the majority of people with my purpose is the same, rotten also someone see, no wonder Feng turned to scold critics. You really are not qualified to criticize, but I have.~~",0.767204
20,"呃","Uh",1
20,"呆若木鸡 毫无生气","Transfixed lifeless",1
20,"呵","Heh",1
20,"呵-呵","Uh-uh",1
20,"呵呵呵呵","Hehehehe",1
20,"呵呵呵呵呵呵呵呵","Huh huh huh huh",1
20,"呵呵呵呵呵呵呵呵呵呵呵呵呵","Huh huh huh huh huh huh huh",1
20,"和爹娘一起看的。觉得没甲方乙方好看。就色诱这点来说，甲方乙方里刘蓓甩着水袖唱着戏曲美极了，这里就只有李小璐整容脸和挤奶露肉。时代变了诶。宋丹丹篇结尾那首歌真好听喂！结尾的环保那段太突兀好做作。从片前到片尾都是广告。反正就是百度影音看才划算啊。","And parents watch together. Don't think Party a party B to look good. You seduce this point, Party a party B in Liu bei tossed poke fun at martial roles singing Opera beautiful, there is only Li Xiaolu cosmetic face and milking the exposed meat. Times have changed eh. Song Dan Dan article the end of that song is really nice! At the end of the green period too obtrusive well contrived. From the sheet prior to the credits is advertising. Anyway, that is Baidu video watch the only a deal.",0.92585
20,"和荒诞/喜剧等词基本扯不上关系，也实在很纳闷为什么非得割裂为三段，还要搞个标题，恶不恶心？珍爱网和海南宣传也太红果果了吧？公益朗诵实在欣赏不来，葛大爷那pose确定不是威士忌广告？一开始还算很自然的笑点从遮着点表和朋友圈开始变成烂梗集合。唯一的看点变成了四位同事的时装秀和暧昧关系。","And the absurd/the Comedy of the words basic pull not on the relationship, but also really wondering why does it have to split into three sections, but also to engage in a title, the evil is not disgusting? Cherished network and Hainan publicity too red fruit? Public recitation of the really enjoy not to, GE uncle that pose determine not a whiskey ad? The beginning is also very natural laugh from shielding the point of the table and the circle of friends begins to turn into a rotten Terrier collection. The only watch point into the four colleagues of the fashion show and not.",0.843788
20,"哎，我一度怀疑豆瓣，心想冯导的贺岁喜剧怎么可能低到6以下呢，带着赌一把的心态走进了电影院，期间走神无数次，玩手机n次，看时间n次~结论豆瓣还是客观的。就宋丹丹那段还好看一点，我给2星就是冲着明星阵容，要不1星都多","Hey, I once suspected watercress, thought von guide of New Year Comedy how may be as low as 6 below it, with the gamble of mentality went into the cinema, during the distracted numerous times, play mobile n times, look at the time n-th~conclusions of watercress or objective. You song Dan Dan that's okay see, I give 2 star is the Star of the lineup, or 1 star.",0.790512
20,"哪里是什么电影啊，就是段子里面加广告，很明显春晚的前奏。三个段子分别是关于当官的、俗导演、中国大妈，再整一个环保的结尾，煽点情，还是冯氏喜剧，但这次没有故事，只有段子，核心还是他最擅长的，只是看不到创作的诚意。很明显这就是逗乐的俗作品，说的很明白，你乐了，我把钱挣了。","Where is what movie Ah, is the piece inside the plus advertising, it's obvious the show's Intro. The three piece are on when the officer, a customs Director, China aunt and then the whole a environmentally friendly the end, fanned the point of love, or Feng's Comedy, but this time there is no story, only a piece, the core is still his best, just can't see the creation of goodwill. Obviously this is what amused the vulgar work, said very understand, your music, and I put the money to earn.",0.854474
20,"唉，冯小刚","Alas, Feng Xiaogang",1
20,"唉~~~亏了因为各种事没去电影院看，真不值得看，团购都浪费","Alas~~~thanks for various things that didn't go to the cinema to see, really not worth watching, buy all the waste",0.770623
20,"唔……电影院的空调好足啊~~~我都淌汗了！！！暖宝宝不适合在空调房使用，真的会烫伤的~~~你说啥？电影~？我在看电影么~？……你看，我差点就被暖宝宝烫伤了~~~","Well...... The cinema Air-Conditioning good foot Ah~~~I drip sweat!!! Warm baby does not fit in the air conditioning room to use, and will really burn The~~~you say? The movie~is? I in the movies?~for?...... You see, I almost were warm baby burns.~~~",0.943941
20,"唯一的泪点在宋丹丹那会儿。。。反正整体不知道想要表达什么，最后莫名其妙扯到环保什么的上去了好生硬= =","The only point of tears in the song Dandan of that while to. Anyway overall don't know want to Express what, and finally somehow ripped to environmental protection or something go up a good blunt= =",0.788983
20,"啊 都不知道说什么了  整个都很无聊 完全看得打瞌睡  最后还是没有看完就没看   都不知道他拍的这个电影的意义何在  无聊透了","Ah don't know what to say the whole are very boring completely see doze last or not after watching it didn't see didn't know he shot this movie what is the significance of boring through the",0.761702
20,"啧啧啧","Tut tut",1
20,"喵，真心一般~~","Meow, really General~~",0.763018
20,"回国在电影院看的，笑点的确不如以前多了，当然也可能是因为我笑点变高了。最后两个Chapter意义何在？","Returning home in the cinema to see, the punchline is indeed not as good as the previous lot, of course it may be because my humor becomes high. The last two Chapter what is the significance?",0.762499
20,"因为冯导语气太坚定以及对某几位影评人确实有成见...还是去看了。片子其实挺轻松，反而有些影评太累。你念着从前的好，导演却是站在过去的对立面，角度根本不同。老了，对曾经的辉煌难免又想提又不愿提，别骂了其实可怜的。","As von blurbs gas too firm as well as on a few Film Critics actually have to see...or to see. The film is actually quite easy, but some critics too tired. You read the front of the well, the Director is standing in the last of the opposites, the angle is fundamentally different. Old, and the once brilliant inevitably also want to mention again the reluctance to mention, don't scold the actually poor.",0.75899
20,"因为有个时间去哪了，来看下电影，根本没找到这首歌放在电影中有什么意义。。说是喜剧，没有找到笑点。。结尾的道歉，噗，到底怎么把公益广告和电影拼在一起的。。","Because there's a time where, see a movie, didn't find this song put in the movie what is the meaning of it.. That is Comedy, not found in the punchline of.. At the end of the apology, poof, in the end how the PSAs and the film pieces together.",0.775818
20,"国产，唉","Domestic, alas",1
20,"土豪版的好梦一日游~~垃圾版的甲方乙方，终极垃圾版的顽主。小肛还是歇歇吧~~","Tyrant version of the good dream of a day tour~~the garbage version of the party party, the ultimate garbage edition of the coercive master. Small anal or break it~~",0.956176
20,"圣诞节快到了，也没什么送给大家的。想来想去，只能把今天看的这片的结论告诉大家，帮大家省省钱。如果不是为了欣赏范伟的精彩演技，或者不光是看电影而是为了约会什么的别有用心，还是网上下下看吧，真的。不用谢，叫我红领巾就行了。","Christmas is coming soon, but also nothing to everyone. After much deliberation, only put in today to see this conclusion to tell everyone, help everyone province to save money. If not in order to enjoy the fan Wei of the wonderful acting, or not only watching movies but for a date or something with an ulterior motive, or online under the see, really. You're welcome, call me red scarf on the line.",0.763162
20,"在一堆的爸去哪和喜羊羊中没的选择，看了这部片，果然我被恶心到了。电影的景色越来越漂亮，投资越来越大，但是导演的诚意却越来越少了。最后的道歉，是把观众当XX么？在电影院，真的看不下去真的出戏了。","In a bunch of dad where to go, and hi sheep sheep, didn't have a choice, watch the portion of the sheet, and sure enough I was sick. The movie views more and more beautiful, investment is growing, but the Director's good faith, but less and less. The last apology is to the audience when the XX? In the cinema, really could not stand really out of the game.",0.863796
20,"在一星和两星之间犹豫，最后选择两星，算是对电影中几个好演员的支持吧。..看了这个电影，感觉就像，你在参加一个人追悼会，这个人你非常尊敬。但是他突然诈尸了，尊敬什么的，瞬间没了，剩下恐惧和恶心。就是这样","In the one star and two stars between hesitate finally select the two stars is for the movie a few good actors to support it... See this movie, it feels like you participate in a person memorial service, the person you very respect. But he suddenly turns into a vampire, dear what, the moment is gone, the remaining fear and nausea. Is this",0.853174
20,"在五道口的狭小的三号厅，对电影院印象差对电影的印象也很差 前半部分都要睡着了 宋丹丹的部分，到了点播台播放音乐的时候 有点煽情，我觉得那首歌还不错 还有就是马青看到的一大片凹陷的草原的时候 颇有感触 原来我们的地球已经残破不堪 我们也已经残破不堪","In wudaokou a small three Hall, the cinema, the impression of difference on the film the impression is also very poor first half to fall asleep song Dandan part, to the on-demand Station playing music of the time to a little sensational, I think that song is also nice there is a youth to see a large depression in the Prairie of time quite a feeling of the original our Earth has dilapidated we have dilapidated",0.855483
20,"在电影院第一次能看着看着睡着了的电影。五个故事因为进场迟了与睡着了的缘故，就只完整的看完第二个和最后一个。植入广告给我印象深刻，公益环保故事接入无比生硬。两星给我电影放映中那不短的睡眠。","In the cinema the first time I watched and fell asleep to the movie. The five stories because of entering late and fell asleep sake, it is only complete after watching the second one and the last one. Ads give me the impression profound, the public interest environmental story access incredibly blunt. The two stars give me a movie that is not short of sleep.",0.823258
20,"在骂人这个事上，冯小刚和影评人，five five open~。冯虽然表达出了一些东西，但是过于浅显而且主管色彩太强烈。整部电影弄的跟网络剧似的。不过还好，风格还在。","In the curse of this thing, Feng Xiaogang and film critic, five five open to it. Von although the expression of some things, but too facile and competent color too strongly. The whole movie did with the webisodes. But okay, the style is also in.",0.771717
