"ranking","Chinese.origin.data","Google.translated.data","Baidu.English.sentiment.analysis.positive.probability.base.on.Google.translated.data."
10,",,,,唉",",,,,Ugh",1
10,".私人定制.这种强奸院线的电影，还好意思说自己几天票房超了泰囧，我们看泰囧的时，院线里四五个片子上映好么，现在所有院线只有你一部片子好么！能不能注意点品质和素质，人家泰囧的评分是8.9好么，人家是导演诚意之作好么，私人评分是5分好么，导演为票房糊弄人好么，看完大家都想对你说fuck好么！！","This custom of filming rape, I am sorry to say that the box office over a few days Thai embarrassed, when we look at Thai embarrassed, four or five films released in the theater, what, and now all the theaters only you a Good movie! Can not pay attention to the quality and quality of people Thai embarrassed the score is 8.9 good, people are good director for good, personal rating is good, the director for the box office fool people good, after reading we all want to you What good fuck! !",0.964929
10,"【慎看·纯吐槽】本没抱多大希望，可还是足够失望，还没看的建议就别看了。混乱牵强的拼接，中心思想被狗吃了吗请问，就算喜剧电影也可以有个主线好吗，可以俗烂，但不要什么都没有好吗。最后那是什么，保护大自然吗，道歉是吗，不顺便给观众道歉吗。套你们自己的话——毛。","[Looked purely Tucao] This did not hold much hope, but still disappointed enough, have not read the proposal do not read. Is the messy and far-reaching stitching, the central idea is eaten by the dog? Excuse me, even if the comedy movie can have a main line alright, can be vulgar, but do not do anything good. What is the last, the protection of nature do you apologize, apologize to the viewer? Set your own words - hair.",0.842311
10,"06年K歌时很屌的唱着双截棍、忍者、龙拳，周围同事朋友纷纷骂着你丫90后啊，这么潮的歌你也会唱。13年还唱着同样的歌，周围的人该干嘛干嘛根本没人理你。97年再好看的片子，放到现在的审美也看不下去了吧，更何况比起97年的那部片子，这部简直就是坑蒙拐骗毫无诚意。别说花钱去电影院了，网上看不要钱","In 2006 K song is very loud singing nunchakus, ninja, dragon fist, friends around have scolded you after Ah Ya 90, ah, this tide song you will sing. 13 years also sing the same song, why do people around do not care about you. In 1997, the best-looking film can not stand up to the present aesthetic. Not to mention that this film is almost no sincerity when compared with that of the 97-year film. Do not say spending money to the cinema, online do not want money",0.78679
10,"18号和石头哥一起在影院看的提前场。不说前三段的割裂感，单说最后的废话，搁再好的片子里也要把分数扣到精光。","On the 18th and stone brother to see the advance field in the theater. Not to mention the first three paragraphs of the sense of separation, saying the last nonsense, put no matter how good the film also points to fine.",0.816247
10,"2013.12.29","2013.12.29",1
10,"2bmeiwenhua","2bmeiwenhua",1
10,"5年内唯一一支让我看到一半就忍吐离场的电影,为了葛大爷,为了王朔,为了冯小刚,我一直在努力的寻找笑点搏自己一笑,但我失败了,我想也可能是时代已将我的笑点提的太高...","For the first time in 5 years, I have seen half of the films that I endure vindictively. For Ge Grandpa, Wang Shuo, Feng Xiaogang, I have been working hard to find a smile and smile, but I failed, I think it may be It's time has put my smile point too high ...",0.801737
10,"haonimei","haonimei",1
10,"hehehe","Hehehe",1
10,"laji","species",1
10,"lanlanlan","lanlanlan",1
10,"lansile","lansile",1
10,"nmsl","nmsl",1
10,"shajibapolan","shajibapolan",1
10,"shuoshenmaasd","shuoshenmaasd",1
10,"wtf?在很奇葩的状况下看完此片~","Wtf? in very wonderful condition to read this film ~",0.717408
10,"一个人造女、一个广告男、一个逼祖奶奶绿茶婊外加一个晚节不保的御用百搭牌，结果打了一手农村重金属出来，想用最戏谑的手法讽刺社会却用了最傻逼的表达方式，搞笑不好好搞，道理不好好讲，煽情不好好煽，道歉不好好道，真想负分滚粗，唯一的一颗星给挖煤的大坑。.豆瓣太不与时俱进了，居然没有负分。","A man-made woman, an advertising man, a forced ancestral grandmother green tea bitch plus a night without the Royal wild wild card, the result hit the hands of rural heavy metals out, want to use the most teasing way of satirical use of the most silly expression, Funny not good to engage in, the truth is not good to say, sensational not good fan, apologize bad Road, really want to negative points thick, the only one star to dig coal pit. The watercress is too young to keep up with the times, actually does not have the negative score.",0.83191
10,"一开始在序幕的时候看到王朔的名字还是挺抱希望的，结果还是被剧情郁闷到了，没有任何意义的私人定制，宋丹丹那段莫名其妙的煽情，以及故事想反讽社会现状却又变得乱七八糟的还有最后那段道歉。。整部剧看着就像是一锅乱炖的菜，杂七杂八全部丢在一块，说笑点吧，其实还真没什么笑点，失望","At the beginning of the prelude to see Wang Shuo's name or embrace hope, the result was depressing plot, no sense of personal custom, Song Dandan inexplicable during that period of sensationalism, and the story would like to iron up the social situation but has become messy And last apology. . The whole play looks like a pot of stewed dishes, miscellaneous all lost in one, joking point, in fact, no reason to laugh, disappointment",0.750925
10,"一开始是点很奇怪的搞笑片，后来变成了煽情做作的大自然纪录片。。不过和girl们看烂片还对很欢乐～而且一想到明天又能吃妞妞薯条，幸福感就爆棚啦～","The beginning is a little funny film, and later became a sensational natural documentary. . But the girl is also very happy to see the bad film ~ and think of tomorrow can eat nianjian fries, bliss on happiness it ~",0.827715
10,"一星给宋丹丹，最后那里演的真好~~","A star to Song Dandan, where the final play nice ~ ~",0.79459
10,"三句话能讲完的道理一定要拍俩小时的电影还讲不清 从头到尾都是广告 小到饮料 大到房地产 一星给王铮亮的时间都去哪儿了 这部电影毁了这首好歌 好忧伤","Three words can finish the truth must take two hours of film also can not tell from start to finish are ad small to big beverage to real estate star to Wang Zhengliang where the time went to the movie ruined this good song So sad",0.717839
10,"下半场如坐针毡，那些号称看出情怀，解读各种深意的，赶紧绝交吧。按这种思路，任何电影都能加个公益结尾，施瓦辛格搞定恐怖分子后，来个宣传防艾，霍比特人融了魔戒后来个拯救文化遗产，地心引力末尾普及保护臭氧层，阿凡达后面加上节约地球资源，太他妈深刻了！蠢货导演们，戏就该这么拍，学着点！","The second half, such as pins and needles, those who claim to see the feelings, interpretation of all kinds of profound meaning, and quickly perfect it. According to this idea, any movie can add a commonweal end, Schwarzenegger to get terrorists, to publicize anti-AIDS, the Hobbit melted the ring of the Lord to save a cultural heritage, the end of universal gravity to protect the ozone layer, Avatar with the earth behind saving resources, too fucking profound! Stupid directors, the film should be shot, learn something!",0.79616
10,"不伦不类","nondescript",1
10,"不伦不类、笑点全无、结构无新意，这么烂的剧本也拍出来了，感觉冯小刚就是为1942泄愤的：我好好拍个片子你们观众不买账，我就故意拍个票房大卖的烂片，成全观众恶心自己。殊不知烂过头把观众也恶心了，浪费了葛大爷等一众好演员。。。","Neither fish nor fowl, no jokes, no new structure, such a bad script is also shot out, I feel Feng Xiaogang is the 1942 vent their anger: I took a good shot of the audience do not buy it, I deliberately made a box office selling bad film, Complete audience nausea. Everyone knows too rotten the audience disgusting, a waste of Ge uncle and other good actors. . .",0.759713
10,"不值得看啊~","Not worth seeing ~",0.714157
10,"不公平啊，老美过节看霍比特人，我们就只能看这种东西啊。你可以说老美的东西空洞模式化只有视觉冲击力，但是至少人家用心做了。中国的这种电影几乎什么都没有，也好意思拿出来骗钱？冯导真应该留着这片在春节晚会时段再播一遍，让我们把年夜饭都吐出来。我想看霍比特人。。。为什么不同步。。。为什么","It is unfair, we see only this kind of thing, because the Old Americans look at the hobbit. You can say that there is only a visual impact of the old-fashioned thing-and-forget mode, but at least people are diligent about it. There is almost nothing in this kind of movie in China. Feng Yingzhen should keep this piece in the Spring Festival evening broadcast time again, let us spit it all out. I want to see the hobbit. . . Why not sync. . . why",0.781983
10,"不好好琢磨怎么拍好电影，只顾上烂片赚俏皮钱，观众不是傻子，能分出好坏，只想说好自为之吧","Not good pondering how to make a good movie, only take into account the bad money to make cute money, the audience is not a fool, can be divided into good or bad, just want to say it for yourself",0.849596
10,"不好意思，笑点及其无聊，想表达的东西是好的可是呈现的方式太烂，就像你有拯救世界的英雄心却没有超人的英雄身一样，牵强的很，让我无数次无聊的冷笑，除了宋丹丹那个我有点小感动，其他的真没啥，一直都在玩手机，估计是本电影所达到的境界是我等俗人无法抵达和理解的","Sorry, grin and boring, what I want to express is good, but the way it is presented is too bad, just as you have a hero who saves the world but no superhero hero, which makes me immensely boring Sneer, except Song Dandan that I am a little touched, the other really nothing, always playing mobile phone, it is estimated that the realm of the movie is that I and other lay people can not reach and understand",0.770788
10,"不好看","Not good-looking",1
10,"不好看 莫名其妙 最后环保那段更是无聊","Not good to see somehow the last part of the environment is boring",0.715189
10,"不好看，我就是煤老板，他们一点没顾及我们这些人的尊严，日他妈现在这年头让个煤矿场给你冯小刚做东家，你怕你又舍得不挖？谁不想要钱，你们说是不嘛！！污染环境的问题又不是说我们守规矩人家就一定守规矩，如果说这都是我们的错，那好像当年你们烧煤的时候是我逼的咯！妈的如果老子穷疯病痛饿死在路","Do not look good, I was the boss of coal, they did not take into account the dignity of our people, the day his mother made a coal mine this year to Feng Xiaogang to do your home, you are afraid you are reluctant to dig? Who do not want money, you say yes or no! ! Pollution of the environment is not to say that we behave in accordance with the rules, if this is our fault, it seems that when you burn coal when I forced slightly! Mom, if I'm mad and starved to death on the road",0.803089
10,"不好看~","Do not look good ~",0.801113
10,"不接地气","Not grounded",1
10,"不是坐四个半小时的飞机还真看不了这大烂片，不过李小璐还是挺好看的","Not take four and a half hours of plane can not really see this large film, but Li Xiaolu is still very nice",0.780838
10,"不真诚，高高在上。冯小刚带着1942票房失利的拧巴，炮制一个自己高高在上的段子秀。连个故事都算不上。一个自认作品牛逼哄哄，观众没品才不会去欣赏的导演。你还是去画画吧，真的！","Not sincere, high above. Feng Xiaogang with 1942 at the box office defeat screwed Pakistan, concocted a high above the Duan Xiu. Not even a story. A piece of self-proclaimed works Niubihonghong, the audience would not appreciate the director no products. You still go to draw it, really!",0.709252
10,"不知所云","Unconscious",1
10,"不知所云，转折突兀","Unconscious, turning abrupt",1
10,"不知所云。","Unconscious",1
10,"不知所云~","Unknown ~",0.734991
10,"不知所谓","Ridiculous",1
10,"不知道是我们看电影品味高了还是 冯导的水平降了。像海豚湾、中国合伙人，疯狂石头这类电影。看完在心里有些心酸感动。像指环王、阿凡达、少年派，看后是视觉盛宴。  .冯导对术的追求有些走火入魔了，却忘了电影的道。 有道无术，术尚可求，有术无道，至于术。 看来人的能力就是逆水行舟，不进则退。","I do not know if we are watching the film taste or the level of Feng guide down. Dolphin Bay, China partner, Crazy Stone, such films. After reading some sad in the heart moved. Like the Lord of the Rings, Avatar, Junior School, after watching is a visual feast. Feng led some of the pursuit of magic, but forgot the movie Road. Youdao no surgery, surgery is still seeking, there is no surgery, as surgery. It seems that people's ability is against the current boat, do not go back.",0.833128
10,"不能打零分吗？感觉打一分都是对小时代的极度不尊重。本来我已经是个对电影没有底线的人了，什么都能看，很好，这部电影总算让我发现了自己的底线，同时，我的节操也碎在底线上了","Can not hit zero? Feeling hit points are extremely underestimated age. I was already a film who did not have the bottom line, and can see everything, very good, this movie finally let me find my bottom line, at the same time, my knuckles are also broken in the bottom line",0.788871
10,"不要抱有太高期望的人去看觉得挺不错的，休闲乐趣","Do not have people with too high expectations to see that very good, casual fun",0.770296
10,"不论这片子好坏，单凭冯小刚的态度就给零分。记得冯在一次颁奖晚会中说道：好好弄了一个1942部挣钱，随随便便弄个私人订制就赚钱。就凭他对观众的哄弄就给零分","Whether the film is good or bad, Feng Xiaogang's attitude alone gives zero points. I remember von at an awards show, said: get a good 1942 earn money, casually get a personal subscription to make money. With him on the audience to give zero zero",0.837363
10,"两个字，恶俗，形容完了这部电影的观后感，看完以后感觉像不小心吃了个烂橘子，吃的时候并没有太多不适的感觉，但是回味一下觉得立意太低有点俗不耐。。。虽然是讽刺的口吻但是编剧对于官腔，色诱和土豪的描摹还是让人觉得很无趣，最后一部分突然冒出来的长段良心发现的环保的诗朗诵显得极其格格不入。","Two words, vulgar, described the end of this film after feeling, after reading feel like accidentally eating a rotten orange, eat when not feeling too much discomfort, but the aftertaste that the conception is too low a bit vulgar Resistance. . . Although satirical tone, the screenwriter's comments on the bureaucratic, seductive and local princes are boring, and the epic poem recorded by the last part of the sudden constellation of conscience appears extremely out of tune.",0.754331
10,"中国影坛不要过分消费观众的信任！要俗要赤裸的求票房当真小人大家没异议，不过开头那多出来五分钟臭脚步一样的广告，算在电影时长里就极其过分，让人不禁有砸电影屏幕的冲动！幼稚无聊的剧情，单薄的人物塑造，蹩脚的环保感情诉求让人觉得虚伪又突兀！冯导这是要拿宇宙最俗奖啊！","Chinese film do not over-consume audience's trust! Vulgar to see the box office really small villain everyone no objection, but at the beginning that out five minutes more stinky ads, count in the movie time is extremely excessive, people can not help but have the impulse to hit the movie screen! Childish boring plot, thin character, crappy environmental appeal makes people feel hypocritical! Feng guide this is to get the most vulgar prize in the universe ah!",0.73452
10,"中间我睡着了将近一个多小时，直接导致脖子落枕。fuck！今年看过最烂电影没有之一。相比之下，四娘简直业界良心。起码人家全片无尿点，靠弹屏吐槽足以撑够120分钟。护舒宝炒冷饭功力实在见长，片尾的配乐诗朗诵珍是吓死人惹！","In the middle I fell asleep for more than an hour, leading directly to the neck stiff neck. fuck! I've seen one of the worst movies this year. In contrast, Si Niang is the industry conscience. At least people have no point on the whole film, spit enough to hold enough elastic 120 minutes. Shu Shu Bao fried cold meal skill is good, ending music poem recitation Jane is scared to death!",0.835558
10,"乏善可陈的老笑料，甚至连段子都称不上，要不是靠着那几个有喜剧观众缘的演员拼尽全力靠自身表演为那点可怜的台词加分，更没法看。两个小时的长度太考验忍耐力。虽然本来也没抱太大希望，但是也没想到居然如！此！难！看！","Lack of good old joke, and even the pieces can not be called, or by relying on a few comedy audience actor do their utmost to rely on their performance for that poor speech points, but can not see. The length of two hours is too endurance test. Although originally did not hold much hope, but did not expect actually! this! difficult! Look!",0.788195
10,"乱","Chaos",1
10,"乱七八糟","Messy",1
10,"乱七八糟不知所云","Messy unintelligible",1
10,"乱拼乱凑 雅俗的那一截虚幻得很莫名其妙 最后道歉那段也乱入 又加入环保。小刚是想做鲁迅一样的斗士么 反映这么多事情  可惜不知道自己有多大的腚，裤衩不合身啊。外国的好导演是会讲故事，这个片子的导演是在扯故事，让观众入不了戏，自顾自的表演。","Unrequited elegance and satire that section of the Unreal is very baffling Finally apologized that period of chaos and joined the environment. Xiaogang Lu Xun who want to do the same fighter reflect so many things Unfortunately, do not know how much I have, pants ah do not fit. Good foreign director is to tell the story, the film's director is telling the story, so that the audience can not enter the play, self-serving performance.",0.714669
10,"今天大雪天，本来想说去看部好电影的，对电影本身也有很多期待，可是看了开头的一段无厘头的引子，加上后面毫无故事性可言的垃圾拼凑，真的是失望到不行，全程没有让我发笑的点，而且毫无故事性可言，完全的生搬硬套，冯小刚，果然是长江后浪推前浪，前浪死在沙滩上了，现在对他而言金钱比电影重要，现","Today, on a snowy day, I wanted to say that I had a good movie. I also had many expectations of the movie itself. However, having read the beginning of a nonsensical introductory phrase and adding rubbish behind the story, it was really disappointing. , The whole point did not make me laugh, and no story at all, completely mechanically, Feng Xiaogang, it really is the Yangtze River waves before the waves, before the waves die on the beach, and now for him the money is more important than the movie, and now",0.857867
10,"从来没指望冯小刚高雅，但至少他要搞笑，或者搞笑也可以是次要的，只要他好看，看私人定制说实话，我要说一次都没笑，那是亏心，不过整体而言，的确是不搞笑又不知所云，如果一部片子是王家卫拍的，大家看不懂，那是有深度，如果一部片子是冯小刚拍的，大家还看不懂，那冯小刚就不要继续拍电影了……","Feng Xiaogang has never been expected elegant, but at least he wants to be funny, or funny can be secondary, as long as he looks good, to see private custom to be honest, I would say no laugh at all, it is unfair, but overall, indeed If you are not funny and you know nothing about it, if one film is shot by Wong Kar-wai, we do not understand it. If there is depth, if a film is made by Feng Xiaogang, we still can not understand it. ...",0.709419
10,"从私人订制 到 春晚  冯小刚可能已经得到了自己想要的东西 同样的也会失去一些东西 就像当年说的 人心散了 队伍不好带呀 这也反映了中国电影圈的现状 自己是牛逼的 群众是钱多人傻 冯导人自己都总结了呀 恶心别人 成全自己！","From a private subscription to the Spring Festival Evening, Feng Xiaogang may have got what they want, will also lose some of the same things that year, said the people scattered team is not good with ah This also reflects the status quo of China's film itself is Niubi The people are silly money Feng people guide themselves are summed up disgusting others make their own!",0.766058
10,"从贪腐，到电影界的现实，到穷富矛盾，到环境问题，冯小刚想讨论中国的现状，每个方面都说一些，还说着一些每个人都听得懂的反话，但观众不买账，因为冯导自己也没想清楚自己想要表达的主旨是什么。观众不需要一个导演重复大家已知的事实。这电影没有讽刺，段子又不好笑，观众怎么会喜欢。","From corruption to the reality of film industry, to the contradictions between rich and poor and to environmental issues, Feng Xiaogang would like to discuss the status quo in China, saying in every respect and saying some anti-talk that everyone can understand but the audience does not buy it , Because Feng himself did not want to know what you want to express the main theme. The audience does not need a director to repeat the fact that everyone knows. This movie is not ironic, the segment is not funny, how the audience will like it.",0.782873
10,"他是真的不搞笑也不好看，三个大部分某个看点寥寥，每段结尾想要升华主题却用了十分生硬的手段，让人觉得很不信服。最后那个环保，某导说是有深意，我也是醉了。","He is really not funny nor good-looking, most of the three aspirations of a few, the end of each section you want to sublimate the subject has used a very blunt means people feel very convinced. Finally, the environmental protection, a guide is profound, I am also drunk.",0.719966
10,"以后可不能让小孩碰文艺啊~","After the children can not touch the arts ah ~",0.714858
10,"以毛泽东思想，邓小平理论，三个代表，科学发展观为指导，踏踏实实走群众路线的新闻联播里插播的公益广告。———花了七十块看七点整的表示感觉自己得了雅过敏且满耳朵响着伤不起的一俗人的评论","Guided by Mao Zedong Thought, Deng Xiaoping Theory, the Three Represents, and the Scientific Outlook on Development, public service announcements broadcast through the news network that take the mass line down. --- Spent 70 to see the whole seven o'clock that they feel allergic and full of ears can not afford a vulgar comment",0.737831
10,"低俗","Vulgar",1
10,"低俗喜剧，后悔看了","Vulgar comedy, regretful read",1
10,"作为一个电影人，冯岛自己拍的这部影片就可以获得宇宙最俗了。还说什么电影不是艺术。 电影都象这样拍当然不算艺术了，只能说是大荧幕上的小品。 本来以为只是国内的观众对冯导期望高，所以出来骂声一片，现在看来是导演自己在糊弄观众，难怪观众骂","As a moviegoer, Feng Shima self-made this movie can get the most vulgar universe. Also said that the film is not art. Of course, the film is not art like this, and can only be described as a big screen on the sketch. Originally thought it was only the domestic audience expectations of Feng guide high, so come out abusive one, and now it seems the director himself fooling the audience, no wonder the audience curse",0.742858
10,"作为一部喜剧，我全程一次都没有笑过。实际上最可笑的是今天早上冯大导在微博上的发言，他炮轰影评人看不出他电影对现实的讽刺，看不出剧情背后的深意。而现实恰恰相反，正是他那自以为犀利的毫无新意的幼稚讽刺，自以为深刻实则浅薄至极的内涵，才让这部电影成为年度大烂片。","As a comedy, I never laughed once. In fact, the most ridiculous thing is the speech made by Feng Dagui on Weibo this morning. When he criticizes film critics, he can not see the satire on the reality of his film and can not see the profound meaning behind the story. In reality, on the contrary, it is exactly his naive satire that he does not have any new ideas. He thinks that this film has become an annual movie with a superficial meaning.",0.732709
10,"俗","Vulgar",1
10,"俗不可耐","Vulgar",1
10,"傻屌，缝小肛","Stupid, sew anal",1
10,"傻逼","Sucker",1
10,"元宵节时朋友提出一起看，我全程没笑。冯导抱歉，我真不知道这电影好在哪。跟北京的雾霾天道歉时，我真就呵呵了。","Lantern Festival friends put together to see, I did not laugh all the way. Feng guide sorry, I really do not know where the movie is good. When I apologize with the smog days in Beijing, I really hate it.",0.79835
