"ranking","Chinese.origin.data","Google.translated.data","Baidu.English.sentiment.analysis.positive.probability.base.on.Google.translated.data."
20,"我总觉得冯小刚的看不懂和姜文的看不懂不是一回事儿~ 以上~","I always feel Feng Xiaogang do not understand and Jiang Wen do not understand is not the same thing ~ ~ above ~",0.788088
20,"我想说结尾那二十分钟世界道歉日是为了过广电总局审核才加的吧。减一颗星。还有，编剧王朔是我认识的那个吗，怎么觉得是重名啊。烂。为了葛大爷，给两星。","I would like to say that the end of the twenty-minute apology day is for the Bureau of Radio Film and Television's review before it is added. Minus one star Also, writer Wang Shuo is that I know it, how do you think it is the same name ah. rotten. To Ge uncle, to two stars.",0.742832
20,"我拖着行李在这个光怪陆离的城市停下来，费劲一番周折找到个环境不错的工作，周一到周五朝九晚五，终于可以在周末的时候给心爱的人倒腾点吃的，（不对，应该是心爱的人给我倒腾）纠结衣服买不买，偶尔熬夜在high吧，总有三五好友相聚吐槽；然后又一次在周一早晨变成战斗的模样，用咖啡开始周一的早上。","I dragged my luggage in this bizarre city to stop and worked hard to find a good environment for work. From Monday to Friday, as late as 9: 5, I finally got over my beloved at weekends. (No, it should be My beloved ones will toss me over) Unwound clothes will not buy, and occasionally staying up late At high, there are always three or five friends to get together; then again on Monday morning it will become a battle pattern, with coffee starting Monday morning.",0.793329
20,"我是去的开心的，但不是很喜剧啊！！！！！唯一启示：这世道文艺青年不好当啊，稍微青年就好，要不最后只能弹棉花了。。。。。","I am going to be happy, but not very comedy ah! ! ! ! ! The only revelation: This world literary youth is not good, ah, like a little youth, or the last only play a cotton. . . . .",0.777148
20,"我真是烦死白百合了 葛优在她的衬托下都变得不可爱了 虽然舒淇也不咋地 但是还能将就看下去 白百合李小璐这俩xxx","I really bored Bai Lily Geli in her background have become unloved Although Shu Qi is not good, but will be able to look at the white lily Li Xiaolu these two xxx",0.732911
20,"我真的对于这部片子摸不着头脑 你说这片子高深难懂吧 那定位又是贺岁片 你说这片子是贺岁片吧 确看不出个所以然来 真的好失望 觉得冯小刚不可能会是这种水平 始终是在宣传反腐环保 但直接的难以接受 一点也不好看 好失望","I really feel puzzled for this film, you say this film is very difficult to understand it, that position is New Year film, you say this film is New Year's film, it does not come true, so disappointed that Feng Xiaogang can not be this The level is always propaganda anti-corruption environmental protection, but the direct unacceptable good disappointment",0.748377
20,"我能说这片子很无聊么，内容非常简单，我也知道你要表达的意思，但是这个表现形式实在是很无趣。就连最后一个我们确实应该向山河日月道歉的内容，也感觉不是发自真心的。","I can say this film is very boring, the content is very simple, I also know what you want to say, but this form of expression is really boring. Even the last one we really should apologize to the sun, the moon, but also do not feel sincere.",0.820841
20,"我觉得不怎么的，可能是还看不懂吧，点不一样","I think not very good, it may not understand it, not the same point",0.758401
20,"我觉得这部电影好坑爹啊，只能说是一部低俗喜剧，而且笑点很烂。看完后没有任何意义。影片中唯一稍微触动我的就是时间都去哪儿了这首歌播放的时候，还有片尾曲挺好听吧。","I think this movie is a good pit father ah, can only be said to be a vulgar comedy, but grinning sucks. After reading does not make any sense. The only thing in the movie that touched me a little bit was where the time went and when the song was playing, there was a good euthanasia.",0.813892
20,"我觉得题材挺好的 就是白瞎了葛优","I think the theme is very good white blind Ge You",0.755278
20,"扯淡","Nonsense",1
20,"扯淡装逼","Lazhuang loaded forced",1
20,"抱歉，我不太欣赏得了，说教说的太直接了，无趣。我只喜欢丹丹姐跟葛优^^","Sorry, I do not appreciate too much, preaching is too direct, boring. I only like Dandan sister Ge You ^^",0.734536
20,"抱着对冯小刚与葛优的惯性期待去，带着失望走出电影院。虽然最后的道歉篇不错但三个故事都一掠而过不高深不精全。什么都想要聊一聊结果什么都没表达好，还非得最后努力装一下高雅。冯小刚还是专心弄春晚去吧~","Holding the inertia of Feng Xiaogang and Ge You look forward to, with disappointment out of the cinema. Although the final apology was good, all three stories were swept past and inattentive. Want to talk about what the results of what did not express anything, but also have to work hard last look elegant. Feng Xiaogang still concentrate on making spring break go ~",0.902837
20,"抱着明明知道不好看也要看的心态，因为即使不好看也要自己说不好看，结果果然很烂，很拧巴的一部电影，没看出来私人订制的意境，觉得是甲方乙方的续集，盗梦空间的盗版","Holding a clearly know not look good also depends on the state of mind, because even if not look good to say that they do not look good, the result really bad, very tweeted a movie, did not see the personal custom mood, that is Party B The sequel, Pirates of the dream of piracy",0.857731
20,"抱着看小品的心去看的，范伟那段还行，李成儒那段纯粹就是客串明星大联欢，宋丹丹那段歌不错，结尾不伦不类，确实笑了，所以两星吧还是，比甲方乙方差远了，顽主就更别提了~我还是挺喜欢葛大爷的= =","Hold the look of the heart to see the sketch, Fan Wei that period is OK, Li Chengru purely during the guest star actress, Song Dan Dan that song is good, end neither fish nor fowl, really laughed, so two stars or it, than the Party A B far worse, even more to mention the pretender ~ I still quite like Grandpa = =",0.79777
20,"拍出来的电影大家只能说好，说不好就是收了钱的大尾巴狼。冯小刚一把年纪了还这么没气度，想让人认同他的作品更难了。","Filming out of the film we can only say good, that is not good is received a large tail of the wolf. Feng Xiaogang an age so rude, want to make people agree that his work more difficult.",0.731319
20,"拍着玩","Patted",1
20,"拼凑 无高潮 说教","Piecing orgasm preaching",1
20,"拿冯小刚的功力来说~这就是及格线以下的水平~ 除了葛优最后几句台词能让人看见恍惚的旧日，都是圈钱货~","Take Feng Xiaogang skill ~ This is the level below the pass line ~ In addition to the last few lines of Ge You can make people see trance of the old days, are misappropriating goods ~",0.826957
20,"挺失望，铁三角还在却江郎才尽的感觉，像是几个小品的合并体最后直接变公益广告。甲方乙方的诙谐幽默精彩不在，像是鸡肋，哎，每年贺岁档有冯导的电影都期待，准备乐一乐，结果笑的挺勉强。但是有这招牌票房也不至于差，基本不管烂片还是好片，观众总会买单，好片自然好，烂片也会被宠坏。","Very disappointed, the Iron Triangle is still just feeling Jianglang, like a few pieces of the merger last directly changed public service ads. Party B's witty humor wonderful is not, like tasteless, hey, Lunar New Year file Feng guide movies are looking forward to preparing music and joy, the results laugh very reluctantly. However, there is this signboard box office will not be worse, the basic regardless of bad films or good films, the audience will always pay, good films naturally good, bad movies will be spoiled.",0.910215
20,"挺没意思的片子，之前还很期待，没想到冯导也失手了。剧本荒诞，小品形式令人出戏。。。不过宋丹丹演的真心好，也就这段笑了几次~","Very boring film, still looking forward to before, did not think Feng guide also lost. Script absurd, skit is a form of play. . . However, Song Dandan played really good, but also laughed several times this paragraph ~",0.76051
20,"挺难看的 嗯","Uh huh",1
20,"据我所知，导演和演员能玩着就把电影拍了而且拍得很不错的例子，东成西就算一个，私人定制绝对算不上第二个。这片子好像一直很努力地想让观众和演员入戏，可是他的每一个镜头都在提醒观众这只是一场自嗨。除了李小璐和白百合的胸，我找不到本片的亮点。","As far as I know, the director and the actress can shoot the film and shoot a very good example. Even if the East is a West, private custom is definitely not the second. This film seems to be trying very hard to get the audience and actors into play, but his every shot reminds the audience that this is just a hi from. In addition to Li Xiaolu and white lily chest, I can not find the highlight of the film.",0.903591
20,"摄影很好，但是整个片子没有节奏可言，段子没有心意而且大部分笑点都很牵强。噢，对了，关于整体，如果把这个当成微电影集来看，似乎就不难看了。","Photography is good, but the whole movie is not rhythmic at all, the pieces have no idea and most are very farfetched jokes. Oh, yes, on the whole, if we look at this as a micro-movie, it seems that it is not ugly.",0.810157
20,"故事比较凌乱，套路也老。可喜的是演员演技不错。几个片段，最喜欢开头那个逃出纳粹地牢的。","The story is more messy, routine is also old. The good news is that acting is good. A few clips, most like the beginning of the escape from the Nazi dungeon.",0.753718
20,"故事立意和情节表现之间的距离差了十万八千里，要不是在机场打发时间绝对看不下去","The distance between the story and the performance of the plot difference of thousands of miles away, or if the time passed in the airport absolutely can not stand it",0.74483
20,"故事虽然极力想表达一些嘲讽和反思，但充满着铜臭和纸醉金迷的割裂感。第一个故事讲贪污，只能引起百姓对当权的愤恨。第二个雅和俗的故事，则让观众疑惑这些人为什么停止治疗。第三个故事有钱人的一天，完全游离于百姓生活之外的拜金。最后的道歉，反倒是像穿西装带草帽一样的不搭和缺乏诚意。","Although the story tried hard to express some ridicule and reflection, but full of smelly and glamorous sense of fragmentation. The first story about corruption, can only cause people to resentment of power. The second story of elegant and vulgar, let the audience wondered why these people stop treatment. The third story rich day, completely free from worship outside the people's lives. The last apology, on the contrary, is the same as wearing a straw hat with a lack of sincerity and lack of sincerity.",0.816701
20,"故事设定和人物逻辑都是反电影的，情节推进是小品化的，自说自话的语境和接地气的方式都是过时的，但又不是简单用烂片可以定义的电影，它对低端观众的抚慰和催眠效果依旧强大，这些观众与创作者以惯性的自我消费达成了伪默契和伪高潮。","Story setting and character logic are anti-film, the plot is to promote the plot, the context of self-talk and grounded manner are outdated, but not simply use the movie can be defined, it is The soothing and hypnotic effects of low-end viewers are still strong. These spectators and creators reached a false tacit agreement and pseudo-orgasm with inertial self-consumption.",0.738623
20,"故事都没啥意思，更没啥情怀，喜剧片做的既没思想又不搞笑，冯导作为一个名声还不错的导演，该好好想想了。","The story is meaningless, but also lacks feelings, neither the thought of comedy films do not make funny, Feng guide as a notoriously good director, the good think of it.",0.798278
20,"整个片子给人一种越往后越不想看的感觉，硬性的广告植入，走马灯的明星脸，各种搞笑段子的混搭和故事中所蕴含的那些无关痛痒的道理。冯小刚用一种闹着玩的态度拍完了这部电影，不知道是在调侃烂片高票房的电影市场还是在调侃自己。尽管如此，冯小刚仍是我喜欢的一位导演，王朔仍是我喜欢的一位编剧。","The whole film gives a feeling of more and more do not want to see the future, hard ad implants, the celebrity face of the lantern, all kinds of funny pieces of the mix and match the stories contained in those irrelevant truth. Feng Xiaogang with a joke attitude finished filming this movie, do not know is ridiculed bad movies at the box office movie market or ridicule themselves. However, Feng Xiaogang is still my favorite director, Wang Shuo is still my favorite writer.",0.760029
20,"整部片子主题和冯小刚以往的作品一样突出，但手法却早已不如当年。三个春晚小品，三个城市宣传片，要不是三个戏骨不知道这个故事笑点能在哪里。从最后一个故事开始直到结尾结尾出乎意料的毫无逻辑，倒是雅俗的故事，告诉我们，不管看不看冯导的片子我们都输了。冯导敢于承认自己是个俗人，咱们不敢。","The whole film theme and Feng Xiaogang works as prominent, but the method has long been worse than the year. Three Spring Festival Pieces, three city videos, or three skits do not know where the laughter of this story can be. From the beginning of the last story to the end of the story, there was an unexpectedly no logic but an elegant story, telling us that we have all lost the look of Feng's film. Feng guide courage to admit he is a laity, we dare not.",0.817616
20,"整部电影全靠宋丹丹范伟以及方言在撑场子，冯导从近几年就开始各种浮躁的不接地气，不知道是混入了哪个阶层，充满了幻想和说教，不会好好说话以及好好讲故事。商业化不是一般的重，乱入的又生硬。还不如。。。泰囧","The whole film thanks to Song Dandan Fan Wei and dialect in support of the field, Feng guide from the impetuous in recent years began to ground, do not know is mixed into what class, full of fantasy and preaching, not to speak and well tell a story. Commercialization is not a general one, but chaos and bluntness. Not as good. . . Thai 囧",0.778735
20,"无力吐槽了","Tucao inability",1
20,"无情节的教育片","No-hearted educational films",1
20,"无法用好坏来评价的一部电影，我更觉得不应该是当喜剧看的电影，不喜欢，也不喜欢白百合和李小璐的表演","I can not judge whether a film is good or bad. I do not think it should be a movie when comedies are seen, I do not like it, I do not like performances by Bai Lily and Li Xiaolu",0.731857
20,"无聊 牵强","Boring far-fetched",1
20,"无聊的咯","Boring slightly",1
20,"无语中","Speechless",1
20,"无语了","Speechless",1
20,"无语凝咽","Speechless condensate",1
20,"无趣。","Boring",1
20,"旧瓶新装，黔驴技穷，相当于甲方乙方的第二部，原来的贺岁档的神话导演已经渐渐走下了神坛，呆板，腐朽的冯式段子在如今这个笑点颇高的年代已经站不住脚了，就像网友总结的，恶心别人，成全自己才是这部电影的主题。","The old bottle of new equipment, donkey technology poor, equivalent to Party B's second, the original Lunar New Year file myth director has gradually walked down the altar, dull, decadent von Duan in today's joking high age has stood Live, as friends summary, disgusting others, fulfill themselves is the theme of this movie.",0.760766
20,"早知道私人定制最大的惊喜就是白百合有胸，但在鸡贼的广电局档期管理下，并没什么选择，半个业内人士老仇说王朔编剧的片子还是要看看的。混乱的镜头和一些莫名的角色即使知道是植入的广告和人情，但在不自觉的为那幕墓地估价30到50万后，竟然有从成本核算应该去补看下1942的心思。","I knew the biggest surprise of private custom is the white lily chest, but in the chicken thief SARFT file management, and no choice, half a veteran insider said Wang Shuo screenwriter movie or have a look. Chaos shot and some inexplicable role Even know that the implanted ads and human feelings, but unconsciously for the cemetery valuation of 300,000 to 500,000, there is actually from the cost accounting should be added to look at the 1942 mind.",0.769297
20,"时隔多久和爸爸一起看的冯小刚的贺岁片，时很期待的，但是总有廉颇老矣的感觉，太多梗笑不出来，都是硬搬，感觉纯粹去电影院看原价的是为了小刚和葛优大叔了。","Time after time and father saw Feng Xiaogang's New Year films, very looking forward to, but there is always feeling quite old, too many struts do not come out, are hard to move, I feel purely go to the cinema to see the original price is small Just and Ge You uncle.",0.7473
20,"昏昏欲睡","sleepy",1
20,"春晚式的逗乐，新闻联播式的剧情逻辑，感动中国式的价值观，还没拿到终身成就已经忙着致敬自己。唯一亮点是白百何真好看。","Spring Festival Evening amusement, news broadcast plot logic, touched the Chinese-style values, have not been lifelong achievements have been busy paying tribute to their own. The only bright spot is the white one hundred really nice.",0.783827
20,"春晚彩排，有些恶心人，被当猴调戏的某些观众照样笑得前仰后合。年底了，借段子大导的拿手贺岁挤出个笑容，也不失为一种中国梦吧。","Spring Festival rehearsal, some disgusting people, was some of the audience when the monkey molested smile laugh forward together. By the end of the year, borrowing the good fortune of the New Year can squeeze out a smile, but also a Chinese dream.",0.795751
20,"昨天无意间点开的这部电影 本来说好是之前上映的时候要和栾去看的结果还没来得及她又回美国了 几段梦都反应了很多现实问题 但作为这样一部电影我又觉得太重了","Yesterday, the point where this movie was inadvertently said to be good when the previous release and Luan to see the results have not had time to go back to the United States, some of the dreams reflect a lot of realistic problems, but as a movie I think too heavy",0.752723
20,"昨天看了。确实不太像一部完整的电影。四个段落各有内容，但都比较平淡或者平庸，没有新的或者独特的，超出常识的内容。影片展示了一些阶层之间的断裂割裂及互相之间的对立与想象，有触目惊心的感觉。审片尺度较宽，游泳池以及会所的戏，都给过了。整个片子，有讽刺，但喜剧感欠缺。临时拼凑上去的向大","I saw it yesterday It does not really look like a complete movie. Each of the four paragraphs has its own content, but both are plain or mediocre with no new or unique content beyond common sense. The film shows some of the class between the rupture of fragmentation and mutual opposition and imagination, shocking feeling. Larger scale of the trial, swimming pool and the club's play, have given. The whole film, ironic, but lacking in comic. Provisional patchwork up to the big",0.876004
20,"是真的不好看不好看 不知道是我笑点太高还是的的确确不好笑 冯导的这种告诫观众口吻我一向不太喜欢 您最后那点是为了凑时间的公益广告吗 自以为乱世中出淤泥而不染 其实也不然吧。。。","Is really not good or not do not know if I laugh too high or not really funny Feng guide this audiences tone I always do not like your last point is to get together time for public service ads that trouble in the world Out of the mud but not in fact, it is not. . .",0.848576
20,"普通～搞不懂为咩高票房。马连道成龙耀莱（？）看的，后排一男的打电话说了十几分钟，声音好大。这个人刚说完前排一男的又很大声的讲电话，夹杂着后排电话男的女伴向其大声讲解错过的剧情的声音。第一次碰到那么糟的观影经历，加上普通的剧情，两星是不是给高了。","Ordinary ~ do not understand as high box office. Malone Chan Jackie Chan (?) See, the back of a man said a few minutes to call, the sound is loud. The man just finished front of a man talking loudly again, mixed with the back of the phone male companion to explain loudly the sound of the missed story. For the first time encountered such a bad viewing experience, with ordinary story, the two stars is not given up.",0.783939
20,"普通的一部的爆米花电影，可看可不看。打两颗星因为最后的羽泉老子恶心。范伟和宋丹丹的故事是想挑战这个社会的一些规则，立意很好。我想请问最后的环保部分跟整个电影有鸟的关系？ 不要抱期望，你可以去电影院。纯粹的贺岁电影，没有任何值得讨论的地方。票房高是因为同期没有对手，不然冯小刚死的惨","An ordinary popcorn movie, you can see it. Hit two stars because the last Yuquan I nausea. Fan Wei and Song Dandan's story is to challenge some of the rules of this society, a good idea. I would like to ask the last part of the environmental protection of the whole movie has a bird's relationship? Do not expect, you can go to the cinema. Pure New Year movie, there is no place worth discussing. Box office because there is no opponent over the same period, or Feng Xiaogang miserable",0.830174
20,"暮气","apathy",1
20,"最后一段乱入是怎么回事啊，什么意思啊…最后那个古老的笑话瞬间让人无语了，本来前面还好的～还是比较喜欢以前的甲方乙方","The last paragraph of chaos is how ah, What is the meaning ah ... Finally, the old joke moment silent, had been good in front of ~ or prefer the previous Party B",0.796498
20,"最后冯导的公益广告拍的和春晚片头一样出彩。整部电影要表现的东西太多，显得很乱，重点不突出。范伟那段不错，挺搞笑的！其余很无聊，烂片一部！","Finally Feng guide public service ads and the Spring Festival Evening film debut the same color. The whole movie to show too many things, it is messy, the focus is not prominent. Fan Wei that good, very funny! The rest is boring, a bad film!",0.825033
20,"最后好突兀","Finally unexpected",1
20,"最后对地球的道歉不错，虽然不知道这和电影情节到底有啥关系。","Finally apologize for the earth is good, although I do not know this and the plot in the end what relationship.",0.752909
20,"最后立意很好 但是很假","The final idea is very good but very fake",0.771998
20,"有两处特别感动：一是送宋丹丹回家时放的那首歌，让我落泪；一是结尾处那段人与自然论，让我再度落泪。就是感动，虽然看不出这两个桥段到底和电影有毛关系。","There are two special touched: First Song Song Dandan put the song home, let me cry; First, at the end of that period of man and nature, let me cry again. Is moved, although I do not see the two bridges in the end and the movie hairy relationship.",0.763965
20,"有些戏弄.","Some teasing",1
20,"有些矫情","Some hypocrites",1
20,"有人说小刚导演不适合拍大片所以1942和唐山大地震都不太好，但是总比炒自己冷饭来的有诚意吧。除了场景服装有变化外，我没看出电影的新意在哪，更没发现笑点在哪。要是没有葛大爷，冯导你还是别拍喜剧电影了。","Some people say that director Xiaogang is not suitable for large film so 1942 and the Tangshan earthquake are not very good, but always more than frying their own cold meal to be sincere. In addition to the scene there are changes in clothing, I did not see where the new movie, but did not find where the jokes. If there is no Ge Grandpa, Feng guide you do not shoot comedy movies.",0.73351
20,"有内涵，但叙事生硬，做作。剧情不贴谱~~","Connotation, but the narrative blunt, contrived. Plot does not paste the spectrum ~ ~",0.743945
20,"有史以来冯小刚最难看的电影没有之一。ENDING恶心度破表。唯一的收获是白百合好高啊- -","Feng Xiaogang's most ugly movie ever. ENDING disgusting broken tables. The only gain is white lily good high ah -",0.78841
