"ranking","Chinese.origin.data","Google.translated.data","Baidu.English.sentiment.analysis.positive.probability.base.on.Google.translated.data."
20,"冲着葛大爷去的，提前降低了期待…小的笑点还是有的，但不如冯小刚以往的作品确实是事实。李小璐跟白百荷演什么都是一个样儿，太让人出戏了。最后向大自然道歉那段，独立的去看还是挺发人深省的，虽然确实和电影本身一分钱关系没有。。","Directed at Ge Grandpa to go ahead of schedule to reduce the expectations of a small smile or something, but not as good as Feng Xiaogang's past work is indeed a fact. Li Xiaolu played with the White Lotus what is a kind of child, so people play. Finally apologize to nature that period, independent or very thought-provoking, although it does and the movie itself penny relationship. .",0.773613
20,"冷饭炒得不好吃～～夹生","Fried rice fried not good ~ ~ Jia students",0.851906
20,"冷饭炒得真不怎么样？和非诚勿扰一样的风景片！！","Fried rice really not very good? And if you're the same scenery of the film! !",0.744931
20,"凑合吧。不是很有感，第一，翻来覆去的就那么点事，就那几个人，多没意思。我在想，那个来做梦想的人是怎么进入角色的呢。真是节约成本啊。真是人力物力好紧张的赶脚啊。第二，结尾的环保，可能是想突出意义。做一个美好的收尾，不好意思啊，真心没感觉到，反倒觉得是硬贴上去的，矫情啊。","It is ok. Not very feeling, first, over and over again on the point, on those few people, more boring. I was wondering, how did the person who came to dream come into the role? Really cost savings ah. Really manpower and resources so nervous rush ah. Second, the end of environmental protection, may want to highlight the significance. To make a beautiful ending, I am sorry ah, really did not feel, but actually feel hard to paste up, hypocritical ah.",0.849041
20,"几个段落堆砌起来，可是前后却没有关联，最重要的是神奇四侠在三个合同中关系完全没有任何变化，最后道歉的段落更像是一个公益广告强加上去的人文思考，非常生硬，加以嘲讽的态度对于解决问题也没有帮助。ANYWAY，有点失望，以后去电影院还是看徐峥的喜剧吧，他的片子目前还有点保证。我也是俗人啊。","Several paragraphs piled up, but not before and after the association, the most important thing is that the Fantastic Four in the three contracts did not change any relationship at all, and finally apologized passage is more like a public service ads imposed on humanistic thinking, very hard and to be Tauntless attitude does not help solve the problem. ANYWAY, a little disappointed, after going to the cinema or watching Xu Zheng's comedy now, his film is still a little guaranteed. I am also a laity",0.809341
20,"几乎瞎扯了一整部片子，却在最后生硬的认真起来去关注环境向大自然道歉，越发显得前面那些三部曲不仅仅是在恶心自己，还恶心别人了，其实影片制作团体最应该向影迷道歉，他们辜负了6.55亿的票房，真不怪冯小刚都心虚的表示粗制滥造的本片都如此高票房，而精心制作的1942却票房惨淡。","Almost blind nonsense of a film, but in the final blunt serious concern to the environment to apologize to nature, the more pronounced in front of those trilogy is not just disgusting themselves, but also disgusting others, in fact, the film production community should most fans Apologize, they live up to 655 million box office, it is not strange that Feng Xiaogang are guilty of the show that the shoddy films are so high box office, but the elaborate 1942 but the box office bleak.",0.771424
20,"出发点是好的，转向到公益的层面，不过这剧情真的是不好恭维！","The starting point is good, turned to the level of public welfare, but this story is really not good compliment!",0.779942
20,"分三次勉强看完，段子陈旧，演员做作，说不出的别扭。冯导端着架子说事，早就脱离群众，不接地气了，眼里无外乎权色名利而已。糊弄观众也就罢了，这些戏子们自视甚高的劲头令人很不舒服。接受服务的这些客户，明知做戏，真有快感吗，逻辑上说不通呀。","Reluctantly read three times, old pieces, actors, can not say awkward. Feng led the shelf carrying things that have long been out of the crowd, not greenery, the eyes nothing more than fame fame and fortune it. Just fool the audience, these actors are very uncomfortable with high self-esteem. Accept these services, these customers, knowingly doing, really feel it, the logic of it.",0.873642
20,"分裂的剧本，结尾莫名其妙。广告旅游宣传植入猖狂。三段故事有意思，无奈剧本流于段子堆砌而非真切的生活体验。李成儒像冯导自己，对雅俗的探讨是个有趣的主题但片中对雅的一味贬低令人失望。宋丹丹那段缺少创意，一味摆阔很无聊。李咏苗圃等客串的段落挺多余。所以相对最好的是范伟那段吧","Split the script, ending inexplicable. Advertising tourism propaganda rampant. Three sections of the story interesting, helpless script flow in the pile rather than the real life experience. Li Cheng-ju, like Feng guide himself, is an interesting subject to the discussion of elegance and vulgarity, but disappointment with the demeaning of Ya in the film. Song Dandan lack of ideas during that period, blindly put it very boring. Li Yong nursery and other guest passages very redundant. So the best is Fan Wei it",0.907858
20,"刚从电影院看完回来，不值得去支持票房，跟甲方乙方都有差距了，有白百合的电影都不会太好看！多给的一分是给葛大爷的~","Just finished watching from the cinema, not worth supporting the box office, with the party B has a gap, a white lily movie will not look good! Give a point is to give Grandpa Ge ~",0.757661
20,"刚开始就感觉到王朔的用心，一种小说的幻想在里面，但小说的幻想不适合电影这样具象的表达，整部电影给我一种很满的感觉，很不自然，有些时候鸡皮疙瘩掉一地。.    整部电影充斥着各种各样的产品，好像是一部有情节的广告博览会，真心不看好。","Wang Shuo's intentions were felt at the beginning, the fantasy of a novel was in it, but the fantasy of the novel was not suitable for the concrete expression of the movie. The whole film gave me a feeling of fullness, it was very unnatural, and sometimes the goose bumps One place. The whole movie is full of all kinds of products, like a plot advertising fair, really not optimistic.",0.840575
20,"创意不错，可惜整体编排很凌乱，宋丹丹那一幕不太喜欢，有些故作煽情，自后那一幕像大自然道歉更是狗尾续貂，格格不入","Creative good, but the overall arrangement is very messy, Song Dandan not like that scene, some pretending to be sensational, since the scenes like apologies for nature is a dogfight ferret, out of tune",0.741783
20,"创意好像是挺不错的 不过剧情太无聊了 除了明面上的讽刺没有任何内涵 中间几个故事完全看不下去 在电影院看肯定得睡着","Creative seems to be very good, but the story is too boring In addition to the surface of the irony there is no content in the middle of a few stories can not stand watching in the cinema must have fallen asleep",0.799487
20,"别吵着什么好看不好看好吧，这就不是电影啊","Do not clam any good looking good, this is not a movie ah",0.756926
20,"前边还行，最后难道不是小学生写作文偏题了硬要拉回来的节奏么。。。赞白百合肚皮上的肉","The front line is OK, in the end it is not the pupils writing composition problem hard to pull back rhythm it. . . Like white lily meat on the belly",0.753982
20,"前面看着还行吧，一如既往的耍嘴皮一如既往的傻乎乎，后面跑出去跟大自然一say sorry就变得莫名其妙，sorry你妹啊sorry~~~","Looked at the front of the line right, as always, fooling around, as always, ran out with the natural one say sorry becomes inexplicable, sorry your sister sorry ~ ~ ~",0.7982
20,"剧情不太好，挺不好看的。不值得去电影院看。","The plot is not very good, very bad-looking. Not worth the visit to the cinema.",0.801972
20,"剧情拼凑，全是王朔多年来的老梗，没有一点新意，表演更是乏善可陈，结尾的道歉真是莫名其妙的无法吐槽了，并不是所有讽刺和有意义的东西拍出来都是好的，两星半给笑声和一些仅剩的思考","The plot together, all Wang Shuo old stem for many years, without any new ideas, performance is lackluster, the end of the apology is really inexplicable can not Tucao, and not all satirical and meaningful things shoot out are good, two and a half stars Give laughter and some thoughts left",0.762885
20,"勉强","reluctantly",1
20,"半场离席","Halftime left",1
20,"半睡半醒之间的","Half-asleep between awake",1
20,"单位包场金宝汇，和老公一起看的。电影感觉不好，回头看到冯小刚自己也知道这部拍得不好。","Units package Campbell, and her husband to see together. The film did not feel good, looking back to Feng Xiaogang himself also know that this is not good.",0.802727
20,"印象不怎么深刻的喜剧","Impressed less comedy",1
20,"去电影院看第一遍，一脸复杂。去电影院再看一遍，说不定就会觉得好看了。看完还是一脸复杂：怎么还是不好看呢。","Go to the cinema to see the first time, a look of complex. Go to the cinema again, maybe it will look good. After reading or a look complicated: how or not look good.",0.825037
20,"去质疑雅和俗的边界就很不俗，但是下结论说什么是雅和俗就俗了。因为俗的本质是不质疑。","To question the boundaries of elegant and vulgar is very good, but concluded that what is refined and vulgar vulgar. Because the vulgar nature is not questioned.",0.795818
20,"反腐倡廉要姓福，生态保护得知足。三俗一雅唱高调，冯导你这闹哪样。若没有甲方乙方做对比，这部还算凑合能看，可如今就想问一句，接地气的冯导哪去了。三个故事各个离不开宣传国家政策，离开了暗讽逗乐也别拍成教育片，观众去看就为图一乐不是。全影片还不如最后那个笑话，以后就让葛优在那讲笑话挺好","Fight corruption and advocacy to the last name, ecological protection have enough. Three vulgar and elegant high-profile, Feng guide you to do this. If there is no comparison between Party A and Party B, this is a fair combination to see, but now I would like to ask a question, where Feng Feng went. Each of the three stories can not be separated from propaganda of national policies, left the satirical amusement do not make into educational films, the audience to see the picture is not a happy. The whole film is not as good as the last joke, let Geyou good jokes in that very good",0.827763
20,"发现漏评这部片子了。去年底专门去电影院给冯导海外市场贡献票房去的，结果大失所望——内容太碎了。三段儿里，也就范伟那部分还能看，李成儒的那段太超现实，宋丹丹的则没找好切入点。","I found this film missed the assessment. Dedicated to the cinema at the end of last year to contribute to the overseas market at Feng box office to go, the result disappointed - the content is too broken. Three sections of children, also Fan Wei that part can see, Li Chengru that period is too surreal, Song Dandan did not find a good entry point.",0.789623
20,"受不了了","Unbearable",1
20,"只有范伟的那个part好看剩下的简直看不下去 但是呢 和喜欢的人一起 看白纸都能看出花儿来 哈哈","Only Fan Wei that part looks good to see the rest simply, but like it and see the white paper can see flowers to haha",0.750783
20,"只能笑到此了~~","Can only laugh at this ~ ~",0.727474
20,"只记得夜总会的那3个小姐真的蛮好看的！！","Just remember the nightclub that 3 really nice looking! !",0.773438
20,"可以看出来导演想通过电影来对当今社会的弊端进行抨击，出发点是极好的。可是影片拍出来有一种不真实的强加感。尤其大导那段好扯啊！","It can be seen that the director wants to attack the malpractices of today's society by movie, the starting point is excellent. However, there is an untrue impression of filming. In particular, a good guide that good pull ah!",0.845661
20,"可看性不高，但是三个故事都是在解读当下人们得心态，说教育意义又有些肤浅","Can see the sex is not high, but the three stories are in the interpretation of the moment the mentality of people, said the educational significance and superficial",0.780717
20,"台词字里行间还是透露出王朔的味道。但是很抗拒王朔现在就耍个小聪明这种剧本。也是本来也不是多玄乎的，只是更高一个层次的作品我已经找不到入口了，只能黑一黑当年喜欢的人物以表没有退步。。","Lines between the lines or reveal the flavor of Wang Shuo. However, Wang Shuo very much resist the play now clever this script. Is also not much more than the original, but a higher level of work I can not find the entrance, and only black and black favorite figure to the table did not regress. .",0.773636
20,"吃老本寒心。","Chilling",1
20,"听说这电影挺烂的，于是抱着怀疑的态度走进了电影院。。果然是真的，唯一出彩的就是范伟了。电影烂是烂，但是冯导人气高啊，座无虚席，估计大部分人跟我的目的是一样的，烂也有人看，怪不得冯导骂影评人呢。你们确实是没有资格骂，但是我有啊~~","I heard that this movie is very bad, so in a skeptical manner into the cinema. . Sure enough, the only color is Fan Wei. Movie rotten is rotten, but Feng guide high popularity ah, packed, most people are estimated to be the same with my purpose, rotten also some people see, no wonder Feng guide curse critic. You really did not qualify, but I have ah ~ ~",0.818742
20,"呃","Uh",1
20,"呃，，","Uh,,",1
20,"呵呵，呵呵，呵呵呵呵","Heheheheheheheh",1
20,"呵呵呵呵呵呵呵呵","Heheheheheheheh",1
20,"和爹娘一起看的。觉得没甲方乙方好看。就色诱这点来说，甲方乙方里刘蓓甩着水袖唱着戏曲美极了，这里就只有李小璐整容脸和挤奶露肉。时代变了诶。宋丹丹篇结尾那首歌真好听喂！结尾的环保那段太突兀好做作。从片前到片尾都是广告。反正就是百度影音看才划算啊。","And father and mother look together. Party B does not feel good. On the seduction of this point, Party B Party B Liu Bei tossed the sleeves singing opera beauty very, here only Li Xiaolu cosmetic face and milky dew. Times have changed 诶. Song Dandan chapter ending song really nice to hear! End of the section of environmental protection is too sudden and contrived. From the front of the film to the end of the advertisement. Anyway, it is cost-effective to see Baidu video ah.",0.938571
20,"和麻麻在床上灰常友爱的看完的 好温馨～ 这电影我就不评价了 真是怀念当年的甲方乙方啊","And hemp in the bed often loved by the good gray sweet ~ I do not evaluate the movie really miss the year Party B Party ah",0.794149
20,"哀莫大于心死","th",1
20,"哈哈哈哈哈哈哈哈哈哈哈哈哈哈哈哈哈哈哈哈哈哈哈哈哈哈哈哈哈哈哈哈哈哈哈哈哈哈哈哈哈哈哈哈哈哈哈哈哈啊哈哈哈哈哈哈哈哈哈操哈哈哈哈哈哈哈哈哈哈哈哈哈哈哈麻痹哈哈哈哈哈哈哈哈哈哈哈哈哈哈哈哈哈哈","Ha ha ha ha ha ha ha ha ha ha ha ha ha ha ha ha ha ha ha ha ha ha ha ha ha ha ha ha ha ha ha ha ha ha ha ha ha ha ha ha ha ha ha ha ha ha ha ha ha ha ha ha ha ha ha ha ha ha ha ha ha ha ha ha ha ha ha ha ha ha ha ha ha ha ha ha ha ha ha ha ha ha ha ha ha ha ha ha ha ha ha ha ha ha ha ha ha ha ha ha ha ha ha ha ha ha ha ha ha ha ha ha ha ha ha ha",0.783703
20,"哎，我的钱啊，白花了，一点不好看，情节也不是很连贯，每个桥段里的内在连接好像也很牵强，但是刚看到票房倒是很不多，可评价很低，不值得看","Hey, my money ah, white, not look good, the plot is not very coherent, the inner link in each section seems to be very far-fetched, but just saw the box office is very small, can be evaluated very low, not worth Look",0.830491
20,"哗众取宠，为了讽刺而讽刺","Grandstanding, satirical irony",1
20,"哪里是什么电影啊，就是段子里面加广告，很明显春晚的前奏。三个段子分别是关于当官的、俗导演、中国大妈，再整一个环保的结尾，煽点情，还是冯氏喜剧，但这次没有故事，只有段子，核心还是他最擅长的，只是看不到创作的诚意。很明显这就是逗乐的俗作品，说的很明白，你乐了，我把钱挣了。","Where is the movie ah, is the paragraph inside advertising, it is clear that the prelude to the Spring Festival Gala. The three paragraphs are about the official, the popular director, the Chinese aunt, the end of an entire environment, incitement, or Feng's comedy, but this time there is no story, only the piece, the core or his best, just look Less than creative sincerity. Obviously this is an amusing, vulgar piece of work. It is very clear to say that you are happy. I earned the money.",0.884933
20,"哭笑不得","Dumbfounding",1
20,"唉，冯小刚","Alas, Feng Xiaogang",1
20,"唉，冯林嫂还是安心导春晚吧~","Alas, Fung Lin Sao or peace of mind at night it ~",0.729407
20,"唉，就范叔那段好看","Alas, it looks nice to Fan Shu",0.787333
20,"唉，看完第一小节感觉还不错的，可是后面几个段子就不是个事了，幸亏没在电影院看","Alas, I feel pretty good after reading the first bar, but behind a few paragraphs is not a problem, fortunately not in the cinema",0.766312
20,"唉，真不配叫电影~~","Oh, really not called the movie ~ ~",0.729586
20,"唉、、、","Ugh,,,",1
20,"唔……电影院的空调好足啊~~~我都淌汗了！！！暖宝宝不适合在空调房使用，真的会烫伤的~~~你说啥？电影~？我在看电影么~？……你看，我差点就被暖宝宝烫伤了~~~","Well ... cinema theater air-conditioned ah ~ ~ ~ I have sweat! ! ! Warm baby is not suitable for use in the air-conditioned room, it will really burn ~~~ you say what? Movie ~? What am I watching a movie ~? ... you see, I was almost scalded by a warm baby ~ ~ ~",0.764654
20,"啊  呸","Nonsence",1
20,"喵，真心一般~~","Meow, sincere ~ ~",0.807858
20,"回炉翻新，老套","Refurbished refurbished, stereotypes",1
20,"因为冯导语气太坚定以及对某几位影评人确实有成见...还是去看了。片子其实挺轻松，反而有些影评太累。你念着从前的好，导演却是站在过去的对立面，角度根本不同。老了，对曾经的辉煌难免又想提又不愿提，别骂了其实可怜的。","Because Feng tone is too firm and indeed for a few critics have preconceptions ... or to see it. In fact, very relaxed film, but some critics too tired. You read the past, the director is the opposite of the past, the point of view is fundamentally different. Old, inevitable to once again want to mention again do not want to mention, do not scold the fact that poor.",0.7605
20,"因为有葛大爷，外加女神白小姐，才去看的！最重要的是冯导的！总体平淡无奇！结束的安排不错！大人物就应该有这心，不能利欲熏心，其它就不顾了！","Because Ge Grandpa, plus Miss Goddess, only to see! The most important is Feng guide! Overall bland! The end of the arrangement is good! Big names should have this heart, can not be blinded, the other regardless of it!",0.747859
20,"困","sleepy",1
20,"国产，唉","Domestic, alas",1
20,"圈钱的。","Misappropriating",1
20,"土豪版的好梦一日游~~垃圾版的甲方乙方，终极垃圾版的顽主。小肛还是歇歇吧~~","Local version of the dream day trip ~ ~ garbage version of Party B, the ultimate junk version of the main. Little anal or rest it ~ ~",0.838912
20,"在一堆的爸去哪和喜羊羊中没的选择，看了这部片，果然我被恶心到了。电影的景色越来越漂亮，投资越来越大，但是导演的诚意却越来越少了。最后的道歉，是把观众当XX么？在电影院，真的看不下去真的出戏了。","In the choice of a bunch of dads and Pleasant did not see this film, and sure enough I was disgusted. The scenery of the movie is getting more and more beautiful, the investment is getting bigger and bigger, but the director's sincerity is less and less. The last apology, is the audience XX? In the cinema, really can not afford to really play out.",0.785453
20,"在一星和两星之间犹豫，最后选择两星，算是对电影中几个好演员的支持吧。..看了这个电影，感觉就像，你在参加一个人追悼会，这个人你非常尊敬。但是他突然诈尸了，尊敬什么的，瞬间没了，剩下恐惧和恶心。就是这样","Hesitating between a star and two stars, the final choice of two stars, be considered a few good actors in the movie support it. After watching this movie, I feel like you are attending a memorial service. You are very respectful to this person. But he suddenly deceive the corpse, respect what, an instant gone, leaving the fear and nausea. That's it",0.866943
20,"在五道口的狭小的三号厅，对电影院印象差对电影的印象也很差 前半部分都要睡着了 宋丹丹的部分，到了点播台播放音乐的时候 有点煽情，我觉得那首歌还不错 还有就是马青看到的一大片凹陷的草原的时候 颇有感触 原来我们的地球已经残破不堪 我们也已经残破不堪","In the narrow Wudaokou Hall 3, the poor impression on the cinema on the movie is also very poor impression of the first half asleep Song Dandan part of the on-demand stage to play music a little sensational, I think the song is not bad there Ma Qing is seen when a large depression prairie quite touched the original our Earth has been dilapidated we have also been dilapidated",0.747767
20,"在伊犁电影院和小伙伴们一起看的。有点失望，感觉没有甲方乙方出彩，三个故事的笑点和意义也原来越浅，甚至到后面我是有钱人那段都有点困顿的感觉。而且在冯小刚微博上大肆叫骂，就更对这部电影没有了好感了。为什么火气那么大，一个导演本来就该接受负面评论。同非诚勿扰二一样，真的是有失水准。","Ili theater and friends see together. A bit disappointed, I did not feel a party B out of color, the three stories of the original jokes and the meaning of the more shallow, and even to the back I was rich some feel a little sleepy. And in the Feng Xiaogang microblogging wantonly curse, even more of the movie did not feel good. Why so angry, a director should have been negative comments. If you are the same as the non-interference II, really is a loss of standard.",0.860638
20,"在电影院里坐在第一排跨越1314，过了12点就和H同学狂奔出了电影院，剩下最后部分没有看完","Sitting in the cinema in the first row across 1314, after 12 o'clock and H classmates spree out of the cinema, the rest of the last part did not finish",0.756142
20,"垃圾了","Trash",1
20,"大！烂！片！这阵容真是浪费，水平倒退到连十年前自己的作品都PK不过，剧中那些调侃用在冯导自己身上倒是颇合适。看不出最后的环保跟整个电影有什么关系，衔接都很有问题，笑点的枯燥赶上小剧场烂戏了。","Big! rotten! sheet! This lineup is really a waste of level back to even his own works PK ten years ago, however, the ridicule in the play is quite suitable for Feng himself. Can not see the last of the environmental protection has anything to do with the film, the connection is very problematic, the boring smile to catch a small theater rotten drama.",0.76305
20,"大半夜看的，越往后越看不下去，到道歉那里就出来了，有种不忍心看的感觉，就像在眼睁睁瞧着英雄垂暮！哎！！现在好电影越来越少了！还不如窝家里看泰囧呢！起码能笑出来！","Look at most of the night, the more you can not stand the more, to apologize out there, a kind of feeling can not bear to see, just watch as the hero dusk! Hey! ! Now a good movie less and less! Not as good as nest home look Thai 囧 it! At least laugh!",0.855561
20,"大失所望","Disappointed",1
20,"大失所望......","Disappointed",1
20,"大家一起来找广告吧~四个人的职位看着有意思，其实都是干一样的事——忽悠。笑点牵强，讽刺无力，结尾呼吁环保特别多余，作成彩蛋都比现在这效果好。几个故事段落唯一动人就是最后宋丹丹在车上卸妆时响起BGM，戳泪点。","We come together to find advertising it ~ four positions look interesting, in fact, are doing the same thing - Fudge. Joking point far-fetched, satirical weakness, the end of the call for special extra environmental protection, made of eggs are better than now. The only moving paragraphs of the story is the last of Song Dandan remover in the car sounded BGM, poke punctuation.",0.787987
